ACCESSION_NUMBER	OTHERMANAGER_SK	CIK	FORM13FFILENUMBER	CRDNUMBER	SECFILENUMBER	NAME
0001493152-21-024053	120659	0001543170	028-16511			SPRUCE HOUSE INVESTMENT MANAGEMENT LLC
0001352022-21-000004	120647	0001256909	028-10487			Northern Trust Investments, Inc
0001352022-21-000004	120646	0001234074	028-11833			SPRUCEGROVE INVESTMENT MANAGEMENT LTD
0001352022-21-000004	120645	0001088876	028-04841			BAILLIE GIFFORD & CO LTD
0001352022-21-000004	120644	0000885062	028-03139			BROWN CAPITAL MANAGEMENT LLC
0001352022-21-000004	120637	0001276918	028-10622			ZEVENBERGEN CAPITAL INVESTMENTS LLC
0001352022-21-000004	120642	0001164833	028-10068			HOTCHKIS & WILEY CAPITAL MANAGEMENT LLC
0001352022-21-000004	120641	0000314965	028-00096			CAPITAL GUARDIAN TRUST CO
0001352022-21-000004	120640	0000913414	028-03946			BlackRock Institutional Trust Company, N.A.
0001352022-21-000004	120639	0000902219	028-04557			WELLINGTON MANAGEMENT GROUP LLP
0001352022-21-000004	120638	0001050442	028-06630			DISCIPLINED GROWTH INVESTORS INC /MN
0001352022-21-000004	120643	0001428948	028-13410			Impax Asset Management LTD
0001768723-21-000003	120658	0001256909	028-10487			Northern Trust Investments, Inc
0001768723-21-000003	120657	0001234074	028-11833			SPRUCEGROVE INVESTMENT MANAGEMENT LTD
0001768723-21-000003	120656	0001088876	028-04841			BAILLIE GIFFORD & CO LTD
0001768723-21-000003	120655	0000885062	028-03139			BROWN CAPITAL MANAGEMENT LLC
0001768723-21-000003	120654	0001428948	028-13410			Impax Asset Management LTD
0001768723-21-000003	120653	0001164833	028-10068			HOTCHKIS & WILEY CAPITAL MANAGEMENT LLC
0001768723-21-000003	120652	0000314965	028-00096			CAPITAL GUARDIAN TRUST CO
0001768723-21-000003	120651	0000913414	028-03946			BlackRock Institutional Trust Company, N.A.
0001768723-21-000003	120650	0000902219	028-04557			WELLINGTON MANAGEMENT GROUP LLP
0001768723-21-000003	120649	0001050442	028-06630			DISCIPLINED GROWTH INVESTORS INC /MN
0001768723-21-000003	120648	0001276918	028-10622			ZEVENBERGEN CAPITAL INVESTMENTS LLC
0001012975-21-000351	95262	0001752847	028-20631			Pivotal bioVenture Partners Fund I U.G.P., Ltd
0001012975-21-000351	95261	0001844645	028-20630			Pivotal bioVenture Partners Investment Advisor LLC
0000950123-21-012428	27038		028-20837			ABG Innovation Capital Partners III GP Limited
0000950123-21-012428	27039		028-20834			Ally Bridge Group (NY) LLC
0000950123-21-012427	24575		028-20837			ABG Innovation Capital Partners III GP Limited
0000950123-21-012427	24576		028-20834			Ally Bridge Group (NY) LLC
0001457716-21-000026	26843	0001533964	028-14585			Virtu Financial LLC
0001541597-21-000004	10358	0001132597	028-17515			Itau Unibanco Holding S.A.
0001387131-21-009306	5585	0001005817	028-05097			TOMPKINS FINANCIAL CORP
0001879648-21-000010	5929	0001535847	028-15648			CWM, LLC
0001879648-21-000009	5834	0001535847	028-15648			CWM, LLC
0001879648-21-000008	2517	0001535847	028-15648			CWM, LLC
0001879648-21-000007	3641	0001535847	028-15648			CWM, LLC
0001879648-21-000006	8619	0001535847	028-15648			CWM, LLC
0001879648-21-000005	7315	0001535847	028-15648			CWM, LLC
0001879648-21-000004	3177	0001535847	028-15648			CWM, LLC
0001879648-21-000003	7016	0001535847	028-15648			CWM, LLC
0001879648-21-000002	3887	0001535847	028-15648			CWM, LLC
0001879648-21-000001	8779	0001535847	028-15648			CWM, LLC
0001085146-21-002632	7798	0001105467	028-05505			SAWGRASS ASSET MANAGEMENT LLC
0001085146-21-002632	7797	0000932859	028-04558			PARAMETRIC PORTFOLIO ASSOCIATES LLC
0000947871-21-000966	4437	0001828929				B. Metzler seel. Sohn & Co. Holding AG
0000947871-21-000965	3073	0001828929				B. Metzler seel. Sohn & Co. Holding AG
0001878849-21-000034	5620	0001018331	028-05788			NATIXIS ADVISORS, L.P.
0001878849-21-000036	3824	0001018331	028-05788			NATIXIS ADVISORS, L.P.
0001878849-21-000038	6832	0001018331	028-05788			NATIXIS ADVISORS, L.P.
0001878849-21-000037	9162	0001018331	028-05788			NATIXIS ADVISORS, L.P.
0001878849-21-000035	5031	0001018331	028-05788			NATIXIS ADVISORS, L.P.
0001062993-21-008001	9514	0001443077	028-13194			INTACT INVESTMENT MANAGEMENT INC.
0001878849-21-000033	7824	0001018331	028-05788			NATIXIS ADVISORS, L.P.
0001878849-21-000032	4008	0001018331	028-05788			NATIXIS ADVISORS, L.P.
0001878849-21-000031	10526	0001018331	028-05788			NATIXIS ADVISORS, L.P.
0001878849-21-000030	10726	0001018331	028-05788			NATIXIS ADVISORS, L.P.
0001878849-21-000029	10453	0001018331	028-05788			NATIXIS ADVISORS, L.P.
0001878849-21-000028	9872	0001018331	028-05788			NATIXIS ADVISORS, L.P.
0001878849-21-000027	7572	0001018331	028-05788			NATIXIS ADVISORS, L.P.
0001878849-21-000026	8475	0001018331	028-05788			NATIXIS ADVISORS, L.P.
0001878849-21-000025	5924	0001018331	028-05788			NATIXIS ADVISORS, L.P.
0001878849-21-000024	4424	0001018331	028-05788			NATIXIS ADVISORS, L.P.
0001878849-21-000023	8433	0001018331	028-05788			NATIXIS ADVISORS, L.P.
0001878849-21-000022	2283	0001018331	028-05788			NATIXIS ADVISORS, L.P.
0001878849-21-000021	5604	0001018331	028-05788			NATIXIS ADVISORS, L.P.
0001878849-21-000020	4503	0001018331	028-05788			NATIXIS ADVISORS, L.P.
0001878849-21-000019	8193	0001018331	028-05788			NATIXIS ADVISORS, L.P.
0001878849-21-000018	2997	0001018331	028-05788			NATIXIS ADVISORS, L.P.
0001878849-21-000017	6394	0001018331	028-05788			NATIXIS ADVISORS, L.P.
0001878849-21-000016	6905	0001018331	028-05788			NATIXIS ADVISORS, L.P.
0001878849-21-000015	10765	0001018331	028-05788			NATIXIS ADVISORS, L.P.
0001878849-21-000014	10175	0001018331	028-05788			NATIXIS ADVISORS, L.P.
0001878849-21-000013	6819	0001018331	028-05788			NATIXIS ADVISORS, L.P.
0001878849-21-000012	7769	0001018331	028-05788			NATIXIS ADVISORS, L.P.
0000950123-21-011883	8062		028-10368			DIFA
0000950123-21-011883	8061		028-10904			Janus Henderson Group Plc
0000950123-21-011883	8072		028-04139			Eaton Vance Management
0000950123-21-011883	8071		028-04490			Vontobel Asset Management, Inc.
0000950123-21-011883	8063		028-10562			AllianceBernstein L.P.
0000950123-21-011883	8070		028-00115			T. Rowe Price Associates, Inc.
0000950123-21-011883	8065		028-11197			Cohen & Steers Capital Management, Inc.
0000950123-21-011883	8066		028-10981			Goldman Sachs Asset Management, L.P.
0000950123-21-011883	8067		028-04968			MFS Investment Management
0000950123-21-011883	8068		028-03432			Morgan Stanley Investment Management, Inc.
0000950123-21-011883	8069		028-00399			SSgA Funds Management, Inc.
0000950123-21-011883	8064		028-01091			American Century Investment Management, Inc.
0001878849-21-000010	6203	0001018331	028-05788			NATIXIS ADVISORS, L.P.
0001878849-21-000009	8221	0001018331	028-05788			NATIXIS ADVISORS, L.P.
0001878849-21-000011	4454	0001018331	028-05788			NATIXIS ADVISORS, L.P.
0001878849-21-000007	9229	0001018331	028-05788			NATIXIS ADVISORS, L.P.
0001878849-21-000008	10162	0001018331	028-05788			NATIXIS ADVISORS, L.P.
0001878849-21-000006	6040	0001018331	028-05788			NATIXIS ADVISORS, L.P.
0001878849-21-000005	10686	0001018331	028-05788			NATIXIS ADVISORS, L.P.
0001878849-21-000004	10390	0001018331	028-05788			NATIXIS ADVISORS, L.P.
0001878849-21-000003	7817	0001018331	028-05788			NATIXIS ADVISORS, L.P.
0001878849-21-000002	9060	0001018331	028-05788			NATIXIS ADVISORS, L.P.
0001567619-21-016318	5642	0001080117	028-04321			HEITMAN REAL ESTATE SECURITIES LLC
0001606587-21-001246	10072	0000312272	028-18352			Commonwealth Equity Services, LLC
0001606587-21-001245	2706	0000312272	028-18352			Commonwealth Equity Services, LLC
0001606587-21-001242	5639	0000312272	028-18352			Commonwealth Equity Services, LLC
0001567619-21-016308	6843	0001080117	028-04321			HEITMAN REAL ESTATE SECURITIES LLC
0000949509-21-000019	7610	0001692234	028-17598			Russell Investments Group, Ltd.
0000949509-21-000019	7611	0001597857	028-17875			Hartree Partners, LP
0001580642-21-003941	6419	0001846208	028-21357			Mariner Platform Solutions, LLC
0001262124-21-000012	6297	0001692234	028-17598			Russell Investments Group, Ltd.
0001524828-21-000013	3615	0001381954	028-14613			Tieton Capital Management, LLC
0001524828-21-000013	3614	0001026710	028-05876			GRANAHAN INVESTMENT MANAGEMENT INC/MA
0001524828-21-000013	3613	0001027796	028-03791			PZENA INVESTMENT MANAGEMENT LLC
0001524828-21-000013	3612	0000921531	028-04886			GLOBEFLEX CAPITAL L P
0001524828-21-000013	3604	0001388167	028-12126			ClariVest Asset Management LLC
0001524828-21-000013	3605	0001568555	028-15158			Monarch Partners Asset Management LLC
0001524828-21-000013	3606	0001591546				Pacific Ridge Capital Partners, LLC
0001524828-21-000013	3607	0001319691	028-11311			Ranger Investment Management, L.P.
0001524828-21-000013	3608	0001444055	028-16516			JCSD Capital, LLC
0001524828-21-000013	3609	0000820289	028-01346			FRIESS ASSOCIATES LLC
0001524828-21-000013	3610	0001483339	028-13672			Walthausen & Co., LLC
0001524828-21-000013	3611	0001740837	028-19044			AltraVue Capital, LLC
0001524828-21-000013	3617	0001761269				Plaisance Capital LLC
0001524828-21-000013	3616	0000919859				MACKENZIE FINANCIAL CORP
0001740837-21-000011	2121	0001524828	028-16461			Acuitas Investments, LLC
0001740837-21-000011	2122	0001442641	028-13158			Legato Capital Management LLC
0001740837-21-000010	8370	0001442641	028-13158			Legato Capital Management LLC
0001740837-21-000010	8369	0001524828	028-16461			Acuitas Investments, LLC
0001740837-21-000009	6568	0001524828	028-16461			Acuitas Investments, LLC
0001740837-21-000009	6569	0001442641	028-13158			Legato Capital Management LLC
0001740837-21-000008	8271	0001442641	028-13158			Legato Capital Management LLC
0001740837-21-000008	8270	0001524828	028-16461			Acuitas Investments, LLC
0001398344-21-016691	5440	0001565951	028-18238			DC Investments Management, LLC
0001172661-21-001902	5758	0001635409	028-17227			Harbor Spring Capital, LLC
0001172661-21-001901	5055	0001698819	028-18327			Covalis Capital LLP
0001172661-21-001899	3156	0001698819	028-18327			Covalis Capital LLP
0001524828-21-000011	3734	0001388167	028-12126			ClariVest Asset Management LLC
0001524828-21-000011	3735	0001568555	028-15158			Monarch Partners Asset Management LLC
0001524828-21-000011	3736	0001591546				Pacific Ridge Capital Partners, LLC
0001524828-21-000011	3737	0001319691	028-11311			Ranger Investment Management, L.P.
0001524828-21-000011	3738	0001444055	028-16516			JCSD Capital, LLC
0001524828-21-000011	3739	0000820289	028-01346			FRIESS ASSOCIATES LLC
0001524828-21-000011	3747	0001761269				Plaisance Capital LLC
0001524828-21-000011	3741	0001740837	028-19044			AltraVue Capital, LLC
0001524828-21-000011	3742	0000921531	028-04886			GLOBEFLEX CAPITAL L P
0001524828-21-000011	3743	0001027796	028-03791			PZENA INVESTMENT MANAGEMENT LLC
0001524828-21-000011	3744	0001026710	028-05876			GRANAHAN INVESTMENT MANAGEMENT INC/MA
0001524828-21-000011	3745	0001381954	028-14613			Tieton Capital Management, LLC
0001524828-21-000011	3746	0000919859				MACKENZIE FINANCIAL CORP
0001524828-21-000011	3740	0001483339	028-13672			Walthausen & Co., LLC
0001878849-21-000001	3107	0001018331	028-05788			NATIXIS ADVISORS, L.P.
0000950123-21-011726	8318		28-00545			Thrivent Financial for Lutherans
0000950123-21-011725	8808		28-00545			Thrivent Financial for Lutherans
0000950123-21-011723	9270		28-00545			Thrivent Financial for Lutherans
0000950123-21-011718	3123		28-00545			Thrivent Financial for Lutherans
0000950123-21-011717	7715		28-00545			Thrivent Financial for Lutherans
0001418812-21-000051	7558	0001351069				ValueAct Capital Management, L.P.
0001569638-21-000004	2351	0001730083	028-18427			M Financial Asset Management, Inc.
0001730083-21-000003	7318	0001569638	028-15330			M Holdings Securities, Inc.
0001172661-21-001895	2070	0000922940	028-04057			M.D. SASS INVESTORS SERVICES, INC.
0001632574-21-000007	4014	0001632574	028-16549			Ward Ferry Management (BVI) Ltd
0001812046-21-000084	5243	0001565432	028-15127			Selkirk Management LLC
0001580642-21-003828	8761	0001373442	028-13550			Mariner, LLC
0001178913-21-002750	4626	0001496201	028-15863			SPHERA FUNDS MANAGEMENT LTD.
0001178913-21-002748	6441	0001496201	028-15863			SPHERA FUNDS MANAGEMENT LTD.
0001593387-21-000005	8821		028-15454			Advisory Services Network, LLC
0001593387-21-000005	8822		028-18893			Foundations Investment Advisors, LLC
0001593387-21-000005	8823		028-19093			TrinityPoint Wealth, LLC
0001593387-21-000005	8824		028-20168			Transcend Wealth Collective, LLC
0001593387-21-000005	8825		028-18760			Change Path, LLC
0001593387-21-000005	8826		028-19206			Aspire Private Capital, LLC
0000950123-21-011621	8077		028-05050			Oaktree Capital Management, L.P.
0000950123-21-011607	8266		028-14349			Brookfield Asset Management Inc.
0001138420-21-000005	7360	0001583825	028-15599			Lone Star Global Acquisitions, Ltd.
0001172661-21-001888	6099	0001352924	028-15101			Caledonia (Private) Investments Pty Ltd
0000950123-21-011625	5695		028-05050			Oaktree Capital Management, L.P.
0001162695-21-000004	5728	0000061227	028-00046			MACKAY SHIELDS LLC
0001567619-21-015943	5132	0000914208	028-11246			Invesco Ltd.
0000950123-21-011601	5234		028-14349			Brookfield Asset Management Inc.
0000950123-21-011616	4207		028-05050			Oaktree Capital Management, L.P.
0001687502-21-000006	5369	0001583825	028-15599			Lone Star Global Acquisitions, Ltd.
0000950123-21-011623	3963		028-05050			Oaktree Capital Management, L.P.
0000950123-21-011606	3979		028-14349			Brookfield Asset Management Inc.
0001167376-21-000018	4011	0001469589	028-13619			Q Global Advisors, LLC
0001567619-21-015939	3634	0000914208	028-11246			Invesco Ltd.
0001167376-21-000016	3093	0001469589	028-13619			Q Global Advisors, LLC
0001167376-21-000016	3094	0001167376	028-10108			Scepter Holdings, Inc.
0000950123-21-011602	3540		028-14349			Brookfield Asset Management Inc.
0000950123-21-011596	2777		028-05050			Oaktree Capital Management, L.P.
0000950123-21-011596	2778		028-21340			Oaktree Fund Advisors, LLC
0000950123-21-011609	2024		028-14349			Brookfield Asset Management Inc.
0001697892-21-000005	8762	0001583825	028-15599			Lone Star Global Acquisitions, Ltd.
0000950123-21-011622	2288		028-05050			Oaktree Capital Management, L.P.
0001167376-21-000017	9883	0001167376	028-10108			Scepter Holdings, Inc.
0000950123-21-011605	9817		028-14349			Brookfield Asset Management Inc.
0001405086-21-000229	3092	0001749824	028-19277			INHERENT GROUP, LP
0001297254-21-000010	2702					WESTWOOD HOLDINGS GROUP INC.
0001607761-21-000012	8142					WESTWOOD HOLDINGS GROUP INC.
0000861177-21-000011	2460		028-13826			BROOKFIELD SECURITIES GROUP LLC
0000861177-21-000011	2461		028-05582			FIRST QUADRANT LP
0000861177-21-000011	2462		028-14114			HUBER CAPITAL MANAGEMENT, LLC
0000861177-21-000011	2463		028-16230			JACKSON SQUARE PARTNERS LLC
0000861177-21-000011	2464		028-11937			J.P. MORGAN INVESTMENT MANAGEMENT, INC.
0000861177-21-000011	2465		028-05792			KAYNE ANDERSON RUDNICK INVESTMENT MANAGEMENT, LLC
0000861177-21-000011	2466		028-10229			LOS ANGELES CAPITAL MANAGEMENT AND EQUITY RESEARCH, INC.
0000861177-21-000011	2467		028-13243			MAR VISTA INVESTMENT PARTNERS, LLC
0000861177-21-000011	2468		028-11450			MONDRIAN INVESTMENT PARTNERS LIMITED
0000861177-21-000011	2469		028-17085			NEUBERGER BERMAN INVESTMENT ADVISERS LLC
0000861177-21-000011	2470		028-10594			NOMURA CORPORATE RESEARCH AND ASSET MANAGEMENT INC.
0000861177-21-000011	2471		028-12690			PCJ INVESTMENT COUNSEL LTD
0000861177-21-000011	2472		028-10952			PACIFIC INVESTMENT MANAGEMENT COMPANY LLC
0000861177-21-000011	2473		028-03791			PZENA INVESTMENT MANAGEMENT, LLC
0000861177-21-000011	2474		028-05655			RIVERBRIDGE PARTNERS, LLC
0000861177-21-000011	2475		028-01911			ROBERT W. BAIRD & CO. INCORPORATED (CHAUTAUQUA CAPITAL MANAGEMENT, LLC)
0000861177-21-000011	2476		028-17843			SAPIENCE INVESTMENTS LLC
0000861177-21-000011	2477		028-05369			SIRIOS CAPITAL MANAGEMENT L.P.
0000861177-21-000011	2478		028-17022			WILLIAM BLAIR & COMPANY L.L.C.
0000861177-21-000011	2479		028-17689			KETTLE HILL CAPITAL MANAGEMENT, LLC
0000861177-21-000011	2480		028-13391			NOMURA ASSET MANAGEMENT SINGAPORE LTD.
0000861177-21-000011	2481		028-03059			JACOBS LEVY EQUITY MANAGEMENT, INC.
0000861177-21-000011	2482		028-04413			WELLS CAPITAL MANAGEMENT, INC.
0000861177-21-000011	2483		028-02900			MELLON INVESTMENTS CORP
0000861177-21-000011	2484		028-11166			CALAMOS ADVISORS
0000861177-21-000011	2485		028-19400			RWC ASSET ADVISORS (US) LLC
0000861177-21-000011	2486		028-17749			DLD ASSET MANAGEMENT, L.P.
0000861177-21-000011	2487		028-02682			MAGNETAR ASSET MANAGEMENT, LLC
0000861177-21-000011	2488		028-15430			ARGA INVESTMENT MANAGEMENT LP
0000861177-21-000011	2489		028-16899			WELLINGTON MANAGEMENT CO.
0000861177-21-000011	2490		028-04968			MASSACHUSETTS FINANCIAL SERVICES CO.
0000861177-21-000011	2491		028-13578			ARTISAN PARTNERS LIMITED PARTNERSHIP
0000861177-21-000011	2458		028-06609			AVIVA INVESTORS AMERICAS LLC
0000861177-21-000011	2459		028-04293			BLACKROCK FINANCIAL MANAGEMENT
0001398053-21-000006	3535		28-13438			Apollo Management Holdings, L.P.
0000949471-21-000010	8220					WESTWOOD HOLDINGS GROUP INC.
0001607760-21-000011	7576					WESTWOOD HOLDINGS GROUP INC.
0001456421-21-000008	5574		28-13438			Apollo Management Holdings, L.P.
0000950123-21-011585	6282		28-13114			The Blackstone Group Inc.
0000950123-21-011583	6412		28-13114			The Blackstone Group Inc.
0001578621-21-000005	4924					LMR Partners LLC
0001578621-21-000005	4925					LMR Partners Limited
0000950123-21-011582	3289		28-13114			The Blackstone Group Inc.
0000950123-21-011581	7566		28-13114			The Blackstone Group Inc.
0001567619-21-015931	10040	0001599822	028-16027			Point72 Hong Kong Ltd
0001567619-21-015931	10039	0001603465	028-16258			Cubist Systematic Strategies, LLC
0001567619-21-015931	10041	0001698051	028-17887			Point72 Europe (London) LLP
0001398344-21-016347	3875		028-05637			ADVISORY RESEARCH, INC.
0001398344-21-016347	3874		028-06668			OAK RIDGE INVESTMENTS LLC
0001398344-21-016347	3873		028-10860			ALGERT GLOBAL LLC
0001398344-21-016347	3876		028-18686			RED CEDAR INVESTMENT MANAGEMENT, LLC
0001398344-21-016347	3878		028-21352			NSI Retail Advisors, LLC
0001398344-21-016347	3877		028-10104			ALTRINSIC GLOBAL ADVISOR, LLC
0001512948-21-000003	4440	0001105838	028-10843			ROBOTTI ROBERT
0000950123-21-011577	8524		28-13114			The Blackstone Group Inc.
0000950123-21-011575	9880		28-13114			The Blackstone Group Inc.
0000950123-21-011574	7375		28-13114			The Blackstone Group Inc.
0000950123-21-011570	3921		28-13114			The Blackstone Group Inc.
0001595888-21-000020	3623	0001595888	028-16162			JANE STREET GROUP, LLC
0001172661-21-001885	4263	0001642575	028-16923			Squarepoint Ops LLC
0001595888-21-000019	9498	0001595888	028-16162			JANE STREET GROUP, LLC
0001595888-21-000018	4880	0001595888	028-16162			JANE STREET GROUP, LLC
0000950123-21-011563	8625		028-05810			UNITED SERVICES AUTOMOBILE ASSOCIATION
0001595888-21-000017	8962	0001595888	028-16162			JANE STREET GROUP, LLC
0000919574-21-005430	3570	0001317588	028-11161			ABRAMS BISON INVESTMENTS, LLC
0001724134-21-000004	4874	0001733173	028-18796			Howard Capital Management Inc.
0001724134-21-000004	4872	0000897378	028-03434			CONGRESS ASSET MANAGEMENT CO /MA
0001724134-21-000004	4877	0001078635	028-11829			WINDWARD CAPITAL MANAGEMENT CO /CA
0001724134-21-000004	4876	0001702435	028-18145			Donoghue Forlines LLC
0001724134-21-000004	4875	0001551787	028-16629			Sterling Global Strategies LLC
0001724134-21-000004	4873	0001426940	028-12835			Horizon Investment Services, LLC
0001567619-21-015918	6950	0000070858	028-00158			BANK OF AMERICA CORP /DE/
0000939334-21-000020	5638	0000939334	028-12645			RIT CAPITAL PARTNERS PLC
0001012975-21-000324	5832	0001586986	028-16049			Electron Capital Partners, LLC
0001567619-21-015915	9231	0000070858	028-00158			BANK OF AMERICA CORP /DE/
0001567619-21-015912	8320	0000070858	028-00158			BANK OF AMERICA CORP /DE/
0001012975-21-000323	4442	0001586986	028-16049			Electron Capital Partners, LLC
0001567619-21-015907	10748	0000070858	028-00158			BANK OF AMERICA CORP /DE/
0000902664-21-003903	7446	0001762304	028-19395			HHLR ADVISORS, LTD.
0001012975-21-000322	4992	0001586986	028-16049			Electron Capital Partners, LLC
0000869772-21-000004	7550	0000869772	028-02805			SECURITY BENEFIT LIFE INSURANCE CO /KS/
0001567619-21-015902	2336	0000070858	028-00158			BANK OF AMERICA CORP /DE/
0000950123-21-011556	5821		028-14321			Coliseum Capital Management, LLC
0001567619-21-015899	8771	0000070858	028-00158			BANK OF AMERICA CORP /DE/
0001772593-21-000006	5694	0001771067	028-20737			Builders Union LLP
0001172661-21-001878	7317	0001079114	028-07484			GREENLIGHT CAPITAL INC
0001567619-21-015897	9515	0001702490	028-18498			Deer Park Road Corp
0001607637-21-000003	8015	0001353316	028-11815			Hound Partners, LLC
0001172661-21-001877	7532	0001079114	028-07484			GREENLIGHT CAPITAL INC
0001567619-21-015895	6801	0000070858	028-00158			BANK OF AMERICA CORP /DE/
0001172661-21-001876	8196	0001079114	028-07484			GREENLIGHT CAPITAL INC
0000950123-21-011547	8796		028-14321			Coliseum Capital Management, LLC
0001567619-21-015891	3631	0001702490	028-18498			Deer Park Road Corp
0001418812-21-000049	9239	0001351069				ValueAct Capital Management, L.P.
0001085146-21-002606	2987	0001004244	028-05194			NEW ENGLAND ASSET MANAGEMENT INC
0001482756-21-000013	9203		028-13645			Enterprise Financial Services Corp
0001567619-21-015890	6135	0000070858	028-00158			BANK OF AMERICA CORP /DE/
0001172661-21-001873	7608	0001281446	028-11743			GREAT POINT PARTNERS LLC
0001172661-21-001870	10388	0001281446	028-11743			GREAT POINT PARTNERS LLC
0001567619-21-015886	7279	0001702490	028-18498			Deer Park Road Corp
0001012975-21-000318	8534	0001319998	028-11745			Southpoint Capital Advisors LP
0001178913-21-002736	3939	0001603837	028-16590			Ion Asset Management Ltd.
0001567619-21-015884	9137	0000070858	028-00158			BANK OF AMERICA CORP /DE/
0001567619-21-015882	10825	0001127799	028-17038			Zurich Insurance Group Ltd/FI
0001567619-21-015880	6153	0001035674	028-10010			PAULSON & CO. INC.
0001085146-21-002600	5963	0001167456	028-10114			CNH PARTNERS LLC
0001827733-21-000003	2683	0001353316	028-11815			Hound Partners, LLC
0001012975-21-000317	6233	0001319998	028-11745			Southpoint Capital Advisors LP
0001082045-21-000007	3202	0000003520	028-00869			FRED ALGER MANAGEMENT, LLC
0001178913-21-002734	3429	0001603837	028-16590			Ion Asset Management Ltd.
0001085146-21-002599	5238	0001167557	028-10120			AQR CAPITAL MANAGEMENT LLC
0001085146-21-002599	5239	0001167456	028-10114			CNH PARTNERS LLC
0000950123-21-011541	3120		028-02610			RBS Partners, L.P.
0000950123-21-011539	10418		28-14388			BDT Capital Partners, LLC
0001012975-21-000316	10413	0001319998	028-11745			Southpoint Capital Advisors LP
0001172661-21-001864	4403	0001728850				LSP Investment Advisors, LLC
0000950159-21-000258	4423	0001009258	028-05366			DEERFIELD MANAGEMENT COMPANY, L.P. (SERIES C)
0001172661-21-001861	2516	0001541901	028-15266			Encompass Capital Advisors LLC
0000950123-21-011534	3905		028-16271			SV Health Investors, LLC
0001606587-21-001234	2785	0001626982	028-16938			FormulaFolio Investments, LLC
0001606587-21-001234	2786	0001840565	028-20549			Baker Tilly Wealth Management, LLC
0001567619-21-015866	7146	0001791786	028-20282			Elliott Investment Management L.P.
0000921895-21-002115	6591	0001056807	028-06800			BVF INC/IL
0001375836-21-000003	6465	0001353316	028-11815			Hound Partners, LLC
0000950123-21-011529	2857		028-13627			Sculptor Capital II LP
0000950123-21-011527	10820		028-16271			SV Health Investors, LLC
0001172661-21-001857	7319	0001541901	028-15266			Encompass Capital Advisors LLC
0001085146-21-002598	3829	0001637460	028-18778			Man Group plc
0001085146-21-002598	3830	0001692234	028-17598			Russell Investments Group, Ltd.
0001012975-21-000315	7373	0001319998	028-11745			Southpoint Capital Advisors LP
0001567619-21-015865	2685	0001791786	028-20282			Elliott Investment Management L.P.
0001085146-21-002597	4522	0001692234	028-17598			Russell Investments Group, Ltd.
0001085146-21-002596	5112	0001637460	028-18778			Man Group plc
0001085146-21-002596	5113	0001352261	028-11672			GLG LLC
0001085146-21-002595	5541	0001637460	028-18778			Man Group plc
0001085146-21-002595	5542	0001289643	028-10979			GLG Partners LP
0000950123-21-011505	10488		28-20812			Bain Capital Partners XII, LLC
0000950123-21-011505	10489		28-20813			Bain Capital Fund XII, L.P.
0000950123-21-011519	9985		28-18477			Bain Capital Life Sciences Investors, LLC
0000950123-21-011503	6940		28-11185			Bain Capital Investors, LLC
0000950123-21-011503	6941		28-15506			Bain Capital Partners X, L.P.
0000950123-21-011514	7150		28-18477			Bain Capital Life Sciences Investors, LLC
0000950123-21-011514	7151		28-20816			Bain Capital Life Sciences Investors II, LLC
0000950123-21-011504	8144		28-11185			Bain Capital Investors, LLC
0000950123-21-011504	8145		28-16250			Bain Capital Partners Europe III, L.P.
0000950123-21-011504	8146		28-16251			Bain Capital Europe Fund III, L.P.
0000950123-21-011504	8147		28-15506			Bain Capital Partners X, L.P.
0000950123-21-011504	8148		28-15509			Bain Capital Fund X, L.P.
0000950123-21-011504	8149		28-16793			Atalaya Luxco S.a.r.l.
0000950123-21-011499	8675		28-11185			Bain Capital Investors, LLC
0000950123-21-011499	8676		28-20812			Bain Capital Partners XII, LLC
0000950123-21-011496	8810		28-11185			Bain Capital Investors, LLC
0000950123-21-011496	8811		28-20812			Bain Capital Partners XII, LLC
0000950123-21-011496	8812		28-20813			Bain Capital Fund XII, L.P.
0000950123-21-011496	8813		28-20811			BCPE Perception GP, LLC
0000950123-21-011500	9237		28-11185			Bain Capital Investors, LLC
0000950123-21-011508	10179		28-13588			Bain Capital Venture Investors, LLC
0000950123-21-011508	10180		28-19238			Bain Capital Venture Coinvestment Partners,  LP
0000950123-21-011495	10079		28-11185			Bain Capital Investors, LLC
0000950123-21-011495	10080		28-16250			Bain Capital Partners Europe III, L.P.
