0001567619-21-020282	7	0001688390	028-21334			ICONIQ Strategic Partners GP, L.P.
0000950123-21-015379	2		028-04037			Amundi Asset Management US, Inc.
0000950123-21-015379	12		028-13048			KBI Global Investors Ltd
0000950123-21-015379	1		028-11419			Amundi Asset Management
0000950123-21-015379	13		028-13513			KBI Global Investors (North America) Ltd
0000950123-21-015379	3		028-13935			Morgan Stanley Smith Barney LLC
0000950123-21-015379	4		028-17736			AMUNDI AUSTRIA GMBH
0000950123-21-015379	5		028-18672			Amundi Czech Republic Asset Management AS
0000950123-21-015379	6		028-18597			Amundi Deutschland GmbH
0000950123-21-015379	7		028-17737			AMUNDI HONG KONG LTD
0000950123-21-015379	8		028-13721			Amundi Japan Ltd.
0000950123-21-015379	10		028-11415			CPR Asset Management
0000950123-21-015379	11		028-13717			SOCIETE GENERALE GESTION
0000947871-21-001186	2	0001698089	028-17928			Yorktown XI Co LP
0000947871-21-001186	1	0001687163	028-17865			Yorktown XI Associates LLC
0001624758-21-000010	1	0000059546	028-21251			LINCOLN INVESTMENT PLANNING, LLC
0001593324-21-000004	6	0001748860				Beyond Advisors IC
0001593324-21-000004	1	0001457320				EXCHANGE TRADED CONCEPTS, LLC
0001593324-21-000004	3	0001633061				Amplify ETF Trust
0001593324-21-000004	8	0001518042				NORTHERN LIGHTS FUND TRUST II
0001593324-21-000004	7	0001727398				Procure ETF Trust II
0001593324-21-000004	2	0001599368				Innovator Management LLC
0001593324-21-000004	5	0001732541				Defiance ETFs, LLC
0001593324-21-000004	4	0001756985				Hoya Capital Real Estate, LLC
0000947871-21-001185	2	0001688467	028-17862			Yorktown X Co LP
0000947871-21-001185	1	0001687161	028-17863			Yorktown X Associates LLC
0001389933-21-000011	1	0001389932	028-12328			Fischel Nathan
0000093751-21-000697	2	0001257442	028-11338			SSGA FUNDS MANAGEMENT INC
0000093751-21-000697	20	0001714343	028-18135			State Street Global Advisors Trust Co
0000093751-21-000697	19	0001520010	028-14459			State Street Global Advisors Europe Ltd
0000093751-21-000697	12	0001324598	028-11331			State Street Global Advisors Asia LTD
0000093751-21-000697	11	0001324599	028-18493			State Street Global Advisors Singapore LTD
0000093751-21-000697	10	0001324600	028-11332			State Street Global Advisors (Japan) Co., Ltd.
0000093751-21-000697	8	0001324595	028-11330			State Street Global Advisors, Australia
0000093751-21-000697	6	0001324601	028-11327			State Street Global Advisors Ltd.
0000093751-21-000697	5	0001324602	028-11326			State Street Global Advisors LTD
0000093751-21-000697	1	0000093748	028-00733			STATE STREET BANK & TRUST CO
0001567619-21-020275	28	0001552332	028-17873			Dickerman Ronald
0000947871-21-001184	2	0001689134	028-17867			Yorktown IX Co LP
0000947871-21-001184	1	0001526187	028-17866			Yorktown IX Associates LLC
0001445546-21-005665	1	0001145263	028-06683			TCW INVESTMENT MANAGEMENT Co LLC
0001445546-21-005665	4	0001560717	028-15165			Horizon Investments, LLC
0001445546-21-005665	3	0001536185	028-14633			Equitable Investment Management Group, LLC
0001445546-21-005665	2	0001469751	028-13577			RiverFront Investment Group, LLC
0000947871-21-001183	1	0001473117	028-17367			Yorktown VIII Associates LLC
0000947871-21-001183	2	0001473118	028-17372			Yorktown VIII Co LP
0001420506-21-001683	1	0001803213	028-20014			AmFam Holdings, Inc.
0001420506-21-001683	2	0000351040	028-00997			AMERICAN FAMILY MUTUAL INSURANCE COMPANY, S.I.
0001567619-21-020268	2	0001267311	028-14274			ASHMORE INVESTMENT MANAGEMENT LTD
0001567619-21-020268	1	0001631277	028-16677			ASHMORE INVESTMENT ADVISORS LTD.
0001567619-21-020268	3	0000073124	028-00290			NORTHERN TRUST CORP
0000947871-21-001182	1	0001423201	028-17370			Yorktown VII Associates LLC
0000947871-21-001182	2	0001423200	028-17365			Yorktown VII CO LP
0000919574-21-007094	4	0001774696	028-20094			Samlyn Net Neutral Master Fund, Ltd.
0000919574-21-007094	1	0001393721	028-12828			SAMLYN ONSHORE FUND, LP
0000919574-21-007094	5	0001844766	028-20927			Samlyn Long Alpha Master Fund, Ltd.
0000919574-21-007094	3	0001446441	028-13210			Samlyn Partners, LLC
0000919574-21-007094	2	0001453676	028-13310			Samlyn Offshore Master Fund, Ltd.
0001172661-21-002270	1	0001169486	028-14109			TOKIO MARINE HOLDINGS, INC.
0000947871-21-001181	2	0001731600	028-18647			Yorktown VI Co LP
0000947871-21-001181	1	0001347608	028-18544			Yorktown VI Associates LLC
0001533421-21-000006	2	0001533423	028-15418			Latour Trading LLC (Latour)
0001533421-21-000006	1	0001569605	028-15417			Tower Research Capital Investments LLC
0001567619-21-020262	6	0001697619	028-17961			Union Investment Privatfonds GmbH
0001567619-21-020262	5	0001697816	028-17959			Union Investment Institutional GmbH
0001567619-21-020262	3	0001575710	028-17957			UNION ASSET MANAGEMENT HOLDING AG
0001567619-21-020262	2	0001695960	028-17956			IPConcept (Luxemburg) S.A.
0001567619-21-020262	8	0001655374	028-17963			Quoniam Asset Management GmbH
0001567619-21-020262	1	0001694893	028-17955			DZ PRIVATBANK S.A.
0001567619-21-020262	7	0001697554	028-17962			BEA Union Investment Management Ltd.
0001172661-21-002260	1	0001633019	028-17204			Capula Investment US LP
0001172661-21-002260	2	0001351450	028-17757			Capula Investment Management LLP
0001172661-21-002257	1	0001756558	028-20965			XN LP
0001104659-21-138946	1	0000859804	028-05973			WEDGEWOOD PARTNERS INC
0001104659-21-138946	2	0001517133	028-20771			Cohanzick Management, LLC
0001104659-21-138945	1	0001692234	028-17598			Russell Investments Group, Ltd.
0000950123-21-015330	3		028-15373			DST Managers Ltd
0000950123-21-015330	2		028-17317			DST Global Advisors Ltd
0000950123-21-015330	1		028-18613			Cardew Services Ltd
0001172661-21-002250	1	0001409705	028-14591			Lakewood Capital Partners, LP
0001172661-21-002250	2	0001534288	028-14592			Lakewood Capital Advisors, LLC
0000950123-21-015324	2		028-18610			Orland Properties Ltd
0000950123-21-015324	1		028-18606			Newton (PTC) Ltd
0000950123-21-015317	1					Milky Way Investments Limited
0001398344-21-021522	2		028-00290			Northern Trust Corp
0001398344-21-021522	1		028-12230			ALPS ADVISORS INC
0001731509-21-000005	1	0001730859	028-18611			SB INVESTMENT ADVISERS (US) INC.
0001434819-21-000008	1	0000918509	028-04817			STICHTING PENSIOENFONDS ABP
0001434819-21-000008	2	0001434820	028-13073			APG Group
0001599793-21-000005	1	0001509874	028-20970			Corbin Capital Partners, L.P.
0001754960-21-000212	2	0001078635	028-11829			WINDWARD CAPITAL MANAGEMENT CO /CA
0001754960-21-000212	9	0001551787	028-16629			Sterling Global Strategies LLC
0001754960-21-000212	8	0001733173	028-18796			Howard Capital Management Inc.
0001754960-21-000212	4	0001426940	028-12835			Horizon Investment Services, LLC
0001754960-21-000212	1	0000897378	028-03434			CONGRESS ASSET MANAGEMENT CO /MA
0001422848-21-000180	1		028-00218			CAPITAL GROUP COMPANIES INC
0001422848-21-000180	2		028-00157			CAPITAL RESEARCH & MANAGEMENT CO
0000950123-21-015297	2		028-10477			Columbia Management Investment Advisers, LLC
0000950123-21-015297	3		028-10458			Ameriprise Trust Co
0000950123-21-015297	4		028-00140			Ameriprise Certificate Co
0000950123-21-015297	5		028-00143			RiverSource Life Insurance Co
0000950123-21-015297	6		028-10460			RiverSource Life Insurance Co of New York
0000950123-21-015297	10		028-10644			Threadneedle Asset Management Holdings LTD
0000950123-21-015297	16		028-14918			Ameriprise Financial Services, LLC
0000950123-21-015297	17		028-03639			Columbia Wanger Asset Management, LLC
0000950123-21-015297	18		028-18942			Ameriprise Bank, FSB
0001606587-21-001624	2	0001504665	028-18973			DFPG INVESTMENTS, LLC
0001606587-21-001624	1	0001758171	028-19380			Capita Financial Network
0001323255-21-000017	1	0000918509	028-04817			STICHTING PENSIOENFONDS ABP
0001323255-21-000017	3	0001434819	028-13074			APG Asset Management N.V.
0001323255-21-000017	2	0001434820	028-13073			APG Group
0000902664-21-004952	1	0001511305	028-15284			Polygon Global Partners LP
0000902664-21-004952	3	0001511306	028-15285			Polygon Global Partners LLP
0000902664-21-004952	2	0001511278	028-15282			TFG Asset Management L.P.
0000919574-21-007065	1	0001597786	028-16056			Berkshire Partners Holdings LLC
0000919574-21-007065	2	0001597787	028-16060			BPSP, L.P.
0000919574-21-007064	4	0001453226	028-15356			TWO SIGMA HORIZON PORTFOLIO, LLC
0000919574-21-007064	6	0001802995	028-20138			Two Sigma Equity Spectrum Portfolio, LLC
0000919574-21-007064	3	0001600096	028-16011			Two Sigma Futures Portfolio, LLC
0000919574-21-007064	2	0001316047	028-11144			TWO SIGMA SPECTRUM PORTFOLIO, LLC
0000919574-21-007064	1	0001280134	028-10704			TWO SIGMA EQUITY PORTFOLIO LLC
0000919574-21-007064	5	0001667003	028-17336			Two Sigma Options Portfolio, LLC
0001422848-21-000176	2		028-00157			CAPITAL RESEARCH & MANAGEMENT CO
0001422848-21-000176	1		028-00218			CAPITAL GROUP COMPANIES INC
0001172661-21-002240	1	0001767843	028-19315			MIROVA
0001104659-21-138893	2	0001279329	028-15814			SHEN NEIL NANPENG
0001104659-21-138893	6	0001845935	028-20918			SCGGF III - China Management, L.P.
0001104659-21-138893	5	0001742980	028-20070			SC China Growth IV Management, L.P.
0001104659-21-138893	1	0001537592	028-15812			SNP China Enterprises Ltd
0001104659-21-138893	7	0001611392	028-20902			SC CHINA VENTURE IV MANAGEMENT, L.P.
0001104659-21-138893	3	0001470761	028-16467			SEQUOIA CAPITAL CHINA MANAGEMENT I LP
0001104659-21-138893	4	0001743286	028-20069			SC China Growth V Management, L.P.
0001422848-21-000175	2		028-05044			CAPITAL GROUP INTERNATIONAL INC
0001422848-21-000175	1		028-00218			CAPITAL GROUP COMPANIES INC
0001422848-21-000175	3		028-00157			CAPITAL RESEARCH & MANAGEMENT CO
0000919574-21-007063	1	0001507209	028-14405			Two Sigma U.S. All Cap Core Equity Fund, LP
0000919574-21-007063	2	0001569734	028-15367			TWO SIGMA ABSOLUTE RETURN PORTFOLIO, LLC
0000919574-21-007063	3	0001569731	028-15404			TWO SIGMA ACTIVE EXTENSION U.S. ALL CAP EQUITY PORTFOLIO, LLC
0000919574-21-007063	7	0001667002	028-17346			Two Sigma Equity Risk Premia Portfolio, LLC
0000919574-21-007063	5	0001634034	028-16751			Two Sigma Macro Portfolio, LLC
0000919574-21-007063	6	0001630305	028-17350			Two Sigma World Core Fund, LP
0000919574-21-007063	4	0001559804	028-15364			Two Sigma Active Extension U.S. Small Cap Equity Fund, LP
0001035463-21-000004	1	0000743367	028-14044			BAR HARBOR BANKSHARES
0001035463-21-000004	2	0001506242	028-14045			Bar Harbor Bank & Trust
0001772937-21-000006	1	0001772938	028-19461			TPWM Services, Inc.
0001772937-21-000006	2	0001692067	028-19462			Tolleson Private Wealth Management, LP
0000919574-21-007062	2	0000907692	028-16475			SEI INVESTMENTS MANAGEMENT CORP
0000919574-21-007062	1	0001421307	028-12821			Brigade Leveraged Capital Structures Fund Ltd.
0001172661-21-002235	1	0001681639	028-17489			Coronation Investment Management International (Pty) Ltd
0001398344-21-021512	2		028-17446			Morningstar Investment Management LLC
0001398344-21-021512	4		028-13577			RiverFront Investment Group, LLC
0001398344-21-021512	1		028-14056			Red Rocks Capital LLC
0001398344-21-021512	5		028-14703			Sprott Asset Management LP
0001398344-21-021512	3		028-14185			Rocky Mountain Advisers, LLC
0000919574-21-007061	2	0001597787	028-16060			BPSP, L.P.
0000919574-21-007061	1	0001597786	028-16056			Berkshire Partners Holdings LLC
0001114039-21-000004	1	0000743367	028-14044			BAR HARBOR BANKSHARES
0001114039-21-000004	2	0001506242	028-14045			Bar Harbor Bank & Trust
0001422848-21-000174	2		028-05044			CAPITAL GROUP INTERNATIONAL INC
0001422848-21-000174	1		028-00218			CAPITAL GROUP COMPANIES INC
0001422848-21-000174	3		028-00157			CAPITAL RESEARCH & MANAGEMENT CO
0001422848-21-000173	1		028-00218			CAPITAL GROUP COMPANIES INC
0001422848-21-000173	3		028-00157			CAPITAL RESEARCH & MANAGEMENT CO
0001422848-21-000173	2		028-05044			CAPITAL GROUP INTERNATIONAL INC
0001104659-21-138864	1	0000948518	028-06348			Dai-ichi Life Holdings, Inc.
0000950123-21-015268	2		028-19255			SV Life Sciences Fund VI (GP), L.P.
0000950123-21-015268	1		028-19256			SVLSF VI, LLC
0001104659-21-138860	1	0001611388	028-18063			SC U.S. GROWTH VI MANAGEMENT, L.P.
0001104659-21-138860	2	0001447940	028-15205			SCGF IV MANAGEMENT LP
0001104659-21-138860	3	0001552459	028-16465			SCGF V Management, L.P.
0001104659-21-138860	4	0001743276	028-20900			SC U.S. Growth VIII Management, L.P.
0001104659-21-138860	10	0001742979	028-20901			SC U.S. Venture XV Management, L.P.
0001104659-21-138860	6	0001767303	028-19324			SCGGF III - Endurance Partners Management, L.P.
0001104659-21-138860	7	0001742978	028-19323			SC U.S. Growth VII Management, L.P.
0001104659-21-138860	8	0001611397	028-19321			SC U.S. VENTURE XIV MANAGEMENT, L.P.
0001104659-21-138860	9	0001743989	028-20068			SC Global Growth II Management, L.P.
0001104659-21-138860	5	0001611362	028-19322			SCGGF MANAGEMENT, L.P.
0000764068-21-000008	1	0001738063	028-18791			GO ETF SOLUTIONS LLP
0000764068-21-000008	4	0001495115	028-13969			Legal & General Investment Management Ltd
0000764068-21-000008	3	0001559265	028-15066			Legal & General Investment Management America Inc
0000764068-21-000008	2	0001540804	028-14895			LGIM International Ltd
0001567619-21-020240	2	0001692234	028-17598			Russell Investments Group, Ltd.
0001567619-21-020240	1	0001280782	028-11097			GUGGENHEIM FUNDS INVESTMENT ADVISORS, LLC
0001275218-21-000004	1		028-129569			North Square Investments, LLC
0000918537-21-000004	1	0001105685	028-05359			MFP INVESTORS LLC
0001172661-21-002229	1	0001758720	028-18937			Walleye Capital LLC
0001422848-21-000171	2		028-00157			CAPITAL RESEARCH & MANAGEMENT CO
0001422848-21-000171	1		028-00218			CAPITAL GROUP COMPANIES INC
0000950123-21-015259	1		005-85372			The Guardian Life Insurance Company of America
0001085146-21-003313	1	0000073076	028-00229			NORTHWESTERN MUTUAL LIFE INSURANCE CO
0001422848-21-000170	3		028-00157			CAPITAL RESEARCH & MANAGEMENT CO
0001422848-21-000170	1		028-00218			CAPITAL GROUP COMPANIES INC
0001422848-21-000170	2		028-05044			CAPITAL GROUP INTERNATIONAL INC
0001393825-21-000099	1	0001538853	028-20053			MIRABELLA FINANCIAL SERVICES LLP
0000950123-21-015254	1		028-20333			Harber Capital LLC
0000950123-21-015247	1		028-17846			Precept Capital Management, L.P.
0000950123-21-015245	1		028-19296			EnerVest Investment Services, L.L.C.
0001420506-21-001661	1	0001454027	028-13309			Verition Fund Management LLC
0000914208-21-000585	3		028-12270			Invesco Trust Co.
0000914208-21-000585	4		028-20392			Invesco Hong Kong Ltd
0000914208-21-000585	5		028-20393			Invesco Asset Management Deutschland GmbH
0000914208-21-000585	6		028-05683			Invesco Asset Management Ltd
0000914208-21-000585	9		028-20391			Invesco Management S.A.
0000914208-21-000585	11		028-20389			Invesco Asset Management Japan Ltd
0000914208-21-000585	13		028-20390			Invesco Australia Ltd.
0000914208-21-000585	14		028-11365			Invesco Investment Advisers, LLC
0000914208-21-000585	15		028-11936			Invesco Capital Management LLC
0000914208-21-000585	1		028-00255			Invesco Advisers, Inc.
0000914208-21-000585	2		028-06137			Invesco Canada Ltd
0001632813-21-000002	1	0001776936	028-19536			CMT GmbH Holdings LLC
0001632813-21-000002	2	0001607635	028-16153			CMT Global Holdings LLC
0001812046-21-000111	1	0001329948	028-11413			Janney Montgomery Scott LLC
0001812046-21-000111	2					New Edge Wealth (formally Mid Atlantic Capital)
0001812046-21-000111	3	0001610520	028-16612			UBS Group AG
0001737109-21-000013	14					Natixis AIA
0001737109-21-000013	15					Natixis Loomis Sayles
0001737109-21-000013	16					Natixis Multi
0001737109-21-000013	17					Neuberger Berman
0001737109-21-000013	18					Oak Ridge Investments
0001737109-21-000013	19					Parametric Portfolio Associates
0001737109-21-000013	20					Polen Capital Management
0001737109-21-000013	21					Richard Bernstein Advisors
0001737109-21-000013	22					Santa Barbara Asset Management
0001737109-21-000013	23					Trillium Asset Management
0001737109-21-000013	24					Zacks Investment Management
0001737109-21-000013	1					Alliance Bernstein
0001737109-21-000013	2					Abner Herrman and Brock
0001737109-21-000013	3					Beacon Capital Management
0001737109-21-000013	4					Capital Research & Management Company
0001737109-21-000013	5					Clark Capital Management Group
0001737109-21-000013	6					Congress Asset Management
0001737109-21-000013	7					Davis Select Advisors
0001737109-21-000013	8					Federated
0001737109-21-000013	9					Horizon Investments
0001737109-21-000013	10					JP Morgan
0001737109-21-000013	11					Loomis Sayles
0001737109-21-000013	12					LPL Research
0001737109-21-000013	13					Manning & Napier
0000950159-21-000318	1	0001512538	028-14173			New Vernon Capital Holdings II LLC
0001719165-21-000014	1	0001731572	028-18614			Accent Partners LLC
0001085146-21-003311	1	0000073076	028-00229			NORTHWESTERN MUTUAL LIFE INSURANCE CO
0001085146-21-003308	1	0000073076	028-00229			NORTHWESTERN MUTUAL LIFE INSURANCE CO
0001785546-21-000003	1	0001607635	028-16153			CMT Global Holdings LLC
0001256484-21-000025	9	0001145619	028-10549			NORTHERN TRUST GLOBAL INVESTMENTS LTD
0001256484-21-000025	8	0001256909	028-10487			Northern Trust Investments, Inc
0001256484-21-000025	1	0000919972	028-10495			NORTHERN TRUST CO
0001256484-21-000025	10	0001755386	028-18905			Belvedere Advisors LLC
0001085146-21-003307	2					Concordia Wealth Planning, LLC
0001085146-21-003307	3	0001043176				WEALTH MANAGEMENT LLC                                   /ADV
0001085146-21-003307	4	0000789995				INVESTMENT PLANNERS, INC.
0001085146-21-003307	1	0001740842	028-18789			Braun-Bostich & Associates Inc.
0001085146-21-003307	6	0001802459	028-20009			CWS Financial Advisors, LLC
0001085146-21-003307	7					Roman Retirement Planning
0001085146-21-003307	8					CAFG Wealth Management, Inc.
0001085146-21-003307	5	0000715113				MJP ASSOCIATES INC /ADV
0001567619-21-020215	1	0001768021	028-19326			Scion Asset Partners, LP
0001567619-21-020215	2	0001768023	028-19327			SCION CAPITAL GROUP, LLC
0001567619-21-020211	1	0001213066	028-10307			TRUSTCO BANK
0001567619-21-020207	1	0001675772	028-18491			Blue Pool Capital Ltd
0000950123-21-015215	1		028-20932			Mill Road Capital III GP LLC
0001859606-21-000019	2	0001694093				AMS DERIVATIVES B.V.
0001859606-21-000019	3	0001716559				Optiver US LLC
0001859606-21-000019	1	0001535794				Optiver VOF
0001085146-21-003300	2	0001598147	028-15939			Orbis Investment Management (U.S.), L.P.
0001085146-21-003300	1	0000940594	028-04613			ORBIS INVESTMENT MANAGEMENT LTD
0001731732-21-000003	1	0001086483	028-04587			ZACKS INVESTMENT MANAGEMENT
0001085146-21-003298	1	0001265287	028-13184			JEFFERIES LLC
0001085146-21-003298	4	0001492224	028-13965			Leucadia Asset Management LLC
0001085146-21-003298	5	0001681904	028-17499			Jefferies Financial Services, Inc.
0001085146-21-003298	2	0001697634	028-17885			Leucadia Investment Management Ltd
0001567619-21-020193	1	0000099189	028-00136			TRANSAMERICA CORP
0001085146-21-003295	1	0001593363	028-15664			KLPD Ventures, LLC
0001085146-21-003295	2	0001498928	028-15665			Wingate Andrew D.
0001085146-21-003295	4	0001593399	028-15666			KLP Enterprises, LLC
0001085146-21-003295	3	0001498904	028-15663			Falk Lucinda
0001315863-21-000884	1	0001581079	028-18132			Anson Advisors Inc.
0001085146-21-003292	2	0001569595	028-15217			BTG PACTUAL (UK) Ltd
0001085146-21-003292	1	0001569579	028-15216			BTG Pactual Asset Management US LLC
0001085146-21-003292	3	0001569785	028-15342			BTG Pactual Asset Management S.A. DTVM
0001085601-21-000006	1					LaSalle AIFM Europe S.a.r.l.
0001604488-21-000014	1	0001125816	028-06487			FIRST TRUST ADVISORS LP
0000720672-21-000013	7	0001725950	028-19513			Washington Crossing Advisers LLC
0000720672-21-000013	5	0001135986	028-06397			Stifel Trust Company, N.A.
0000720672-21-000013	4	0001324943	028-11345			1919 Investment Counsel, LLC
0000720672-21-000013	3	0001483835	028-13699			Stifel Independent Advisors, LLC
0000720672-21-000013	6	0001592412	028-16086			Stifel Trust Co Delaware, N.A.
0000720672-21-000013	1	0000948905	028-06972			STIFEL NICOLAUS & CO INC \MO\
0000720672-21-000013	2	0001442676	028-13156			EquityCompass Investment Management
0001841827-21-000011	14	0001446209	028-20871			SIG Asia Investment, LLLP
0001841827-21-000011	8	0001081698	028-13218			HEIGHTS CAPITAL MANAGEMENT, INC
0001728194-21-000004	8	0001081698	028-13218			HEIGHTS CAPITAL MANAGEMENT, INC
0001728194-21-000004	12	0001649553	028-17822			CVI Investments, Inc.
0001422848-21-000164	2		028-05044			CAPITAL GROUP INTERNATIONAL INC
0001422848-21-000164	3		028-00157			CAPITAL RESEARCH & MANAGEMENT CO
0001422848-21-000164	1		028-00218			CAPITAL GROUP COMPANIES INC
0001454027-21-000004	2	0001754535	028-19350			DeepCurrents Investment Group LLC
0001454027-21-000004	1	0001538853	028-20053			MIRABELLA FINANCIAL SERVICES LLP
0001446194-21-000006	7	0001444949	028-13217			SUSQUEHANNA ADVISORS GROUP, INC.
0001446194-21-000006	5	0001011712	028-13219			CAPITAL VENTURES INTERNATIONAL
0001446194-21-000006	13	0001839852	028-20869			Darby Financial Products
0001446194-21-000006	11	0001136305	028-16683			G1 EXECUTION SERVICES, LLC
0001446194-21-000006	10	0001628277	028-16682			CVI Opportunities Fund I, LLLP
0001446194-21-000006	1	0000918950	028-13224			SUSQUEHANNA INVESTMENT GROUP
0001446194-21-000006	2	0001446580	028-13221			SUSQUEHANNA SECURITIES, LLC
0000950123-21-015198	4		028-17500			MEMBERS Trust Co
0000950123-21-015198	5		028-20554			Thrivent Advisor Network, LLC
0000950123-21-015198	6		028-21235			Thrivent Trust Company of Tennessee, Inc.
0000950123-21-015198	3		028-14970			Thrivent Trust Company
0000950123-21-015198	2		028-10230			Thrivent Investment Management Inc
0000950123-21-015198	1		028-11983			Thrivent Asset Management, LLC
0000919574-21-007006	2	0001722659	028-18484			Long Meadow, L.P.
0000919574-21-007006	1	0001448009	028-13775			FRESHFORD PARTNERS, LP
0001451531-21-000010	1	0000923338	028-10337			KOCH INDUSTRIES INC
0000950123-21-015194	2					Calibrium Management Company S.A.
0000950123-21-015194	1					Calibrium AG
0001172661-21-002209	1	0001544730	028-15968			First Reserve GP XII, LP
0001172661-21-002207	1	0001477478	028-14889			First Reserve GP XI, L.P.
0001405086-21-000293	4	0001541852	028-14820			Avenue Capital Partners VI, LLC
0001405086-21-000293	3	0001541853	028-14819			Avenue Special Situations Fund VI (Master), L.P.
0001405086-21-000293	2	0001317338	028-11224			Avenue Capital Management II, L.P.
0001405086-21-000293	5	0001541856	028-14823			GL Partners VI, LLC
0001405086-21-000293	6	0001613152	028-17831			Avenue Energy Opportunities Fund, L.P.
0001405086-21-000293	1	0001389850	028-12377			Avenue Capital Management II GenPar, LLC
0001405086-21-000293	8	0001689135	028-17833			GL ENERGY OPPORTUNITIES PARTNERS, LLC
0001405086-21-000293	7	0001689110	028-17832			AVENUE ENERGY OPPORTUNITIES PARTNERS, LLC
0001055980-21-000006	1	0001076598				EATON VANCE MANAGEMENT
0000813917-21-000049	1		028-05788			NATIXIS ADVISORS, L.P.
0001012975-21-000446	1	0001754247	028-19332			Globespan Management Associates IV, LLC
0000950123-21-015191	1		028-11063			Permit Capital GP, L.P.
0001455468-21-000004	1		028-13158			Legato Capital Management LLC
0001567619-21-020161	7	0001335241	028-11442			CA Indosuez (Suisse) SA
0001567619-21-020161	6	0001330773	028-11417			CA Indosuez Wealth (Europe)
0001567619-21-020161	5	0001696409	028-17740			CREDIT AGRICOLE INDOSUEZ WEALTH (AM)
0001567619-21-020161	4	0001696434	028-17742			CREDIT AGRICOLE INDOSUEZ WEALTH (GROUP)
0001567619-21-020161	3	0001697575	028-17739			CREDIT AGRICOLE INDOSUEZ GESTION
0001567619-21-020161	2	0001697576	028-17741			CREDIT AGRICOLE INDOSUEZ WEALTH (FRANCE)
0001567619-21-020161	1	0001330437	028-11418			Credit Agricole Corporate & Investment Bank
0000919574-21-007000	1	0001163648	028-10064			CI INVESTMENTS INC.
0001611848-21-000012	1	0000811393	028-01949			BANKERS TRUST CO
0001085146-21-003283	4	0001650392	028-16969			Aberdeen Asset Investments Ltd
0001085146-21-003283	5	0001125816	028-06487			FIRST TRUST ADVISORS LP
0001085146-21-003283	7	0000073076	028-00229			NORTHWESTERN MUTUAL LIFE INSURANCE CO
0001085146-21-003283	10	0001505708	028-14115			Standard Life Investments LTD
0001085146-21-003283	11	0001803235	028-20161			abrdn Capital International Ltd
0001085146-21-003283	12	0001472915	028-15005			ABERDEEN STANDARD ALTERNATIVE FUNDS Ltd
0001085146-21-003283	2	0001056108	028-11022			abrdn Asia Ltd
0001085146-21-003283	9	0001536355	028-16269			Ignis Investment Services Ltd
0001085146-21-003283	8	0001624724	028-16329			abrdn Capital Ltd
0001085146-21-003283	6	0001071039	028-05167			Brighthouse Investment Advisers, LLC
0001085146-21-003283	3	0001544935	028-14936			Aberdeen Asset Managers Ltd
0001085146-21-003283	1	0001309613	028-11020			Aberdeen Standard Investments Inc.
0001736225-21-000004	1					PYTHAGOREAN TRADING, LLC
0000919574-21-006994	1	0000914699	028-13190			Southport Management Limited Partnership
0001104659-21-138730	2					Bpifrance Investissement SAS
0001104659-21-138730	1	0001581835	028-19623			Bpifrance Participations SA
0001666335-21-000009	1	0001827377				Rokos Capital Management (US) LP
0000072971-21-000339	4	0000740906	028-01341			WELLS FARGO BANK N A
0000072971-21-000339	13	0001418112	028-13117			WELLS FARGO ADVISORS FINANCIAL NETWORK, LLC
0000072971-21-000339	15	0001417544	028-13118			WELLS FARGO CLEARING SERVICES, LLC
0000072971-21-000339	17	0001418540	028-12628			WELLS FARGO DELAWARE TRUST CO, N.A.
0000072971-21-000339	24	0001470801	028-13600			Wells Fargo Securities, LLC
0000072971-21-000339	3	0001075869	028-04413			Allspring Global Investments LLC
0000072971-21-000339	5					Wells Fargo Funds Management, LLC reporting on behalf of Citigroup, Inc
0000072971-21-000339	3					WELLS CAPITAL MANAGEMENT INC reporting on behalf of 361 CAPITAL LLC
0000072971-21-000339	3					WELLS CAPITAL MANAGEMENT INC reporting on behalf of SEI INVESTMENTS CO
0000072971-21-000339	3					WELLS CAPITAL MANAGEMENT INC reporting on behalf of UBS ASSET MANAGEMENT AMERICAS INC
