ACCESSION_NUMBER	SEQUENCENUMBER	CIK	FORM13FFILENUMBER	CRDNUMBER	SECFILENUMBER	NAME
0001006378-21-000011	1		028-06325			New York Life Investment Management LLC
0001393825-21-000105	1	0001538853	028-20053			MIRABELLA FINANCIAL SERVICES LLP
0000948046-21-000195	10	0001179124	028-10249			DWS INVESTMENT MANAGEMENT AMERICAS, INC
0000948046-21-000195	11	0000938772	028-04760			RREEF AMERICA LLC
0000948046-21-000195	19	0001342720	028-11509			Deutsche Bank (Suisse) SA
0000948046-21-000195	20	0001020242	028-11997			DEUTSCHE BANK NATIONAL TRUST CO
0000948046-21-000195	21	0001370961	028-11998			Deutsche Bank Trust CO Delaware
0000948046-21-000195	23	0001370965	028-12000			Deutsche Bank Trust Company, National Association
0000948046-21-000195	33	0001498187	028-13988			DWS Investments UK Ltd
0000948046-21-000195	287	0001506281	028-18169			DBX Advisors LLC
0000948046-21-000195	422	0001767587	028-19303			DWS Investments Hong Kong Ltd
0000948046-21-000195	482	0001767619	028-19307			DWS Investment S.A.
0000948046-21-000195	483	0001767611	028-19304			DWS International GmbH
0000948046-21-000195	442	0001491448	028-13922			SAL Oppenheim Jr. & Cie.AG & Co.KGaA
0000948046-21-000195	522	0001793932	028-19625			Quaystreet Asset Management Ltd
0000948046-21-000195	6	0001167717	028-10155			DWS Investment GmbH
0000948046-21-000195	1	0001173854	028-13777			Deutsche Bank Trust Co Americas
0000948046-21-000195	2	0000898380	028-05033			BT ALEX BROWN INC /
0001505817-21-000034	1	0000945425	028-04930			Fiera Capital Inc.
0001505817-21-000034	2	0001351841	028-11574			Fiera Capital (Europe) Ltd.
0001505817-21-000034	3	0001316828	028-11145			Fiera Capital (IOM) Ltd
0001085146-21-003436	1	0001265287	028-13184			JEFFERIES LLC
0001085146-21-003436	5	0001681904	028-17499			Jefferies Financial Services, Inc.
0001085146-21-003436	4	0001492224	028-13965			Leucadia Asset Management LLC
0001085146-21-003436	2	0001697634	028-17885			Leucadia Investment Management Ltd
0001628280-21-025139	1		028-18621			METLIFE INC
0001628280-21-025138	1		028-18621			METLIFE INC
0001628280-21-025136	1		028-18621			METLIFE INC
0001628280-21-025135	1		028-18621			METLIFE INC
0001628280-21-025134	1		028-18621			METLIFE INC
0001628280-21-025133	1		028-18621			METLIFE INC
0000949509-21-000024	1	0001001085	028-14349			BROOKFIELD ASSET MANAGEMENT INC.
0000949509-21-000024	2	0001790787	028-20007			Atlas OCM Holdings, LLC
0001178913-21-003783	1	0001573618	028-15466			Psagot Securities Ltd.
0001178913-21-003783	3	0001576257	028-16081			Psagot Mutual Funds Ltd.
0001791965-21-000005	1	0001593324				Penserra Capital Management LLC
0001449434-21-000013	1		28-13441			Apollo Capital Management, L.P.
0001449434-21-000013	2		28-13439			Apollo Management, L.P.
0000950123-21-015874	1					Deer IX & Co. L.P.
0001580642-21-005559	15		028-04557			WELLINGTON MANAGEMENT GROUP LLP
0001580642-21-005559	1		028-10562			ALLIANCEBERNSTEIN L.P
0001580642-21-005559	2		028-05933			ARGENT CAPITAL MANAGEMENT LLC
0001580642-21-005559	3		028-01006			BARROW HANLEY MEWHINNEY & STRAUSS LLC
0001580642-21-005559	4		028-02204			Brandywine Global Investment Management, LLC
0001580642-21-005559	5		028-10449			COLUMBUS CIRCLE INVESTORS
0001580642-21-005559	6		028-01203			CS MCKEE LP
0001580642-21-005559	7		028-01185			FRONTIER CAPITAL MANAGEMENT CO LLC
0001580642-21-005559	8		028-02494			TCW GROUP INC
0001580642-21-005559	9		028-16230			Jackson Square Partners, LLC
0001580642-21-005559	10		028-05267			MACQUARIE INVESTMENT MANAGEMENT BUSINESS TRUST
0001580642-21-005559	11		028-03692			MILLER HOWARD INVESTMENTS INC /NY
0001580642-21-005559	12		028-03425			NEW SOUTH CAPITAL MANAGEMENT INC
0001580642-21-005559	13		028-03459			SMITH ASSET MANAGEMENT GROUP LP /ADV
0001580642-21-005559	14		028-07104			WCM INVESTMENT MANAGEMENT, LLC
0001580642-21-005559	16		028-10622			ZEVENBERGEN CAPITAL INVESTMENTS LLC
0001437749-21-027350	1		028-16121			Astor Investor Management, LLC
0001437749-21-027350	2		028-13023			Dana Investment Advisors, Inc.
0001437749-21-027350	3		028-18135			State Street Global Advisors Trust Co.
0001437749-21-027350	4		028-04375			Federated Investors Inc.
0000950123-21-015791	300					World Asset Management
0000950123-21-015791	100					Comerica Bank
0001104659-21-141992	1	0000863926	028-02725			SUNAMERICA ASSET MANAGEMENT, LLC
0001104659-21-141992	2	0001492070	028-13934			AIG Asset Management (U.S.), LLC
0001062993-21-011251	1					Broken Clock Management LLC
0001062993-21-011251	2					Arbiter Partners QP LP
0001062993-21-011251	3					Arbiter Partners LP
0001062993-21-011251	4					Arbiter Partners Offshore LTD
0001580642-21-005524	5		028-18460			Clifford Capital Partners, LLC
0001580642-21-005524	4		028-10799			CIBC Private Wealth Management
0001580642-21-005524	3		028-03381			Segall Bryant & Hamill, LLC
0001580642-21-005524	2		028-14059			ACR, Alpine Capital Research, LLC
0001580642-21-005524	1		028-05229			Greatlakes Advisors, LLC
0000092230-21-000085	14	0001383161	028-15462			BB&T SECURITIES, LLC
0000092230-21-000085	12	0001696868	028-18010			SunTrust Advisory Services, Inc.
0000092230-21-000085	5	0000764116				TRUIST BANK /NC/
0000092230-21-000085	15	0001329883	028-11465			Sterling Capital Management LLC
0001172661-21-002412	1	0001689919	028-17563			VEPF MANAGEMENT, L.P.
0001390777-21-000109	66		028-14511			American Beacon Advisors, Inc.
0001390777-21-000109	69		028-14070			EAM Investors, LLC
0001390777-21-000109	71		028-03935			Geneva Capital Management LLC
0001390777-21-000109	78		028-12426			Nicholas Investment Partners, L.P.
0001390777-21-000109	80		028-12484			Boston Partners Global Investors, Inc.
0001390777-21-000109	83		028-13672			Walthausen & Co., LLC
0001390777-21-000109	86		028-14862			Granite Investment Partners, LLC
0001390777-21-000109	87		028-10467			Rice Hall James & Associates, LLC
0001390777-21-000109	94		028-17546			BNY Mellon Investment Management Cayman Ltd.
0001390777-21-000109	96		028-11090			Channing Capital Management
0001390777-21-000109	104		028-04634			Moody Aldrich Partners LLC
0001390777-21-000109	114		028-12234			Redwood Investments, LLC
0001390777-21-000109	118		028-05161			Nationwide Fund Advisors
0001390777-21-000109	119		028-20231			Alaska Permanent Fund Corporation
0001390777-21-000109	121		028-04131			Heartland Advisors, Inc.
0001390777-21-000109	124		028-21404			Newton Investment Management North America, LLC
0001390777-21-000109	4		028-17542			BNY Mellon Trust of Delaware
0001390777-21-000109	15		028-02900			Mellon Investments Corporation
0001390777-21-000109	22		028-00127			BNY Mellon Investment Adviser, Inc.
0001390777-21-000109	40		028-04797			Newton Investment Management Limited
0001390777-21-000109	42		028-18785			BNY Mellon Securities Corporation
0001390777-21-000109	48		028-02009			The Bank of New York Mellon
0001390777-21-000109	49		028-00620			BNY Mellon, NA
0001390777-21-000109	51		028-17544			Walter Scott & Partners Limited
0001390777-21-000109	59		028-11769			Lockwood Advisors, Inc.
0001606587-21-001647	1	0000733020	028-00858			ARS Investment Partners, LLC
0001606587-21-001647	2	0000860644	028-02634			Aristotle Capital Management, LLC
0001437749-21-027041	43		028-06605			Thornburg
0001437749-21-027041	44		028-18145			W.E. Donoghue & Co. LLC
0001437749-21-027041	45		028-18951			Wakefield Asset Management LLLP
0001437749-21-027041	46		028-07104			WCM Investment Management LLC
0001437749-21-027041	47		028-18341			Redwood Investments LLC
0001437749-21-027041	48		028-00869			Principal Global Investors
0001437749-21-027041	49		028-01549			Fred Alger Management LLC
0001437749-21-027041	50		028-17768			ARK Investment Management LLC
0001437749-21-027041	51		028-11728			Causeway Capital Management LLC
0001437749-21-027041	52		028-16673			Gyroscope Capital Management Group LLC
0001437749-21-027041	53		028-11091			Hillman Capital Management, Inc.
0001437749-21-027041	54		028-15561			Polaris Wealth Advisory Group, LLC
0001437749-21-027041	55		028-17711			Adviser Investment LLC
0001437749-21-027041	39		028-03489			SouthernSun Asset Management LLC
0001437749-21-027041	1		028-10562			AllianceBernstein LP
0001437749-21-027041	2		028-05637			Advisory Research Inc
0001437749-21-027041	3		028-06538			AEW Capital Management LP
0001437749-21-027041	4		028-11962			AMI Asset Management Corp
0001437749-21-027041	5		028-02634			Aristotle Capital Management LLC
0001437749-21-027041	6		028-21720			AthenaInvest Advisors LLC
0001437749-21-027041	7		028-05936			Atlanta Capital
0001437749-21-027041	8		028-11748			Beaumont Financial Partners LLC
0001437749-21-027041	9		028-05034			Berkshire Asset Management LLC
0001437749-21-027041	10		028-16017			BMO Asset Management Corp
0001437749-21-027041	11		028-14438			Brookmont Capital Management LLC
0001437749-21-027041	12		028-01398			Cambiar Investors LLC
0001437749-21-027041	13		028-11680			Clark Capital Management Group LLC
0001437749-21-027041	14		028-02405			Cohen & Steers Capital Management Inc
0001437749-21-027041	15		028-10477			Columbia Management Investment Advisers LLC
0001437749-21-027041	16		028-03434			Congress Asset Management Company
0001437749-21-027041	17		028-14668			Copeland Capital Management LLC
0001437749-21-027041	18		028-10648			Diamond Hill Capital Management Inc
0001437749-21-027041	19		028-10309			DSM Capital Partners LLC
0001437749-21-027041	20		028-12076			Dorsey, Wright & Associates LLC
0001437749-21-027041	21		028-10981			Goldman Sachs Asset Management LP
0001437749-21-027041	22		028-14862			Granite Investment Partners LLC
0001437749-21-027041	23		028-04139			Eaton Vance Management
0001437749-21-027041	24		028-14862			Granite Investment Partners LLC
0001437749-21-027041	25		028-04145			GW&K Investment Management LLC
0001437749-21-027041	26		028-04434			Harding Loevner LP
0001437749-21-027041	27		028-18950			Henry James International Management Inc.
0001437749-21-027041	28		028-00255			Invesco Advisers Inc
0001437749-21-027041	29		028-00694			JP Morgan
0001437749-21-027041	30		028-10469			Lazard Asset Management LLC
0001437749-21-027041	31		028-12558			Legg Mason Private Portfolio Group, LLC
0001437749-21-027041	32		028-05267			Macquarie Invesment Management Business Trust
0001437749-21-027041	33		028-03692			Miller Howard Investments Inc
0001437749-21-027041	34		028-17085			Neuberger Berman Investment Advisers LLC
0001437749-21-027041	35		028-17093			Newfound Research LLC
0001437749-21-027041	36		028-04558			Parametric Portfolio Associates LLC
0001437749-21-027041	37		028-01523			Peregrine Capital Management LLC
0001437749-21-027041	38		028-03687			Polen Capital Management LLC
0001437749-21-027041	42		028-04041			Thompson, Siegel & Walmsley LLC
0001437749-21-027041	40		028-11076			Sustainable Growth Advisers, LP
0001437749-21-027041	41		028-10665			London Co of Virginia
0001420506-21-001739	1	0001536054	028-14917			Crestline Management, LP
0000849854-21-000007	1	0001513227	028-14414			Smart Portfolios, LLC
0001104659-21-140378	2		028-12556			V. Prem Watsa
0001104659-21-140378	1		028-12555			Hamblin Watsa Investment Counsel Ltd.
0000092230-21-000084	5	0000764116				TRUIST BANK /NC/
0000092230-21-000084	15	0001329883	028-11465			Sterling Capital Management LLC
0000092230-21-000084	14	0001383161	028-15462			BB&T SECURITIES, LLC
0000092230-21-000084	12	0001696868	028-18010			SunTrust Advisory Services, Inc.
0001580642-21-005484	42					Legg Mason
0001580642-21-005484	1					Vanguard
0001580642-21-005484	2					Congress Asset Management Company
0001580642-21-005484	4					Brandes
0001580642-21-005484	6					Miller/Howard
0001580642-21-005484	8					Navellier & Associates Inc.
0001580642-21-005484	10					Zacks Investment Mgt
0001580642-21-005484	13					Cambiar
0001580642-21-005484	14					Anchor Capital
0001580642-21-005484	15					Atlanta Capital
0001580642-21-005484	17					Granite Invstmt Ptnr
0001580642-21-005484	18					Sparrow
0001580642-21-005484	19					Lazard
0001580642-21-005484	20					AthenaInvest Advisor
0001580642-21-005484	21					ACR
0001580642-21-005484	24					Dana Investment
0001580642-21-005484	25					Chartwell
0001580642-21-005484	26					Clark Capital Mgmt
0001580642-21-005484	27					Cohen & Steers
0001580642-21-005484	33					S&P
0001580642-21-005484	41					Hahn Capital Management
0000092230-21-000083	15	0001329883	028-11465			Sterling Capital Management LLC
0000092230-21-000083	5	0000764116				TRUIST BANK /NC/
0000092230-21-000083	12	0001696868	028-18010			SunTrust Advisory Services, Inc.
0000092230-21-000083	14	0001383161	028-15462			BB&T SECURITIES, LLC
0000949509-21-000023	1	0001001085	028-14349			BROOKFIELD ASSET MANAGEMENT INC.
0000949509-21-000023	2	0001790787	028-20007			Atlas OCM Holdings, LLC
0000950123-21-015675	1		005-85372			The Guardian Life Insurance Company of America
0001567619-21-020557	2					Johnson & Johnson UK Treasury Company Limited
0001567619-21-020557	1	0000924020	028-20073			Johnson & Johnson Innovation - JJDC, Inc.
0001166588-21-000009	2	0000872786	028-04059			BNP PARIBAS
0001166588-21-000009	1	0001197610	028-10283			BNP PARIBAS SECURITIES CORP
0001606587-21-001638	1	0000874791	028-02903			CAMPBELL NEWMAN ASSET MANAGEMENT INC
0001606587-21-001638	4	0001034524	028-03687			POLEN CAPITAL MANAGEMENT LLC
0001606587-21-001638	3	0001305227	028-12016			BlackRock Investment Management, LLC
0001606587-21-001638	2	0001730242	028-19649			55I, LLC
0001085146-21-003409	10	0001710524	028-18093			Peak Capital Management LLC
0001085146-21-003409	12	0001721242	028-18182			Belpointe Asset Management LLC
0001085146-21-003409	9	0001726752	028-18382			Pinnacle Wealth Planning Services, Inc.
0001085146-21-003409	7	0001780985	028-19577			OneAscent Financial Services LLC
0001085146-21-003409	6	0000768965	028-18080			FIRST FINANCIAL EQUITY CORPORATION
0001085146-21-003409	5	0001667146	028-17378			Ausdal Financial Partners, Inc.
0001085146-21-003409	4	0001843867	028-21080			Curran Financial Partners, LLC
0001085146-21-003409	20	0001765536	028-19062			Summit Financial, LLC
0001085146-21-003409	2	0001682021	028-18047			Vivaldi Capital Management LP
0001085146-21-003409	19	0001733777	028-18727			F3Logic, LLC
0001085146-21-003409	14	0000891943	028-18315			CENTAURUS FINANCIAL, INC.
0001085146-21-003409	15	0001767313	028-19275			WealthBridge Capital Management, LLC
0001085146-21-003409	16	0001800724	028-19853			Cascadia Advisory Services, LLC
0001085146-21-003409	18	0001793904	028-19913			Wealth Alliance
0001731509-21-000008	1	0001730859	028-18611			SB INVESTMENT ADVISERS (US) INC.
0001085146-21-003406	10	0000812295	028-01343			JANUS CAPITAL MANAGEMENT LLC
0001085146-21-003406	2	0001125816	028-06487			FIRST TRUST ADVISORS LP
0001085146-21-003406	1	0001133639	028-06325			NEW YORK LIFE INVESTMENT MANAGEMENT LLC
0001085146-21-003406	4	0001280110	028-10906			HENDERSON GLOBAL INVESTORS LTD
0001085146-21-003406	16	0001874815	028-21345			Janus Henderson Investors (Jersey) Ltd
0001085146-21-003406	12	0001810753	028-20257			Janus Henderson Investors (Singapore) Ltd
0001085146-21-003406	11	0001794678	028-20157			Janus Henderson Investors (Australia) Institutional Funds Management Ltd
0001085146-21-003406	9	0001086318	028-04211			INTECH INVESTMENT MANAGEMENT LLC
0001178913-21-003607	3	0001576257	028-16081			Psagot Mutual Funds Ltd.
0001178913-21-003607	1	0001573618	028-15466			Psagot Securities Ltd.
0000950123-21-015661	1		028-19370			Christopher Shackelton
0000950123-21-015661	2		028-19367			Adam Gray
0001616525-21-000007	1		028-06487			FIRST TRUST ADVISORS, LP
0001178913-21-003587	1	0001634147	028-16826			Analyst Provident Funds Ltd.
0001178913-21-003587	2	0001831222	028-20367			Analyst I.M.S. Mutual Funds Management
0001178913-21-003573	1	0001667119	028-17386			Migdal Insurance Co Ltd
0001178913-21-003573	4	0001728584	028-18262			Migdal Mutual Funds Ltd
0001178913-21-003573	3	0001727574	028-18263			Migdal Investment Portfolio Management (1998) Ltd.
0001178913-21-003573	2	0001667118	028-17385			Migdal Makefet Pension Funds & Provident Funds Ltd
0000950123-21-015631	7		28-20994			Blackstone Tactical Opportunities Advisors L.L.C.
0000950123-21-015631	8		28-20992			Blackstone Infrastructure Advisors L.L.C.
0001595888-21-000027	1	0001450698	028-13277			Jane Street Capital, LLC
0001595888-21-000027	2	0001450709	028-13276			Jane Street Options, LLC
0001595888-21-000027	3	0001450705	028-13275			Jane Street Global Trading, LLC
0001595888-21-000027	4	0001556329	028-15040			JSOIN (BVI), Ltd.
0001398344-21-021619	1		028-20951			SevenOneSeven Capital Management
0001415345-21-000005	1		028-14511			American Beacon
0001085146-21-003392	1	0001789219	028-19636			Charles Schwab Trust Co
0001739728-21-000005	1					Client One Securities, LLC
0001739728-21-000005	3					GeoWealth Management, LLC
0001743413-21-000004	1					Gilman Hill
0001688519-21-000005	1	0000860644				Aristotle Capital Management, LLC
0001688519-21-000005	2	0000872259				BAHL & GAYNOR INC
0001688519-21-000005	3	0000790502				EAGLE ASSET MANAGEMENT INC
0001688519-21-000005	4	0000812295				JANUS CAPITAL MANAGEMENT LLC
0001688519-21-000005	5	0001106012				NFJ INVESTMENT GROUP LLC
0001688519-21-000005	6	0001539852				PARAMETRIC DEFENSIVE EQUITY FUND LLC
0001688519-21-000005	7	0000932859				PARAMETRIC PORTFOLIO ASSOCIATES LLC
0001688519-21-000005	8	0001259887				LONDON CO OF VIRGINIA
0001688519-21-000005	9	0001599511				Tortoise Investment Management, LLC
0001688519-21-000005	10	0000900973				Winslow Capital Management, LLC
0001688519-21-000005	11	0000350797				Mirror Merger Sub 2, LLC
0001688519-21-000005	12	0001207017				LAZARD ASSET MANAGEMENT LLC
0001716659-21-000004	1					Earnest
0001167376-21-000031	1	0001469588	028-13620			Q Global Capital Management, L.P.
0001167376-21-000031	2	0001199406	028-10277			RAYNOR GEOFFREY
0000950123-21-015647	1		028-13826			Brookfield Public Securities Group LLC
0000950123-21-015647	2		028-20008			Brookfield BHS Advisors LLC
0000950123-21-015647	3		028-16270			Brookfield Asset Management Private Institutional Capital Adviser US, LLC
0000950123-21-015647	4		028-16296			Brookfield Asset Management Private Institutional Capital Adviser (Credit), LLC
0000950123-21-015647	5		028-14362			Brookfield Asset Management Private Institutional Capital Adviser (Canada), LLC
0000950123-21-015647	6		028-17298			Brookfield Asset Management Private Institutional Capital Adviser (Private Equity), LLC
0000950123-21-015647	7		028-18041			Partners Value Investments LP
0000950123-21-015647	8					Brookfield Asset Management Reinsurance Advisor LLC
0001597857-21-000006	1	0000949509	028-05050			OAKTREE CAPITAL MANAGEMENT LP
0000898417-21-000031	1	0001822993	028-21420			Jackson Financial Inc.
0001167376-21-000030	1	0001114634	028-10109			Amalgamated Gadget, L.P.
0001167376-21-000030	2	0001199406	028-10277			RAYNOR GEOFFREY
0000949509-21-000022	1	0001001085	028-14349			BROOKFIELD ASSET MANAGEMENT INC.
0000949509-21-000022	2	0001790787	028-20007			Atlas OCM Holdings, LLC
0001600327-21-000009	1		028-16454			SEI Investments Co
0001845849-21-000004	1	0001629271	028-16378			PALLADIEM, LLC
0001541349-21-000006	1	0001857187	028-21197			Myriad Asset Management US LP
0000950123-21-015631	6		28-13436			Harvest Fund Advisors LLC
0000950123-21-015631	5		28-20287			Blackstone Real Estate Advisors L.P.
0000950123-21-015631	4		28-19316			Blackstone Alternative Solutions L.L.C.
0000950123-21-015631	3		28-16028			Clarus Ventures, LLC
0001085146-21-003391	1	0001789219	028-19636			Charles Schwab Trust Co
0000950123-21-015631	1		28-12332			Blackstone Alternative Credit Advisors LP
0000950123-21-015631	2		28-17363			Blackstone Management Partners L.L.C.
0001214659-21-011831	1	0001765285	028-19109			Apexium Financial, LP
0000947871-21-001201	1	0001893984				Zurcher Kantonalbank Osterreich AG
0001025835-21-000140	1		028-13646			ENTERPRISE BANK & TRUST
0001172661-21-002403	1	0001373130	028-12005			M.D. Sass Associates, Inc.
0001405086-21-000305	1	0001767929	028-19279			INHERENT GROUP GP, LLC
0001493152-21-028746	1	0001097218	028-05161			Nationwide Fund Advisors
0001567619-21-020514	1	0000919165	028-04120			CHESAPEAKE PARTNERS MANAGEMENT CO INC/MD
0001398344-21-021593	1					Glenmede Investment Management
0001567619-21-020511	1	0001512948	028-14390			Robotti & Co Advisors, LLC
0001567619-21-020504	1	0001463931	028-13533			KKR Investment Management LLC
0001567619-21-020504	2	0001520692	028-14775			KKR Credit Advisors (US) LLC
0000902664-21-004975	6	0001569856	028-15424			Centerbridge Advisors, LLC
0000902664-21-004975	7	0001631018	028-16779			Centerbridge Special Credit Advisors II, L.L.C
0000902664-21-004975	8	0001766897	028-19382			Centerbridge Special Credit Advisors III, L.L.C.
0000902664-21-004975	9	0001800919	028-20085			Centerbridge Advisors II, LLC
0000902664-21-004975	5	0001484831	028-14395			Centerbridge Special Credit Advisors, L.L.C.
0000902664-21-004975	4	0001426126	028-13857			Gallogly Mark T
0000902664-21-004975	2	0001484835	028-13861			Centerbridge Partners Holdings, LLC
0000902664-21-004975	1	0001484832	028-13862			Centerbridge Credit Advisors, L.L.C.
0000902664-21-004975	10	0001846330	028-21012			Centerbridge Advisors III, LLC
0000902664-21-004975	3	0001425800	028-13858			Aronson Jeffrey
0001104659-21-139292	1		028-04826			Warburg Pincus & Co.
0001493152-21-028709	1	0001797827	028-20285			Spruce House Partnership LLC
0001085146-21-003369	1	0001380393	028-12421			Fortress Investment Group LLC
0001085146-21-003369	2	0001387345	028-12417			FIG Corp.
0001085146-21-003369	3	0001387344	028-12418			Fortress Operating Entity I LP
0001085146-21-003369	7	0001633593	028-16785			Fortress Credit Opportunities III Advisors LLC
0001085146-21-003369	5	0001252267	028-11237			DRAWBRIDGE SPECIAL OPPORTUNITIES ADVISORS LLC
0001085146-21-003369	6	0001521338	028-16784			Fortress Credit Opportunities Advisors LLC
0001085146-21-003369	4	0001245521	028-10806			FIG LLC
0001567619-21-020491	1	0001603466	028-16256			Point72 Asset Management, L.P.
0001567619-21-020490	1	0001603466	028-16256			Point72 Asset Management, L.P.
0000950159-21-000326	1	0001353362	028-11827			Flynn Management LLC
0001085146-21-003367	2	0001067983	028-04545			BERKSHIRE HATHAWAY INC
0001085146-21-003367	1	0000317745	028-04922			GENERAL RE CORP
0001567619-21-020488	1	0001603466	028-16256			Point72 Asset Management, L.P.
0001085146-21-003365	1	0001598894	028-16037			AHL Partners LLP
0001085146-21-003365	4	0001365324	028-11946			Numeric Investors LLC
0001085146-21-003365	3	0001289643	028-10979			GLG Partners LP
0001085146-21-003365	2	0001352261	028-11672			GLG LLC
0001446114-21-000060	1	0001657660	028-17014			ANCORA FAMILY WEALTH ADVISORS, LLC
0001446114-21-000060	3	0001836192	028-21227			Ancora Alternatives LLC
0001446114-21-000060	2					Clutterbuck Capital Management LLC
0001493152-21-028680	1	0001493219	028-16671			RTW MASTER FUND, LTD.
0001493152-21-028680	3	0001785169	028-19571			RTW Venture Fund Ltd
0001493152-21-028680	2	0001776733	028-19525			RTW Innovation Master Fund Ltd.
0001560717-21-000007	1					FOUNDERS FINANCIAL SECURITIES LLC
0001567619-21-020479	1	0001166604	028-10011			PAULSON MANAGEMENT LP
0001325091-21-000025	2	0001519964	028-14472			MARSHALL WACE ASIA Ltd
0001325091-21-000025	1	0001325091	028-11377			Marshall Wace North America L.P.
0001567619-21-020477	1	0001509874	028-20970			Corbin Capital Partners, L.P.
0001801263-21-000005	1	0000932859	028-04558			PARAMETRIC PORTFOLIO ASSOCIATES LLC
0001801263-21-000005	2	0001528214	028-14643			Richard Bernstein Advisors LLC
0001172661-21-002382	2	0001832128	028-20398			Yehudai Ortav
0001172661-21-002382	1	0001239607	028-12517			JAY JEFFREY R
0001325091-21-000024	2	0001318757	028-11304			MARSHALL WACE, LLP
0001325091-21-000024	1	0001325091	028-11377			Marshall Wace North America L.P.
0001283072-21-000005	1		28-12550			GUGGENHEIM FUNDS DISTRIBUTORS, LLC
0001283072-21-000005	5		28-11097			GUGGENHEIM FUNDS INVESTMENT ADVISORS, LLC
0001283072-21-000005	3		28-12837			Guggenheim Partners Investment Management, LLC
0001283072-21-000005	2		28-01689			SECURITY INVESTORS LLC
0001325091-21-000023	2	0001519964	028-14472			MARSHALL WACE ASIA Ltd
0001325091-21-000023	1	0001318757	028-11304			MARSHALL WACE, LLP
0001085146-21-003358	1	0001633376	028-16752			AQR Capital Management Holdings, LLC
0001085146-21-003358	3	0001308668	028-10998			GuideStone Capital Management, LLC
0001085146-21-003358	2	0001582681	028-20231			Alaska Permanent Fund Corp
0001104659-21-139220	1	0001569620	028-15365			PlainsCapital Corp
0001104659-21-139220	3	0000878520	028-18782			Hilltop Securities Holdings LLC
0001104659-21-139220	4	0000891055	028-18780			HILLTOP SECURITIES INC.
0001104659-21-139220	2	0001534401	028-15369			PlainsCapital Bank
0001172661-21-002377	1	0001647094	028-16942			Squarepoint Capital LLP
0000950123-21-015596	1		028-11470			ESL Investments, Inc.
0000950123-21-015593	1		28-17341			Braslyn Ltd.
0000950123-21-015593	2		28-20130			Golden Harbor Ltd.
0000950123-21-015593	3		28-17344			Shelton Ventures Inc.
0001085146-21-003356	1	0001633376	028-16752			AQR Capital Management Holdings, LLC
0001085146-21-003356	2	0001167557	028-10120			AQR CAPITAL MANAGEMENT LLC
0001172661-21-002376	1	0001537466	028-15267			Encompass Capital Master Fund LP
0001172661-21-002376	2	0001612850	028-16638			Encompass Capital E L Master Fund L.P.
0001418812-21-000065	1	0001351069				ValueAct Capital Management, L.P.
0001567619-21-020468	1	0001658263	028-17039			Zurich Life Assurance plc
0001104659-21-139214	1	0001125816	028-06487			FIRST TRUST ADVISORS LP
0001012975-21-000465	1	0001378377	028-13948			Southpoint Capital Advisors LLC
0001012975-21-000465	4	0001378379	028-13950			Clark John Smith II
0001012975-21-000465	3	0001378378	028-13952			Southpoint GP, LLC
0001012975-21-000465	2	0001378376	028-13953			Southpoint GP, LP
0001178913-21-003551	2	0001783644	028-19552			ION Tech Ltd
0001178913-21-003551	1	0001667024	028-17382			Ion Value Management Ltd.
0001172661-21-002370	1	0001300763	028-13228			DME Advisors, LP
0001172661-21-002370	2	0001489933	028-14000			DME Capital Management, LP
