0001104659-21-138060	4	0001462675	028-13594			Ares Enhanced Loan Investment Strategy Advisor IV, L.P.
0001104659-21-138060	5	0001684755	028-17562			Ares Capital Management III LLC
0001104659-21-138060	3	0001683967	028-18943			ASSF Operating Manager IV, L.P.
0001781942-21-000005	1					BLACKROCK
0001781942-21-000005	3					PARAMETRIC
0001781942-21-000005	2					MERIDIAN WEALTH PARTNERS
0000950123-21-014968	2		028-15911			CCP Master GP, L.P.
0000950123-21-014968	1		028-15910			Cartica Management, L.P.
0000921895-21-002601	1	0001427289	028-15517			Bylinsky Gregory
0000921895-21-002601	2	0001427290	028-15518			Gramm Jefferson
0001213900-21-058664	1	0001512203	028-16657			CCMP Capital Advisors, LP
0001165002-21-000093	2					WESTWOOD MANAGEMENT CORP /TX
0001165002-21-000093	5					WESTWOOD ADVISORS, L.L.C.
0001165002-21-000093	4					WESTWOOD TRUST
0001165002-21-000093	3					WESTWOOD INTERNATIONAL ADVISORS INC.
0001112520-21-000023	1	0001697927	028-17748			Braddock Partners Offshore, LP
0000859804-21-000010	2	0001484256	028-15568			RiverPark Advisors, LLC
0001104659-21-138019	1		028-19314			Natixis Investment Managers SA
0001104659-21-138018	1		028-19314			Natixis Investment Managers SA
0001104659-21-138014	1		028-19314			Natixis Investment Managers SA
0001104659-21-138006	1		028-19314			Natixis Investment Managers SA
0001567619-21-020003	2	0001230440	028-17085			Neuberger Berman Investment Advisers LLC
0001567619-21-020003	8	0000030163	028-00127			BNY Mellon Investment Adviser, Inc.
0001567619-21-020003	7	0001390777	028-12592			Bank of New York Mellon Corp
0001567619-21-020003	6	0001531987	028-15258			Neuberger Berman Breton Hill ULC
0001567619-21-020003	5	0001497476	028-13986			Neuberger Berman Trust Co of Delaware N.A.
0001567619-21-020003	4	0001497372	028-13985			Neuberger Berman Trust Co N.A.
0001567619-21-020003	1	0001469000	028-13575			NB Alternatives Advisers LLC
0001567619-21-020003	3	0001640762	028-16869			Neuberger Berman Asia Ltd
0001104659-21-138004	1					Natixis Securities America LLC
0001104659-21-138004	6					Natixis Assurances
0001104659-21-138004	5					Natixis North America
0001104659-21-138004	4					Coface
0001104659-21-138004	3					Nexgen Capital Limited
0001104659-21-138004	2					Natixis Wealth Management
0000927971-21-000008	4	0001319184	028-11312			F&C Asset Management plc
0000927971-21-000008	5	0000772028	028-17436			BMO CAPITAL MARKETS CORP.
0000927971-21-000008	6	0001673962	028-17442			BMO Family Office, LLC
0000927971-21-000008	7	0001526648				BMO Harris Bank NA
0000927971-21-000008	8	0001599966	028-16021			BMO NESBITT BURNS INC.
0000927971-21-000008	9	0001600095	028-16020			BMO PRIVATE INVESTMENT COUNSEL INC.
0000927971-21-000008	10	0001673945	028-17429			Pyrford International Ltd
0000927971-21-000008	11	0001336488	028-11481			Stoker Ostler Wealth Advisors, Inc.
0000927971-21-000008	1	0001674398	028-17461			Bank of Montreal Europe Plc
0000927971-21-000008	2	0001599763	028-16017			BMO ASSET MANAGEMENT CORP.
0000927971-21-000008	3	0001600094	028-16018			BMO Asset Management Inc.
0000950103-21-017763	2	0001393014	028-18537			Angelakis Michael J
0000950103-21-017763	1	0001671185	028-18540			Atairos Partners, L.P.
0001446114-21-000058	2					Clutterbuck Capital Management LLC
0001446114-21-000058	1	0001657660	028-17014			ANCORA FAMILY WEALTH ADVISORS, LLC
0001446114-21-000058	3	0001836192	028-21227			Ancora Alternatives LLC
0001772715-21-000005	2	0001088084				GOLDMAN SACHS ASSET MANAGEMENT/
0001772715-21-000005	4	0001569366				PARAMETRICA ASSET MANAGEMENT LTD.
0001772715-21-000005	3	0001463893				Nuveen Asset Management
0001772715-21-000005	1	0000847442				CINCINNATI ASSET MANAGEMENT INC /ADV
0001446114-21-000057	2					Clutterbuck Capital Management LLC
0001446114-21-000057	3	0001836192	028-21227			Ancora Alternatives LLC
0001446114-21-000057	1	0001657660	028-17014			ANCORA FAMILY WEALTH ADVISORS, LLC
0001166588-21-000006	2	0000872786	028-04059			BNP PARIBAS
0001166588-21-000006	1	0001197610	028-10283			BNP PARIBAS SECURITIES CORP
0001446114-21-000056	2					Clutterbuck Capital Management LLC
0001446114-21-000056	1	0001657660	028-17014			ANCORA FAMILY WEALTH ADVISORS, LLC
0001446114-21-000055	1	0001657660	028-17014			ANCORA FAMILY WEALTH ADVISORS, LLC
0001446114-21-000055	2					Clutterbuck Capital Management LLC
0001446114-21-000054	1	0001657660	028-17014			ANCORA FAMILY WEALTH ADVISORS, LLC
0001446114-21-000054	2					Clutterbuck Capital Management LLC
0000919574-21-006810	1	0001572706	028-15489			Okumus Opportunistic Value Fund Ltd.
0001446114-21-000053	1	0001657660	028-17014			ANCORA FAMILY WEALTH ADVISORS, LLC
0001446114-21-000053	2	0001276525	028-10830			DIKER MANAGEMENT LLC
0000919574-21-006808	1	0001697682	028-17816			BISHOP ROCK OPPORTUNITY MASTER FUND, L.P.
0000919574-21-006805	1	0001458862	028-18769			Contrarian Emerging Markets, L.P.
0001085936-21-000023	1	0001004434	028-04975			AFFILIATED MANAGERS GROUP, INC.
0001420506-21-001545	1	0001536054	028-14917			Crestline Management, LP
0001648711-21-000009	3	0001728280				Strategas Asset Management, LLC
0001648711-21-000009	2					Baird Financial Corporation
0001648711-21-000009	1	0000810972	028-01911			BAIRD ROBERT W & CO INC /WI/
0001648711-21-000009	4	0001442181	028-13162			BAIRD TRUST Co
0001548997-21-000005	2					GGCOF Executive Co-Invest, L.P.
0001548997-21-000005	1		028-14374			GGC Opportunity Fund Management, L.P.
0001567619-21-019987	1	0000790504	028-01678			BARON CAPITAL MANAGEMENT INC /NY/
0001567619-21-019987	2					VOYA INVESTMENTS, LLC
0001567619-21-019984	14					Schroder & Co. (Asia) Limited
0001567619-21-019984	4	0001080249				SCHRODER INVESTMENT MANAGEMENT HONG KONG LTD
0001567619-21-019984	12					Schroder & Co Bank AG
0001567619-21-019984	11					Schroder Investment Management (Taiwan) Limited
0001567619-21-019984	10					Schroder Real Estate Investment Management Limited
0001567619-21-019984	9					Schroder (C.I.) Limited
0001567619-21-019984	8					Schroder Investment Management Switzerland AG
0001567619-21-019984	7					Schroder & Co Limited
0001567619-21-019984	6	0001080250				SCHRODER INVESTMENT MANAGEMENT SINGAPORE LTD
0001567619-21-019984	13					Schroder Wealth Management (US) Limited
0001567619-21-019984	3					Schroder Investment Management Limited
0001567619-21-019984	2	0001422318				Schroder Investment Management North America Ltd
0001567619-21-019984	1	0001105005	028-04731-01			SCHRODER INVESTMENT MANAGEMENT NORTH AMERICA INC/ DE
0001567619-21-019984	5	0001080247				SCHRODER INVESTMENT MANAGEMENT JAPAN LTD
0001661140-21-000006	1	0001536054	028-14917			Crestline Management, LP
0000049969-21-000011	9					Evernorth Behavioral Health of Texas, Inc.
0000049969-21-000011	2					CIGNA VENTURES
0000049969-21-000011	4	0000701221	028-01157			Cigna Holding Co
0000049969-21-000011	3					Cigna Health and Life Insurance Company
0000049969-21-000011	8					LINA Life Insurance Company of Korea
0000049969-21-000011	7					Cigna HealthCare of North Carolina, Inc.
0000049969-21-000011	6					Cigna Foundation
0000049969-21-000011	5					NewQuest, LLC
0000049969-21-000011	1					Connecticut General Life Insurance Company
0000919574-21-006787	1	0001710524	028-18093			Peak Capital Management LLC
0000950123-21-014929	1		028-11405			Nuveen Investments, Inc.
0000950123-21-014929	9		028-00331			Teachers Insurance and Annuity Association of America
0000950123-21-014929	7		028-01474			NWQ Investment Management Company, LLC
0000950123-21-014929	5		028-11405			Santa Barbara Asset Management, LLC
0000950123-21-014929	4		028-04800			Teachers Advisors, LLC
0000950123-21-014929	3		028-03194			TIAA-CREF Investment Management, LLC
0000950123-21-014929	2		028-11710			Nuveen Fund Advisors, LLC
0001828301-21-000003	3	0001828298	028-21221			XTX Holdings LLC
0001828301-21-000003	4	0001715650	028-19979			XTX MARKETS LLC
0001828301-21-000003	2	0001747035	028-19981			XTX Holdings Ltd
0001828301-21-000003	1	0001828300	028-21219			XTX Midco Ltd
0001481986-21-000007	9					DRW Europe B.V.
0001481986-21-000007	1					DRW Securities, LLC
0001214659-21-011561	1	0001667084	028-17335			LUCIANI PAULA M.
0001764059-21-000012	1					WCM Investment Management
0000919574-21-006780	4	0001598759	028-15856			LANSDOWNE DM LONG ONLY CAYMAN MASTER LP
0000919574-21-006780	3	0001598751	028-15855			LANSDOWNE DEVELOPED MARKETS LONG ONLY MASTER FUND LTD
0000919574-21-006780	1	0001469444	028-13736			LANSDOWNE DEVELOPED MARKETS STRATEGIC INVESTMENT MASTER FUND LTD
0000919574-21-006780	5	0001666581	028-17195			Lansdowne Lothbury Master Fund Ltd
0000919574-21-006780	6	0001730667	028-18401			LANSDOWNE ENERGY DYNAMICS MASTER L.P.
0000919574-21-006780	7	0001644532	028-17196			LANSDOWNE DMLO DAVIES STREET LP
0000919574-21-006780	8	0001845780				Lansdowne European Absolute Opportunities Master Fund Ltd.
0000919574-21-006780	2	0001548945	028-14977			LANSDOWNE DEVELOPED MARKETS MASTER FUND LTD
0001172661-21-002164	1	0001696876	028-17706			AII Insurance Management Ltd. (Bermuda)
0001172661-21-002164	2	0001810661	028-20268			AmTrust Bermuda I Ltd.
0001172661-21-002163	1	0001125816	028-06487			FIRST TRUST ADVISORS LP
0001172661-21-002163	2	0001673385	028-17446			Morningstar Investment Management LLC
0001172661-21-002163	4	0001308668	028-10998			GuideStone Capital Management, LLC
0001172661-21-002163	3	0000908758	028-14511			American Beacon Advisors, Inc.
0001298088-21-000029	2	0001179157				CIBC Private Wealth Advisors, Inc.
0001298088-21-000029	1	0001607902				CIBC National Trust Co
0001594417-21-000006	1	0001539204	028-18152			Crossmark Global Holdings, Inc.
0001594417-21-000006	2	0001407543	028-13411			ENVESTNET ASSET MANAGEMENT INC
0000919574-21-006772	1	0001226544	028-12362			Arrow Partners LP
0001725296-21-000017	3	0000813905	028-02009			BANK OF NEW YORK MELLON
0001725296-21-000017	4	0000030163	028-00127			BNY Mellon Investment Adviser, Inc.
0001725296-21-000017	2	0001696076	028-17771			Griffin Capital Advisor, LLC
0001725296-21-000017	5	0001390777				Bank of New York Mellon Corp
0001667731-21-000290	2	0001127998	028-14529			JUMP TRADING, LLC
0001667731-21-000290	1	0001831304	028-20373			Jump Trading Holdings, LLC
0001667731-21-000290	3	0001831307	028-20370			Leap GP LLC
0001667731-21-000290	4	0001779672	028-19573			Leap Investments LP
0001357550-21-000074	1	0001357643				WEISS ANDREW M
0001357550-21-000074	2	0001298983				BIP GP LLC
0001567619-21-019962	1	0001577920	028-15534			Veritas Investment Management (UK) Ltd
0000900973-21-000010	2		028-06325			New York Life Investment Management LLC
0000900973-21-000010	1		028-11405			Nuveen Investments, Inc.
0000919574-21-006770	1	0001731167	028-18470			MANA Omega Master Fund LP
0001739439-21-000019	1	0000315123	028-00926			ROCKEFELLER & CO. LLC
0001739439-21-000019	2	0000866998	028-02772			ROCKEFELLER TRUST COMPANY, N.A.
0001739439-21-000019	3	0001292819	028-11086			Rockefeller Trust Co (Delaware)
0001739439-21-000019	4	0001723502	028-19121			ROCKEFELLER FINANCIAL LLC
0000950123-21-014898	5		028-05267			Macquarie Investment Management Business Trust
0000950123-21-014898	6		028-06487			First Trust Advisors L.P.
0000950123-21-014898	7		028-14981			Macquarie Investment Management Austria Kapitalanlage AG
0000950123-21-014898	8		028-16230			Jackson Square Partners, LLC
0000950123-21-014898	9					Macquarie Investmenet Management Australia Limited
0000950123-21-014898	4		028-10368			Ivy Investment Management Company
0000950123-21-014898	10		028-17868			ValueInvest Asset Management S.A.
0000950123-21-014898	3		028-13126			Macquarie Investment Management Global Limited
0000950123-21-014898	1		028-13122			Macquarie Bank Limited
0000950123-21-014898	2		028-13124			Macquarie Investment Management Limited
0001104659-21-137859	1	0001770024	028-21210			Crossingbridge Advisors, LLC
0001567619-21-019951	1	0001762776	028-19457			Kore Private Wealth LLC
0001145443-21-000383	8	0001230788	028-19939			JOHN HANCOCK INVESTMENT MANAGEMENT LLC
0001145443-21-000383	7	0001528732	028-14594			Manulife Investment Management (Europe) Ltd
0001145443-21-000383	6	0001553998	028-15006			Manulife Investment Management (Hong Kong) Ltd
0001145443-21-000383	5	0001254859	028-10490			Manulife Investment Management (North America) Ltd
0001145443-21-000383	4	0001034182	028-03673			MANULIFE INVESTMENT MANAGEMENT (US) LLC
0001145443-21-000383	3	0001073894	028-15079			JOHN HANCOCK LIFE INSURANCE CO USA
0001145443-21-000383	1	0001086888	028-11519			MANULIFE FINANCIAL CORP
0001145443-21-000383	2	0001343498	028-11524			Manulife Investment Management Ltd
0000902584-21-000007	1	0001754305	028-19569			North Square Investments, LLC
0001567619-21-019942	6	0001520225	028-14783			Credit Suisse Fund Management S.A.
0001567619-21-019942	11	0001540418	028-14785			Credit Suisse Funds AG
0001567619-21-019942	7	0001461305	028-13525			Credit Suisse Management LLC
0001567619-21-019942	10	0001343078	028-11518			CREDIT SUISSE SECURITIES (EUROPE) LTD
0001567619-21-019942	9	0001446355	028-13203			Credit Suisse Securities (Canada), Inc.
0001567619-21-019942	12	0001230485	028-11380			CREDIT SUISSE SECURITIES (USA) LLC
0001567619-21-019942	8	0001452282	028-13460			CREDIT SUISSE HEDGING-GRIFFO SERVICOS INTERNACIONAIS S.A.
0001567619-21-019942	13	0001335627	028-11477			CREDIT SUISSE CAPITAL LLC/
0001567619-21-019942	14	0001428599	028-13035			Credit Suisse (Italy) S.p.a.
0001567619-21-019942	3	0000903954	028-03702			CREDIT SUISSE ASSET MANAGEMENT LLC/NY
0001567619-21-019942	5	0001540416	028-14772			MultiConcept Fund Management S.A.
0001567619-21-019942	4	0001343079	028-11516			CREDIT SUISSE INTERNATIONAL
0001193805-21-001572	1	0001731593	028-18623			Scoggin GP LLC
0000021175-21-000121	3		28-387			Continental Casualty Company
0000021175-21-000121	2		28-172			The Continental Corporation
0000021175-21-000121	1		28-217			Loews Corporation
0001085146-21-003197	3	0001771015	028-19614			Cowen Financial Products LLC
0001402828-21-000007	1	0001402828	028-16067			ARROWSTREET CAPITAL HOLDING LLC
0000932974-21-000005	428	0001598011	028-15768			Moreno Evelyn V
0000932974-21-000005	400	0001592615	028-16092			Page Arthur B
0001512020-21-000015	1	1512014				Kepos Partners LLC
0001591505-21-000006	1	0001591478	028-16131			Swan Capital Management, LLC
0000869772-21-000006	1	0001744219	028-21353			Eldridge Industries, LLC
0001027848-21-000009	4	0000315043	028-00472			SWISS REINSURANCE CO LTD
0001027848-21-000009	3					Swiss Re Life Capital Americas Holding Inc
0001027848-21-000009	1	0001794236	028-19632			Swiss Re Corporate Solutions Ltd
0001027848-21-000009	2	0001027848	028-05948			SWISS RE AMERICA HOLDING CORP
0001688882-21-000007	1	0001703455				FS Fund Advisor, LLC
0000313028-21-000037	4	0000908758	028-14511			American Beacon Advisors, Inc.
0000313028-21-000037	1	0001647273	028-18148			Perpetual Ltd
0001214659-21-011526	1	0001458762	028-14291			DEKEL PARTNERS, L.P.
0001214659-21-011526	2	0001679606	028-17788			Adom Partners, L.P.
0000892712-21-000333	1		028-14476			Bexil Advisers LLC
0001592828-21-000007	1	0001726262	028-21202			Gadsden, LLC
0001592828-21-000007	2	0001467517	028-18282			Freedom Day Solutions, LLC
0000870156-21-000059	3		028-19416			Geoffrey Todd Gervasini
0000870156-21-000059	2		028-19414			Wakefield Wealth Management, LLLP
0000870156-21-000059	1		028-19415			Wakefield Asset Management Corp.
0000892712-21-000330	1		028-13748			Johnson Bank
0000892712-21-000330	2		028-17498			Johnson Wealth Inc.
0001567619-21-019885	3	0001455301	028-13391			NOMURA ASSET MANAGEMENT SINGAPORE Ltd
0001567619-21-019885	2	0001332826	028-11455			Nomura Asset Management U.K. Ltd
0001567619-21-019885	1	0001568445	028-15407			Nomura Asset Management Malaysia Sdn. Bhd.
0001567619-21-019885	5	0001674607	028-17454			Nomura Asset Management Taiwan Ltd.
0001567619-21-019885	6	0001831764	028-20377			Nomura Asset Management Europe KVG mbH
0001567619-21-019885	4	0001672271	028-17455			Nomura Islamic Asset Management Sdn. Bhd.
0001567619-21-019880	1	0001177853	028-10251			TRUSTMARK INVESTMENT ADVISORS INC
0001592828-21-000006	2	0001467517	028-18282			Freedom Day Solutions, LLC
0001592828-21-000006	1	0001726262	028-21202			Gadsden, LLC
0000038777-21-000173	1	0001034883	028-06254			MARTIN CURRIE INC
0000038777-21-000173	2	0001034882	028-06256			MARTIN CURRIE INVESTMENT MANAGEMENT LTD
0001276918-21-000010	1	0001319111	028-11308			Virtus Fund Advisers, LLC
0001085146-21-003195	1	0001535090	028-14605			Parametrica Asset Management Ltd
0000873630-21-000005	9	0001581771	028-15555			HSBC PRIVATE BANK (SUISSE) LTD
0000873630-21-000005	10	0001600216	028-15975			Hongkong & Shanghai Banking Corp Ltd / ASP
0000873630-21-000005	14	0001092524	028-17084			HSBC SECURITIES USA INC
0000873630-21-000005	11	0001140465	028-15563			HSBC BANK PLC
0000873630-21-000005	12	0001732101	028-18663			HSBC GLOBAL ASSET MANAGEMENT (MEXICO), SA DE CV, SOCIEDAD OPERADORA DE FONDOS DE INVERSION, GRUPO FINANCIERO HSBC
0000873630-21-000005	13	0001581450	028-15547			HSBC GLOBAL ASSET MANAGEMENT (DEUTSCHLAND) GMBH
0000873630-21-000005	8	0001706499	028-18048			Hang Seng Investment Management Ltd
0000873630-21-000005	1	0001582152	028-15552			HSBC Bank USA, N.A.
0000873630-21-000005	2	0001455270	028-15530			HSBC Global Asset Management (Hong Kong) Ltd
0000873630-21-000005	3	0001578984	028-15532			HSBC International Trustee Ltd
0000873630-21-000005	4	0001580862	028-15540			HSBC Global Asset Management (UK) Ltd
0000873630-21-000005	5	0001581251	028-15545			HSBC GLOBAL ASSET MANAGEMENT (FRANCE)
0000873630-21-000005	6	0001580935	028-15539			HSBC Global Asset Management (Canada) LTD
0000873630-21-000005	7	0001581449	028-15546			HSBC Trinkaus & Burkhardt AG, Germany
0000749044-21-000006	1					Torrington Savings Bank
0001532155-21-000132	10	0000033179	028-20164			EQUITABLE ADVISORS, LLC
0001532155-21-000132	5	0001536185	028-14633			Equitable Investment Management Group, LLC
0001601407-21-000005	1					none
0001226886-21-000005	1	0001132700	028-06661			SAXON WOODS ADVISORS LLC
0001793904-21-000005	2		028-19649			55I LLC
0001793904-21-000005	1		028-14921			ATRIA INVESTMENTS LLC
0001606720-21-000004	1	0001133639	028-06325			NEW YORK LIFE INVESTMENT MANAGEMENT LLC
0001606720-21-000004	2	0001415996	028-13712			IndexIQ Advisors LLC
0000936753-21-000089	1	0000073124	028-00290			NORTHERN TRUST CORP
0001763409-21-000006	1	0001221362	028-10434			Avalon Investment & Advisory
0000038777-21-000172	8	0001023875	028-06154			FRANKLIN MUTUAL ADVISERS LLC
0000038777-21-000172	9	0001368427	028-12310			Franklin Templeton Institutional, LLC
0000038777-21-000172	10	0001766900	028-19123			Franklin Templeton International Services S.a r.l
0000038777-21-000172	11	0001717978	028-18545			Franklin Templeton Investimentos (Brasil) Ltda
0000038777-21-000172	12	0001200138	028-11761			FRANKLIN TEMPLETON INVESTMENT MANAGEMENT LTD
0000038777-21-000172	13	0001200139	028-11855			FRANKLIN TEMPLETON INVESTMENTS ASIA LTD
0000038777-21-000172	14	0001349203	028-11753			Franklin Templeton Investments Australia LTD
0000038777-21-000172	15	0001132702	028-06143			FRANKLIN TEMPLETON INVESTMENTS CORP
0000038777-21-000172	16	0001039348	028-11763			TEMPLETON ASSET MANAGEMENT LTD
0000038777-21-000172	17	0001014885	028-05454			TEMPLETON GLOBAL ADVISORS LTD
0000038777-21-000172	18	0000315282	028-01074			TEMPLETON INVESTMENT COUNSEL LLC
0000038777-21-000172	19	0001303095	028-17200			K2/D&S MANAGEMENT CO LLC
0000038777-21-000172	7	0001027814	028-05930			FRANKLIN ADVISORY SERVICES LLC
0000038777-21-000172	6	0000898420	028-03578			FRANKLIN ADVISERS INC
0000038777-21-000172	5	0001424480	028-13852			FIDUCIARY TRUST INTERNATIONAL LLC
0000038777-21-000172	4	0001689636	028-17561			FIDUCIARY TRUST Co OF CANADA
0000038777-21-000172	3	0001560808	028-15057			Fiduciary Trust Co International of Pennsylvania
0000038777-21-000172	2	0000941407	028-03877			FIDUCIARY TRUST CO INTERNATIONAL
0000038777-21-000172	1	0001313926	028-13078			Edinburgh Partners Ltd
0001085146-21-003178	1	0001079817	028-04859			BROWN INVESTMENT ADVISORY & TRUST CO
0001085146-21-003178	2	0001114667	028-05775			Brown Advisory LLC
0001085146-21-003178	3	0001742040	028-18857			Brown Advisory Ltd
0001085146-21-003178	4	0001542162	028-14797			Signature Financial Management, Inc.
0001085146-21-003178	5	0001133639	028-06325			NEW YORK LIFE INVESTMENT MANAGEMENT LLC
0000936944-21-000006	3	0001409728	028-12567			Mercer Investments LLC
0000936944-21-000006	4	0000350894	028-16454			SEI INVESTMENTS CO
0001085146-21-003174	1	0001432976	028-13689			Tiedemann Wealth Management Holdings, LLC
0001085146-21-003171	1	0001647273	028-18148			Perpetual Ltd
0001085146-21-003170	1	0001647273	028-18148			Perpetual Ltd
0001085146-21-003168	1	0001403438	028-12526			LPL Financial LLC
0000950123-21-014851	1					Bregal Investments, Inc.
0000950123-21-014851	2					Bregal North America General Partner Jersey Ltd.
0000950123-21-014849	1					Bregal North America General Partner Jersey Ltd.
0000950123-21-014849	2					Bregal Sagemount I, L.P.
0000354204-21-000710	3	0001767761				Dimensional Fund Advisors Pte. Ltd.
0000354204-21-000710	2	0001463464	028-13500			DFA Australia Ltd.
0000354204-21-000710	1	0001463225	028-13501			Dimensional Fund Advisors Ltd.
0000940445-21-000009	1	0001800752				Camden Capital, LLC
0000950123-21-014848	2					Bregal Investments, Inc.
0000950123-21-014848	1					Bregal Sagemount I, L.P.
0001085146-21-003163	5					Vector WM
0001085146-21-003163	4					Thornburg
0001085146-21-003163	3					Parametric
0001085146-21-003163	2					Other
0001085146-21-003163	1					Anchor
0000950123-21-014846	2		028-12247			Kevin D. Eng
0000950123-21-014846	1		028-12245			CHC Partners, L.L.C.
0001567619-21-019850	2	0000908758	028-14511			American Beacon Advisors, Inc.
0001567619-21-019850	1	0000796370	028-11931			BrightSphere Inc.
0001567619-21-019847	1	0001859679	028-21212			GREENWOODS INVESTMENTS SG PTE. LTD.
0001567619-21-019847	2	0001577133	028-17006			Greenwoods Asset Management Ltd
0001053906-21-000009	6	0001340096	028-11522			Invus Public Equities Advisors, LLC
0001053906-21-000009	5	0001766952	028-19088			Artal Treasury Ltd
0001053906-21-000009	4	0001218180	028-15033			Artal International S.C.A.
0001053906-21-000009	3	0001522131	028-15031			Artal International Management S.A.
0001053906-21-000009	2	0001283968	028-15029			Westend S.A.
0001053906-21-000009	1	0001460840	028-15028			Stichting Administratiekantoor Westend
0001053906-21-000009	7	0001053905	028-19506			Artal Luxembourg S. A.
0001356513-21-000005	1		028-00290			Northern Trust Corporation
0001085146-21-003148	2	0001597920	028-15749			Axel Blair
0001085146-21-003148	1	0001389964	028-15748			Salzhauer Henry
0000930413-21-001871	1	0001229918				GAM INTERNATIONAL MANAGEMENT LTD
0000930413-21-001871	2					GAM INVESTMENT MANAGEMENT (SWITZERLAND) AG
0001172661-21-002156	1	0001638266	028-17229			HARBOR SPRING MASTER FUND, LP
0000312348-21-000040	2		028-13087			Loomis Sayles Trust Company, LLC
0001123778-21-000010	1	0000009631	028-11475			BANK OF NOVA SCOTIA
0001104659-21-137705	2	0001492070	028-13934			AIG Asset Management (U.S.), LLC
0001104659-21-137705	1	0000863926	028-02725			SUNAMERICA ASSET MANAGEMENT, LLC
0001085146-21-003114	6	0001447578	028-13256			RIVERNORTH CAPITAL MANAGEMENT, LLC
0001085146-21-003114	7	0001415996	028-13712			IndexIQ Advisors LLC
0001085146-21-003114	5	0001162695	028-10044			MCMORGAN & CO LLC
0001085146-21-003114	4	0001269119	028-10748			OPPENHEIMER ASSET MANAGEMENT INC.
0001085146-21-003114	3	0000071633	028-00065			NEW YORK LIFE INSURANCE CO
0001085146-21-003114	2	0001125816	028-06487			FIRST TRUST ADVISORS LP
0001085146-21-003114	1	0001133639	028-06325			NEW YORK LIFE INVESTMENT MANAGEMENT LLC
0001567619-21-019833	1	0001172469	028-10255			BESSEMER INVESTMENT MANAGEMENT LLC
0001567619-21-019833	2	0000011788	028-00356			BESSEMER SECURITIES CORP
0001567619-21-019833	8	0000700683	028-01102			BESSEMER TRUST Co OF FLORIDA
0001567619-21-019833	7	0001326232	028-11458			Bessemer Trust CO of Delaware, N.A.
0001567619-21-019833	6	0001326197	028-11457			Bessemer Trust Co of California, N.A.
0001567619-21-019833	5	0000316744	028-00563			BESSEMER TRUST Co NATIONAL ASSOCIATION
0001567619-21-019833	4	0000011790	028-00587			BESSEMER TRUST CO
0001567619-21-019833	3	0001023279	028-07250			BESSEMER SECURITIES LLC
0001085146-21-003107	21					Columbia Management
0001085146-21-003107	22					Congress Asset Management
0001085146-21-003107	23					Cove Street Capital
0001085146-21-003107	24					Cramer Rosenthal McGlynn
0001085146-21-003107	25					Davis Advisors
0001085146-21-003107	26					Delaware Capital Management
0001085146-21-003107	27					DeRoy & Deveraux
0001085146-21-003107	28					Dearborn Partners
0001085146-21-003107	29					Earnest Partners
0001085146-21-003107	30					Eaton Vance
0001085146-21-003107	31					Epoch Investment
0001085146-21-003107	34					Good Harbor Financial
0001085146-21-003107	36					GW&K Investment Management
0001085146-21-003107	38					Harding Loevner Managed Accts
0001085146-21-003107	39					Invesco Advisors
0001085146-21-003107	40					The Ithaka Group
0001085146-21-003107	41					Jennison Associates
0001085146-21-003107	42					Lyrical Asset Management
0001085146-21-003107	43					MacKay Shields
0001085146-21-003107	44					Madison Investment Advisors
0001085146-21-003107	46					MetWest Capital Management
0001085146-21-003107	47					Miller Howard
0001085146-21-003107	48					Montag & Caldwell
0001085146-21-003107	51					Oak Ridge Investments
0001085146-21-003107	1					ACR Alpine Capital Research
0001085146-21-003107	2					Alger
0001085146-21-003107	54					Penn Capital
0001085146-21-003107	55					Poplar Forest Capital
0001085146-21-003107	56					Reinhart Partners
0001085146-21-003107	57					Riverbridge Partners
0001085146-21-003107	58					RNC Genter Capital Mgmt
0001085146-21-003107	59					Roosevelt Investment Group
0001085146-21-003107	60					Sage Advisory Services
0001085146-21-003107	61					Salient Capital Advisors
0001085146-21-003107	62					SaratogaRIM
0001085146-21-003107	63					Schafer Cullen Capital Mgmt
