0001812046-20-000018	1	0001329948	028-11413			Janney Montgomery Scott LLC
0001451531-20-000003	1	0000923338	028-10337			KOCH INDUSTRIES INC
0001567619-20-015017	11	0000924192	028-04302			ALLSTATE INVESTMENT MANAGEMENT CO
0001567619-20-015017	12	0001206333	028-10298			ALLSTATE INVESTMENTS LLC
0000897423-20-000090	1		028-18015			Robert M. Bass
0000897423-20-000089	1		028-18015			Robert M. Bass
0001567619-20-015010	7	0001335241	028-11442			CA Indosuez (Suisse) SA
0001567619-20-015010	1	0001330437	028-11418			Credit Agricole Corporate & Investment Bank
0001567619-20-015010	6	0001330773	028-11417			CA Indosuez Wealth (Europe)
0001567619-20-015010	3	0001697575	028-17739			CREDIT AGRICOLE INDOSUEZ GESTION
0001567619-20-015010	4	0001696434	028-17742			CREDIT AGRICOLE INDOSUEZ WEALTH (GROUP)
0001567619-20-015010	2	0001697576	028-17741			CREDIT AGRICOLE INDOSUEZ WEALTH (FRANCE)
0001567619-20-015010	5	0001696409	028-17740			CREDIT AGRICOLE INDOSUEZ WEALTH (AM)
0000950123-20-008561	1		28-04382			American National Insurance Company
0001104659-20-094419	1		028-19314			Natixis Investment Managers SA
0001104659-20-094418	1		028-19314			Natixis Investment Managers SA
0001567619-20-014990	7					Schroder & Co Limited
0001567619-20-014990	6	0001080250				SCHRODER INVESTMENT MANAGEMENT SINGAPORE LTD
0001567619-20-014990	5	0001080247				SCHRODER INVESTMENT MANAGEMENT JAPAN LTD
0001567619-20-014990	3					Schroder Investment Management Limited
0001567619-20-014990	2	0001422318				Schroder Investment Management North America Ltd
0001567619-20-014990	1	0001105005	028-04731-01			SCHRODER INVESTMENT MANAGEMENT NORTH AMERICA INC/ DE
0001567619-20-014990	12					Schroder & Co Bank AG
0001567619-20-014990	11					Schroder Investment Management (Taiwan) Limited
0001567619-20-014990	10					Schroder Real Estate Investment Management Limited
0001567619-20-014990	4	0001080249				SCHRODER INVESTMENT MANAGEMENT HONG KONG LTD
0001567619-20-014990	9					Schroder (C.I.) Limited
0001567619-20-014990	8					Schroder Investment Management Switzerland AG
0001104659-20-094416	1		028-19314			Natixis Investment Managers SA
0001085146-20-002170	1	0001070304	028-18337			ORIX CORP
0001104659-20-094415	1		028-19314			Natixis Investment Managers SA
0001104659-20-094413	1		028-19314			Natixis Investment Managers SA
0001104659-20-094411	1	0001535815	028-19314			Natixis Investment Managers SA
0001104659-20-094411	2	0000936828				GIC Private Ltd
0001104659-20-094409	3					Nexgen Capital Limited
0001104659-20-094409	2					Natixis Wealth Management
0001104659-20-094409	6					Natixis Assurances
0001104659-20-094409	5					Natixis North America
0001104659-20-094409	4					Coface
0001104659-20-094409	1					Natixis Securities America LLC
0000919574-20-004998	1	0001802726	028-19849			Nucleo Master Fundo De Investimento De Acoes
0001388443-20-000003	1	0001364615				Aperio Group, LLC
0001140022-20-000012	6	0001730908				Aviva Italia Holdings SpA
0001140022-20-000012	1	0001140211	028-06503			AVIVA INVESTORS GLOBAL SERVICES LTD
0001140022-20-000012	2	0001713231	028-18104			Aviva Investors Asia PTE Ltd
0001140022-20-000012	3	0001145937	028-06615			AVIVA INVESTORS FRANCE SA
0001140022-20-000012	6	0001817620				Aviva Investors Americas LLC
0001606720-20-000003	1	0001133639	028-06325			NEW YORK LIFE INVESTMENT MANAGEMENT LLC
0001606720-20-000003	2	0001415996	028-13712			IndexIQ Advisors LLC
0000950123-20-008534	2		28-12592			The Bank of New York Mellon Corporation
0000950123-20-008530	1		28-13926			Meiji Yasuda Life Insurance Company
0001534653-20-000007	1	0001667108	028-17381			SEB Investment Management AB
0000897101-20-000669	1	0001053046	028-19972			SIT FIXED INCOME ADVISORS II LLC /ADV
0000950123-20-008510	2		028-12247			Kevin D. Eng
0000950123-20-008510	1		028-12245			CHC Partners, L.L.C.
0000950123-20-008501	1		28-11884			Pictet Asset Management SA
0000950123-20-008492	6		028-16989			First State Investments (Singapore)
0000950123-20-008492	7		028-19145			First Sentier Investors (Australia) RE Ltd
0000950123-20-008492	8		028-13582			MITSUBISHI UFJ FINANCIAL GROUP INC
0000950123-20-008492	5		028-14523			First State Investments International Limited
0000950123-20-008492	3		028-06518			First State Investment Management (UK) Limited
0000950123-20-008492	2		028-14423			First Sentier Investors (Australia) IM Ltd
0000950123-20-008492	1		028-14419			First Sentier Investors Realindex Pty Ltd
0000950123-20-008492	4		028-14420			First State Investments (Hong Kong) Limited
0001632572-20-000004	1	0001632572				Ward Ferry Management Ltd
0001214659-20-007012	1	0001786380	028-19584			Stonehage Fleming Investment Management Ltd
0001178913-20-002378	1	0001599855	028-15864			Sphera Global Healthcare GP Ltd.
0001178913-20-002378	2	0001599854	028-15865			Sphera Global Healthcare Management LP
0000950123-20-008443	1		028-14422			Colonial Holding Company Ltd
0000950123-20-008443	5		028-14421			Colonial First State Investments Limited
0000950123-20-008443	4		028-14417			Capital 121 Pty Ltd
0000950123-20-008443	3		028-14425			East Topco Ltd
0000950123-20-008443	2		028-14418			Commonwealth Insurance Holdings Limited
0000921895-20-002175	1	0001733570	028-19294			Brandon Cheryl
0000921895-20-002175	2	0001733572	028-19291			Elishis Isser
0000921895-20-002175	3	0001733612	028-19290			Schoor Kalman
0000921895-20-002175	4	0001733575	028-19285			Toor Kanwaljit
0000921895-20-002175	5	0001733580	028-19297			Wells Richard J.
0001364615-20-000008	1	0001466170	028-13935			MORGAN STANLEY SMITH BARNEY LLC
0000927628-20-000247	1	0001679524	028-19007			United Income, Inc.
0000921895-20-002185	2	0001744289	028-18891			GCM, L.L.C.
0000921895-20-002185	1	0001403169	028-18070			Grosvenor Capital Management, L.P.
0001606152-20-000008	1					Yasumitsu Shigeta
0000814375-20-000025	1	0001697103				Donald Smith, L.P.
0001532155-20-000159	6	0000750443	028-01432			STEWART W P & CO LTD
0001532155-20-000159	1	0001333986	028-19172			Equitable Holdings, Inc.
0001567619-20-014943	1					MPA Capital Management LLC
0000950123-20-008388	2		28-19199			The Column Group II GP, LP
0000950123-20-008388	9		28-19919			Ponoi Capital II, LP
0000950123-20-008388	8		28-19915			Tim Kutzkey
0000950123-20-008388	7		28-19916			Ponoi Management, LLC
0000950123-20-008388	6		28-19917			Ponoi Capital, LP
0000950123-20-008388	5		28-16411			The Column Group GP, LP
0000950123-20-008388	4		28-16410			The Column Group, LP
0000950123-20-008388	1		28-19198			The Column Group II, LP
0000950123-20-008388	10		28-19918			Ponoi II Management, LLC
0000950123-20-008388	3		28-16413			David Goeddel
0000769993-20-000310	7	0001512546	028-14253			Goldman Sachs Financial Markets, L.P.
0000769993-20-000310	6	0001379383	028-12021			Goldman Sachs Trust Company, N.A.
0000769993-20-000310	5	0001055957	028-06738			AYCO CO L P
0000769993-20-000310	4	0001098457	028-05111			GOLDMAN SACHS BANK AG
0000769993-20-000310	3	0000908777	028-05109			GOLDMAN SACHS INTERNATIONAL
0000769993-20-000310	2	0001229262	028-10981			GOLDMAN SACHS ASSET MANAGEMENT, L.P.
0000769993-20-000310	1	0000769993	028-00687			GOLDMAN SACHS & CO. LLC
0000919574-20-004982	1	0001767143	028-19195			CRESTVIEW MANAGEMENT LLC
0001275218-20-000003	1		028-129569			North Square Investments, LLC
0001085146-20-002148	2	0001569595	028-15217			BTG PACTUAL (UK) Ltd
0001085146-20-002148	3	0001569785	028-15342			BTG Pactual Asset Management S.A. DTVM
0001085146-20-002148	1	0001569579	028-15216			BTG Pactual Asset Management US LLC
0001172661-20-001644	1	0001304265	028-11776			Greywolf Advisors LLC
0000919574-20-004980	1	0000801444	028-10558			TOCQUEVILLE TRUST
0001104659-20-093918	2	0001492070	028-13934			AIG Asset Management (U.S.), LLC
0001104659-20-093918	1	0000863926	028-02725			SUNAMERICA ASSET MANAGEMENT, LLC
0001398344-20-015613	1		028-00085			Virtus Investment Advisers, Inc.
0000950123-20-008362	1		028-06348			Dai-Ichi Life Holdings, Inc.
0000950123-20-008360	1		028-17246			Citizens Bank, National Association
0000950123-20-008360	2		028-19418			Clarfeld Financial Advisors, LLC
0001315863-20-000688	1	0001581079	028-18132			Anson Advisors Inc.
0001033984-20-000006	1		028-06325			New York Life Investment Management LLC
0000950123-20-008351	2					BMO HARRIS BANK N.A.
0000950123-20-008351	72					BMO CAPITAL MARKETS CORP.
0000950123-20-008351	64					PYRFORD INTERNATIONAL LIMITED
0000950123-20-008351	56					BMO FAMILY OFFICE LLC
0000950123-20-008351	4					BMO ASSET MANAGEMENT CORP.
0000950123-20-008351	7					STOKER OSTLER WEALTH ADVISORS, INC.
0000950123-20-008351	15					BMO NESBITT BURNS INC.
0000950123-20-008351	16					BMO PRIVATE INVESTMENT COUNSEL INC.
0000950123-20-008351	21					BMO ASSET MANAGEMENT INC.
0000950123-20-008351	33					F&C ASSET MANAGEMENT
0000950123-20-008351	35					BMO HARRIS FINANCIAL ADVISORS, INC.
0001405086-20-000232	1	0001667084	028-17335			LUCIANI PAULA M.
0001483870-20-000004	1	0001423841	028-12874			Turtle Creek Management, LLC
0001483870-20-000004	2	0001484052	028-13831			Turtle Creek Trust Company, LTA
0001013536-20-000006	1	0000907692	028-16475			SEI INVESTMENTS MANAGEMENT CORP
0000950123-20-008342	1		028-00290			Northern Trust Corp
0000950123-20-008342	2		028-10495			Northern Trust Co
0000919574-20-004970	2	0001810661	028-20268			AmTrust Bermuda I Ltd.
0000919574-20-004970	1	0001696876	028-17706			AII Insurance Management Ltd. (Bermuda)
0001390777-20-000074	59		028-11769			Lockwood Advisors, Inc.
0001390777-20-000074	119		028-20231			Alaska Permanent Fund Corporation
0001390777-20-000074	118		028-05161			Nationwide Fund Advisors
0001390777-20-000074	114		028-12234			Redwood Investments, LLC
0001390777-20-000074	104		028-04634			Moody Aldrich Partners LLC
0001390777-20-000074	96		028-11090			Channing Capital Management
0001390777-20-000074	4		028-17542			BNY Mellon Trust of Delaware
0001390777-20-000074	15		028-02900			Mellon Investments Corporation
0001390777-20-000074	22		028-00127			BNY Mellon Investment Adviser, Inc.
0001390777-20-000074	40		028-04797			Newton Investment Management Limited
0001390777-20-000074	42		028-18785			BNY Mellon Securities Corporation
0001390777-20-000074	48		028-02009			The Bank of New York Mellon
0001390777-20-000074	49		028-00620			BNY Mellon, NA
0001390777-20-000074	51		028-17544			Walter Scott & Partners Limited
0001390777-20-000074	66		028-14511			American Beacon Advisors, Inc.
0001390777-20-000074	69		028-14070			EAM Investors, LLC
0001390777-20-000074	71		028-03935			Geneva Capital Management, LTD
0001390777-20-000074	74		028-05792			Kayne Anderson Rudnick Investment Management, LLC
0001390777-20-000074	77		028-13574			Neuberger Berman Management, LLC
0001390777-20-000074	78		028-12426			Nicholas Investment Partners, L.P.
0001390777-20-000074	80		028-12484			Boston Partners Global Investors, Inc.
0001390777-20-000074	83		028-13672			Walthausen & Co., LLC
0001390777-20-000074	86		028-14862			Granite Investment Partners, LLC
0001390777-20-000074	87		028-10467			Rice Hall James & Associates, LLC
0001390777-20-000074	94		028-17546			BNY Mellon Investment Management Cayman Ltd.
0001144969-20-000010	1	0000919086				PEAR TREE ADVISORS INC
0001062993-20-003851	1	0001560717	028-15165			Horizon Investments, LLC
0001770632-20-000007	1	0001802942	028-19930			Quilter Cheviot Europe Ltd
0001770632-20-000007	2	0001802939	028-19931			Quilter International Isle of Man Ltd
0001770632-20-000007	3	0001802282	028-19932			Quilter Cheviot Ltd
0001272544-20-000002	2	0001026013	028-16553			KOONCE CALVIN SCOTT
0001393825-20-000126	1	0001538853	028-20053			MIRABELLA FINANCIAL SERVICES LLP
0001388167-20-000004	1		028-06354			Victory Capital Management Inc.
0001104659-20-093734	2	0001741145	028-18793			Brandes Investment Partners (Europe) Ltd.
0001104659-20-093734	1	0001542551	028-14898			Brandes Investment Partners & Co.
0001164508-20-000005	1		028-16067			Arrowstreet Capital Holding LLC
0000312069-20-000044	1	0000312070	028-00827			BARCLAYS BANK PLC
0000312069-20-000044	8	0001484219	028-13846			Barclays Capital INC
0000312069-20-000044	99	0001484215	028-13881			Barclays Investment Solutions Ltd
0000312069-20-000044	9	0001074031	028-07404			BARCLAYS CAPITAL SECURITIES LTD
0000312069-20-000044	58	0001505923	028-14040			Barclays Capital Luxembourg SaRL
0000312069-20-000044	44	0001535020	028-14600			Barclays Capital Derivative Funding
0000312069-20-000044	82					Barclays Bank Ireland Public Limited Company
0000312069-20-000044	20	0001484222	028-13878			Barclays Bank (Suisse) SA
0001567619-20-014874	5	0001027350	028-07206			BESSEMER VENTURES INC
0001567619-20-014874	3	0000011788	028-00356			BESSEMER SECURITIES CORP
0001567619-20-014874	4	0001023279	028-07250			BESSEMER SECURITIES LLC
0001567619-20-014874	2	0001658426	028-17042			Bessemer Private Investment Fund I LLC
0001567619-20-014874	1	0001435242	028-13119			BESSEC FUNDING LLC
0001172661-20-001641	3	0000908758	028-14511			American Beacon Advisors, Inc.
0001172661-20-001641	1	0001125816	028-06487			FIRST TRUST ADVISORS LP
0001172661-20-001641	2	0001673385	028-17446			Morningstar Investment Management LLC
0000944234-20-000007	2	0001115419	028-11395			AMG Funds LLC
0000944234-20-000007	1	0001004434	028-04975			AFFILIATED MANAGERS GROUP, INC.
0001567619-20-014870	2	0000908758	028-14511			American Beacon Advisors, Inc.
0001567619-20-014870	1	0000796370	028-11931			BrightSphere Inc.
0001567619-20-014865	12	0001230485	028-11380			CREDIT SUISSE SECURITIES (USA) LLC
0001567619-20-014865	7	0001461305	028-13525			Credit Suisse Management LLC
0001567619-20-014865	6	0001520225	028-14783			Credit Suisse Fund Management S.A.
0001567619-20-014865	5	0001540416	028-14772			MultiConcept Fund Management S.A.
0001567619-20-014865	4	0001343079	028-11516			CREDIT SUISSE INTERNATIONAL
0001567619-20-014865	3	0000903954	028-03702			CREDIT SUISSE ASSET MANAGEMENT LLC/NY
0001567619-20-014865	14	0001428599	028-13035			Credit Suisse (Italy) S.p.a.
0001567619-20-014865	9	0001446355	028-13203			Credit Suisse Securities (Canada), Inc.
0001567619-20-014865	10	0001343078	028-11518			CREDIT SUISSE SECURITIES (EUROPE) LTD
0001567619-20-014865	11	0001540418	028-14785			Credit Suisse Funds AG
0001567619-20-014865	8	0001452282	028-13460			CREDIT SUISSE HEDGING-GRIFFO SERVICOS INTERNACIONAIS S.A.
0001567619-20-014865	13	0001335627	028-11477			CREDIT SUISSE CAPITAL LLC/
0000932024-20-000009	1	0001582681	028-20231			Alaska Permanent Fund Corp
0000950123-20-008318	2					LLR Capital IV, L.P.
0000950123-20-008318	1					LLR Capital III, L.P.
0001276918-20-000009	1	0001319111	028-11308			Virtus Fund Advisers, LLC
0000921895-20-002167	1	0001427289	028-15517			Bylinsky Gregory
0000921895-20-002167	2	0001427290	028-15518			Gramm Jefferson
0001591505-20-000005	1	0001591478	028-16131			Swan Capital Management, LLC
0001567619-20-014843	1	0000200406	028-20072			JOHNSON & JOHNSON
0001137774-20-000108	3	0000946754	028-04217			PGIM, Inc.
0001137774-20-000108	18	0001666044	028-17205			PGIM SECURITIES INVESTMENT TRUST ENTERPRISE
0001137774-20-000108	22	0001730802	028-18406			PRUDENTIAL LIFE INSURANCE COMPANY, LTD.
0001137774-20-000108	14	0001316541	028-11173			QMA LLC
0001137774-20-000108	16	0001455701	028-13416			Prudential Trust Co
0001137774-20-000108	20	0001666188	028-17206			PRUDENTIAL GIBRALTAR FINANCIAL LIFE INSURANCE CO., LTD.
0001123778-20-000008	1	0000009631	028-11475			BANK OF NOVA SCOTIA
0000950123-20-008286	3		028-14970			Thrivent Trust Company
0000950123-20-008286	4		028-17500			MEMBERS Trust Co
0000950123-20-008286	1		028-11983			Thrivent Asset Management, LLC
0000950123-20-008286	2		028-10230			Thrivent Investment Management Inc
0001104659-20-093641	1	0001510062	028-14179			West Financial Services, Inc.
0001104659-20-093641	2	0001810360				SSB Wealth Management, Inc.
0001104659-20-093632	1		028-12046			Sun Life Capital Management (U.S.) LLC
0001104659-20-093632	2		028-12047			Sun Life Assurance Company of Canada
0001356513-20-000004	1		028-00290			Northern Trust Corporation
0000913760-20-000138	1	0001650393	028-17766			SA Stone Investment Advisors Inc.
0001567619-20-014802	1	0001502194	028-14029			Norinchukin Zenkyoren Asset Management Co., Ltd.
0001567619-20-014802	2	0001780738	028-19610			Norinchukin Value Investments Co.,Ltd.
0001739439-20-000011	1	0000315123	028-00926			ROCKEFELLER & CO. LLC
0001739439-20-000011	4	0001723502	028-19121			ROCKEFELLER FINANCIAL LLC
0001739439-20-000011	3	0001292819	028-11086			Rockefeller Trust Co (Delaware)
0001739439-20-000011	2	0000866998	028-02772			ROCKEFELLER TRUST COMPANY, N.A.
0001781942-20-000005	3					Parametric
0001781942-20-000005	2					Meridian Wealth Partners
0001781942-20-000005	1					Blackrock
0000831001-20-000096	9	0001345993	028-11547			Citigroup Derivatives Markets Inc.
0000831001-20-000096	6	0001080104	028-04349			Citicorp Banking Corp
0000831001-20-000096	11	0001279224	028-10817			Citigroup Global Markets Europe AG
0000831001-20-000096	12	0001765064	028-19110			Citigroup Global Markets Holdings Bahamas Ltd
0000831001-20-000096	13	0000200245	028-01109			Citigroup Global Markets Holdings Inc.
0000831001-20-000096	14	0000315030	028-00541			Citigroup Global Markets Inc.
0000831001-20-000096	15	0001012467	028-04309			Citigroup Global Markets Ltd
0000831001-20-000096	5	0001336397	028-11520			Citicorp LLC
0000831001-20-000096	4	0001105748	028-05347			Citibank Overseas Investment Corp
0000831001-20-000096	3	0000711466	028-06215			Citibank Canada
0000831001-20-000096	2	0000036684	028-04287			Citibank, N.A.
0000831001-20-000096	1	0000799632	028-04289			Citibank (Switzerland)
0000831001-20-000096	10	0000700691	028-01114			Citigroup Financial Products Inc.
0000831001-20-000096	8	0001426918	028-12977			Citicorp Trust South Dakota
0000831001-20-000096	7	0001389388	028-12382			Citicorp Trust Delaware, National Association
0001567619-20-014793	1	0001177853	028-10251			TRUSTMARK INVESTMENT ADVISORS INC
0001062993-20-003839	3	0001491455	028-19828			First Eagle Alternative Credit, LLC
0001062993-20-003839	1	0001715163	028-18365			CARILLON TOWER ADVISERS, INC.
0001062993-20-003839	2	0001582681	028-20231			Alaska Permanent Fund Corp
0001104659-20-093584	2	0001203370	028-10281			DORSET MANAGEMENT CORP
0001214659-20-006979	2					Acceptance Indemnity Insurance Company
0001214659-20-006979	8					Wishire Insurance Company
0001214659-20-006979	1					Acceptance Casualty Insurance Company
0001214659-20-006979	9					International Fidelity Insurance Company
0001214659-20-006979	3					Commercial Alliance Insurance Company
0001214659-20-006979	4					Harco National Insurance Company
0001214659-20-006979	5					Occidetnal Fire and Casualty Company of North Carolina
0001214659-20-006979	6					SafePort Insurance Company
0001214659-20-006979	7					Transguard Insurance Company of America, Inc.
0001697765-20-000004	2					Cooperatieve Rabobank U.A.
0001697765-20-000004	1	0001667591	028-18085			Achmea B.V.
0000313028-20-000057	1	0000796370	028-11931			BrightSphere Inc.
0000313028-20-000057	4	0000908758	028-14511			American Beacon Advisors, Inc.
0001544599-20-000006	1					NSC Asesores
0001544599-20-000006	2					Kairos Partners
0001104659-20-093493	1	0001623510	028-16288			Fidelidade-Companhia de Seguros, S.A.
0001104659-20-093493	4	0000949156	028-20162			AMERITRUST GROUP, INC.
0001104659-20-093493	3	0001762249	028-18996			Hauck & Aufhaeuser Fund Services S.A.
0001104659-20-093493	2	0001615258	028-18303			Shanghai Fosun Pharmaceutical (Group) Co., Ltd.
0001088875-20-000079	1	0001088876	028-04841			BAILLIE GIFFORD & CO LTD
0001088875-20-000079	2	0001085972	028-04395			BAILLIE GIFFORD OVERSEAS LTD
0001088875-20-000079	3	0001772373	028-19482			Baillie Gifford Investment Management (Europe) Ltd
0001088875-20-000079	4	0001345717	028-20241			Baillie Gifford International LLC
0001694126-20-000005	1	0001640161	028-17719			Harvest Global Investments Ltd
0000950123-20-008262	2		028-20631			People's United Bank, N.A.
0000950123-20-008262	1					People's United Advisors, Inc.
0000950123-20-008259	5					GARANTI ASSET MANAGEMENT
0000950123-20-008259	6					BBVA (SUIZA) SA
0000950123-20-008259	7					BBVA BANCOMER SA INSTITUCION DE BANCA MULTIPLE GRU
0000950123-20-008259	8					BBVA ASSET MANAGEMENT CONTINENTAL
0000950123-20-008259	9					SEGUROS BBVA BANCOMER SA DE CV GRUPO FINANCIERO B
0000950123-20-008259	10					BBVA FIDUCIARIA
0000950123-20-008259	11					BILBAO VIZCAYA HOLDING SA
0000950123-20-008259	12					BBVA CONSOLIDAR SEGUROS SA
0000950123-20-008259	2					BBVA ASSET MANAGEMENT S.A. SGIIC
0000950123-20-008259	1					BANCO BILBAO VIZCAYA ARGENTARIA SA
0000950123-20-008259	4					BBVA BANCOMER GESTION
0000950123-20-008259	3					BBVA PENSIONES SOCIEDAD ANONIMA, EGFP
0001104659-20-093456	4		028-19619			Westpac Financial Services Limited
0001104659-20-093456	3		028-18733			BT Funds Management (NZ) Limited
0001104659-20-093456	2		028-14780			Advance Asset Management Limited
0001104659-20-093456	1		028-14779			BT Funds Management Limited
0001085146-20-002138	1	0001257165	028-12637			ORIX Corp Europe N.V.
0001085146-20-002138	2	0001418773	028-12635			Robeco Institutional Asset Management B.V.
0001085146-20-002138	3	0001491216	028-13904			Boston Partners Trust Co
0001085146-20-002138	4	0001070304	028-18337			ORIX CORP
0001598841-20-000004	1	0001420167	028-12656			Flexible Plan Investments, Ltd.
0000009631-20-000024	2	0001697694	028-17829			SCOTIA CAPITAL (USA) INC
0000009631-20-000024	3	0001698322	028-18067			Scotia Fondos, S.A. de C.V., Sociedad Operadora de Fondos de Inversion, Grupo Financiero Scotiabank Inverlat
0000009631-20-000024	5	0001614991	028-16219			Tangerine Investment Management Inc.
0000009631-20-000024	1	0001336244	028-11472			BNS INVESTMENTS INC.
0000009631-20-000024	4	0001614987	028-16220			Profuturo AFP S.A.
0000009631-20-000023	1	0000009631	028-11475			BANK OF NOVA SCOTIA
0000009631-20-000022	1	0000009631	028-11475			BANK OF NOVA SCOTIA
0001760076-20-000006	1	0000072407				NORRIS PERNE & FRENCH LLP                               /ADV
0001085146-20-002134	1	0001721242	028-18182			Belpointe Asset Management LLC
0001085146-20-002134	2	0001143565	028-16191			RATIONAL ADVISORS LLC
0001672775-20-000003	1	0001634047	028-16741			Vident Investment Advisory, LLC
0000903423-20-000062	3	0001778867	028-19568			2605267 Ontario Ltd
0000903423-20-000062	2	0001811732				OTPP Environmental Services Trust
0000903423-20-000062	1	0001625247	028-16546			1700480 ONTARIO INC
0000950123-20-008225	9		028-00203			OppenheimerFunds, Inc.
0000950123-20-008225	10		028-17868			ValueInvest Asset Management S.A.
0000950123-20-008225	8		028-16230			Jackson Square Partners, LLC
0000950123-20-008225	7		028-14981			Macquarie Investment Management Austria Kapitalanlage AG
0000950123-20-008225	6		028-06487			First Trust Advisors L.P.
0000950123-20-008225	5		028-05267			Macquarie Investment Management Business Trust
0000950123-20-008225	4		021-205239			Macquarie Funds Management Hong Kong Ltd
0000950123-20-008225	3		028-13126			Macquarie Investment Management Global Limited
0000950123-20-008225	1		028-13122			Macquarie Bank Limited
0000950123-20-008225	2		028-13124			Macquarie Investment Management Limited
0001062993-20-003815	1					O'Shaughnessy Asset Management, LLC
0001524828-20-000007	1					Meros Investment Management, LP.
0001085146-20-002119	72					Torray
0001085146-20-002119	73					12th Street Asset Mgmt
0001085146-20-002119	74					Wasatch Advisors
0001085146-20-002119	77					Anchor Capital
0001085146-20-002119	78					Amundi Pioneer
0001085146-20-002119	81					DF Dent
0001085146-20-002119	83					Federated
0001085146-20-002119	85					Lateef Investment
0001085146-20-002119	92					Polen Capital
0001085146-20-002119	95					SGA
0001085146-20-002119	97					Spyglass
0001085146-20-002119	15					Churchill Management Group
0001085146-20-002119	1					ACR Alpine Capital Research
0001085146-20-002119	2					Alger
0001085146-20-002119	3					Ancora Advisors
0001085146-20-002119	4					Apex Capital
0001085146-20-002119	5					Atalanta Sosnoff Capital
0001085146-20-002119	7					Atlanta Capital Management
0001085146-20-002119	8					Bahl & Gaynor
0001085146-20-002119	10					Brandes Investment Partners
0001085146-20-002119	11					Cambiar Investors
0001085146-20-002119	12					Causeway Capital Management
0001085146-20-002119	14					Chautauqua Capital Management
0001085146-20-002119	16					ClearBridge Advisors
0001085146-20-002119	17					Clarkston Caplital Partners
0001085146-20-002119	18					Campbell Newman Asset Mgmt
0001085146-20-002119	19					Confluence Investment Mgmt
0001085146-20-002119	20					Cohen And Steers
0001085146-20-002119	21					Columbia Management
0001085146-20-002119	22					Congress Asset Management
0001085146-20-002119	23					Cove Street Capital
0001085146-20-002119	24					Cramer Rosenthal McGlynn
0001085146-20-002119	25					Davis Advisors
0001085146-20-002119	26					Delaware Capital Management
0001085146-20-002119	27					DeRoy & Deveraux
0001085146-20-002119	28					Dearborn Partners
0001085146-20-002119	29					Earnest Partners
0001085146-20-002119	30					Eaton Vance
0001085146-20-002119	31					Epoch Investment
0001085146-20-002119	33					FPA First Pacific Advisors
0001085146-20-002119	34					Good Harbor Financial
0001085146-20-002119	36					GW&K Investment Management
0001085146-20-002119	38					Harding Loevner Managed Accts
0001085146-20-002119	39					Invesco Advisors
0001085146-20-002119	40					The Ithaka Group
0001085146-20-002119	41					Jennison Associates
0001085146-20-002119	42					Lyrical Asset Management
0001085146-20-002119	43					MacKay Shields
0001085146-20-002119	44					Madison Investment Advisors
0001085146-20-002119	46					MetWest Capital Management
0001085146-20-002119	47					Miller Howard
0001085146-20-002119	48					Montag & Caldwell
0001085146-20-002119	49					Mount Lucas Management
0001085146-20-002119	51					Oak Ridge Investments
0001085146-20-002119	54					Penn Capital
0001085146-20-002119	55					Poplar Forest Capital
0001085146-20-002119	56					Reinhart Partners
0001085146-20-002119	57					Riverbridge Partners
0001085146-20-002119	58					RNC Genter Capital Mgmt
