ACCESSION_NUMBER	SEQUENCENUMBER	CIK	FORM13FFILENUMBER	CRDNUMBER	SECFILENUMBER	NAME
0001085146-20-002415	6	0001542611	028-19423			Executive Wealth Management, LLC
0001085146-20-002415	10	0001761044	028-19117			Compton Wealth Advisory Group, LLC
0001085146-20-002415	11	0001710524	028-18093			Internal server error.
0001085146-20-002415	12	0001663224	028-17491			Harwood Advisory Group, LLC
0001085146-20-002415	13	0001767313	028-19275			WealthBridge Capital Management, LLC
0001085146-20-002415	9	0001674623	028-17456			WEALTHSOURCE PARTNERS, LLC
0001085146-20-002415	8	0001768195	028-19440			BCJ Capital Management, LLC
0001085146-20-002415	7	0001726752	028-18382			Pinnacle Wealth Planning Services, Inc.
0001085146-20-002415	1	0000768965	028-18080			FIRST FINANCIAL EQUITY CORPORATION
0001085146-20-002415	5	0001667146	028-17378			Ausdal Financial Partners, Inc.
0001085146-20-002415	4	0001721242	028-18182			Belpointe Asset Management LLC
0001085146-20-002415	3	0000891943	028-18315			CENTAURUS FINANCIAL, INC.
0001085146-20-002415	2	0001682021	028-18047			Vivaldi Capital Management, LLC
0001345471-20-000044	4		028-12040			TRIAN FUND MANAGEMENT GP, LLC
0001345471-20-000044	3		028-11641			EDWARD P. GARDEN
0001345471-20-000044	2		028-11640			PETER W. MAY
0001345471-20-000044	1		028-11639			NELSON PELTZ
0001089991-20-000003	1		028-06325			New York Life Inestment Management
0000919574-20-005877	6	0001630305	028-17350			Two Sigma World Core Fund, LP
0000919574-20-005877	7	0001667002	028-17346			Two Sigma Equity Risk Premia Portfolio, LLC
0000919574-20-005877	5	0001634034	028-16751			Two Sigma Macro Portfolio, LLC
0000919574-20-005877	4	0001559804	028-15364			Two Sigma Active Extension U.S. Small Cap Equity Fund, LP
0000919574-20-005877	3	0001569731	028-15404			TWO SIGMA ACTIVE EXTENSION U.S. ALL CAP EQUITY PORTFOLIO, LLC
0000919574-20-005877	2	0001569734	028-15367			TWO SIGMA ABSOLUTE RETURN PORTFOLIO, LLC
0000919574-20-005877	1	0001507209	028-14405			Two Sigma U.S. All Cap Core Equity Fund, LP
0000950123-20-009646	3		028-06518			First State Investment Management (UK) Limited
0000950123-20-009646	8		028-13582			MITSUBISHI UFJ FINANCIAL GROUP INC
0000950123-20-009646	7		028-19145			First Sentier Investors (Australia) RE Ltd
0000950123-20-009646	6		028-16989			First State Investments (Singapore)
0000950123-20-009646	5		028-14523			First State Investments International Limited
0000950123-20-009646	1		028-14419			First Sentier Investors Realindex Pty Ltd
0000950123-20-009646	2		028-14423			First Sentier Investors (Australia) IM Ltd
0000950123-20-009646	4		028-14420			First State Investments (Hong Kong) Limited
0001214659-20-007734	1	0001765285	028-19109			Apexium Financial, LP
0001126328-20-000181	4		028-10107			Principal Financial Services, Inc
0001126328-20-000181	1		028-1549			Principal Global Investors, LLC
0001126328-20-000181	2		028-10400			Principal Real Estate Investors, LLC
0001126328-20-000181	3		028-793			Principal Life Insurance Co
0000714142-20-000003	2					INTERNAL MGMT S&P 500 INDEX
0000714142-20-000003	1					INTERNAL MGMT S&P 400 INDEX
0000714142-20-000003	3					INTERNAL MGMT S&P 600 INDEX
0000714142-20-000003	4					STATE STREET US PREMIER GROWTH
0000714142-20-000003	5					IN-HOUSE HIGH YIELD
0000714142-20-000003	22					MED IN-HOUSE HIGH YIELD
0000714142-20-000003	21					MED BAILLIE GIFFORD US EQ GROWTH
0000714142-20-000003	20					LIFE BAILLIE GIFFORD US EQ GROWTH
0000714142-20-000003	19					LIFE IN-HOUSE HIGH YIELD
0000714142-20-000003	18					LIFE S&P 600 STOCK INDEX
0000714142-20-000003	17					LIFE S&P 500 STOCK INDEX
0000714142-20-000003	16					LIFE S&P 400 STOCK INDEX
0000714142-20-000003	15					BAILLIE GIFFORD US EQ GROWTH STR
0000714142-20-000003	6					INTERNAL MGMT J.L. LOSEY SCHOLAR
0000714142-20-000003	13		028-517			WELLINGTON MGMT MID CAP
0000714142-20-000003	14		028-517			WELLINGTON MGMT SMALL CAP
0000714142-20-000003	12		028-517			WELLINGTON MGMT LARGE CAP
0000714142-20-000003	11					UBS GLOBAL ASSET MGMT MID CAP
0000714142-20-000003	10					TODD ASSET MGMT ADV LARGE CAP
0000714142-20-000003	9					TODD ASSET MGMT INTR OPP
0000714142-20-000003	8					TODD ASSET MGMT INTL
0000714142-20-000003	7					TODD ASSET MGMT ALPHA
0001628280-20-013177	1		028-18621			METLIFE INC
0001654954-20-009614	1	0001106553	028-11512			TD SECURITIES INC
0001654954-20-009614	2	0001178652	028-11579			TD GLOBAL FINANCE
0001654954-20-009614	3	0001343236	028-11510			Toronto Dominion (New York) LLC
0001654954-20-009614	4	0001584627	028-15608			TORONTO DOMINION (SOUTH EAST ASIA) Ltd
0001654954-20-009614	5	0001719180	028-18156			TD Insurance - Meloche Monnex
0000950123-20-009394	2		028-5284			PNC Bank, National Association
0000950123-20-009394	3		028-13605			PNC Capital Advisors, LLC
0000950123-20-009394	4		028-13663			PNC Delaware Trust Company
0000950123-20-009394	5		028-16415			PNC Investments LLC
0001567619-20-016079	1	0001469000	028-13575			NB Alternatives Advisers LLC
0001567619-20-016079	2	0001230440	028-17085			Neuberger Berman Investment Advisers LLC
0001567619-20-016079	6	0001531987	028-15258			Neuberger Berman Breton Hill ULC
0001567619-20-016079	4	0001497372	028-13985			Neuberger Berman Trust Co N.A.
0001567619-20-016079	5	0001497476	028-13986			Neuberger Berman Trust Co of Delaware N.A.
0001567619-20-016079	3	0001640762	028-16869			Neuberger Berman Asia Ltd
0000849854-20-000004	1	0001513227	028-14414			Smart Portfolios, LLC
0001214659-20-007481	1	0001786380	028-19584			Stonehage Fleming Investment Management Ltd
0001214659-20-007481	2	0001822067				Stonehage Fleming Investment Management (Suisse) AG
0000950123-20-009331	3		028-03194			TIAA-CREF Investment Management, LLC
0000950123-20-009331	6		028-00331			Teachers Insurance & Annuity Association of America
0000950123-20-009331	5		028-11405			Santa Barbara Asset Management, LLC
0000950123-20-009331	4		028-04800			Teachers Advisors, LLC
0000950123-20-009331	1		028-11405			Nuveen Investments, Inc.
0000950123-20-009331	2		028-11710			Nuveen Fund Advisors, LLC
0001772937-20-000005	1	0001772938	028-19461			TPWM Services, Inc.
0001772937-20-000005	2	0001692067	028-19462			Tolleson Private Wealth Management, LP
0001772937-20-000004	2	0001692067	028-19462			Tolleson Private Wealth Management, LP
0001772937-20-000004	1	0001772938	028-19461			TPWM Services, Inc.
0000315066-20-001702	5	0001759275	028-19165			Fidelity Management & Research (Canada) ULC
0000315066-20-001702	1	0000035368	028-00450			Fidelity Management & Research Co LLC
0000315066-20-001702	2	0000715091	028-01054			FIDELITY MANAGEMENT TRUST CO
0000315066-20-001702	3	0001026420	028-05421			STRATEGIC ADVISERS LLC
0000315066-20-001702	4	0001601774	028-16240			Impresa Management LLC
0000315066-20-001702	10	0001629539	028-16686			FMR Investment Management (UK) Ltd
0000315066-20-001702	6	0001385494	028-12283			Fidelity Institutional Asset Management Trust Co
0000315066-20-001702	7	0001385495	028-12282			FIAM LLC
0000315066-20-001702	8	0001723021	028-18351			Fidelity Management & Research (Japan) Ltd
0000315066-20-001702	9	0001630052	028-16685			Fidelity Management & Research (Hong Kong) Ltd
0001730083-20-000003	1	0001569638	028-15330			M Holdings Securities, Inc.
0001569638-20-000003	1	0001730083	028-18427			M Financial Asset Management, Inc.
0001172661-20-001885	1	0001280346	028-10832			DIKER GP LLC
0001085146-20-002365	1	0001789219	028-19636			Charles Schwab Trust Co
0001567619-20-015793	1	0000796370	028-11931			BrightSphere Inc.
0001044797-20-000004	4	0000948905	028-06972			STIFEL NICOLAUS & CO INC \MO\
0001398344-20-016676	1		028-12230			ALPS ADVISORS INC
0001398344-20-016676	2		028-00290			Northern Trust Corp
0001398344-20-016664	1		028-12230			ALPS ADVISORS INC
0001085146-20-002364	1	0001705439	028-18533			Siris Capital Group III, L.P.
0001085146-20-002364	2	0001821380	028-20344			Siris Capital Group IV, L.P.
0001172661-20-001883	1	0001568820	028-15228			Arlington Value Capital, LLC
0001604488-20-000014	1	0001125816	028-06487			FIRST TRUST ADVISORS LP
0001604488-20-000012	1	0001125816	028-06487			FIRST TRUST ADVISORS LP
0001172661-20-001880	1	0001456506	028-13417			Alyeska Master Fund, L.P.
0001172661-20-001880	2	0001607448	028-16151			Alyeska Master Fund 2, L.P.
0001172661-20-001880	3	0001775953	028-19522			Alyeska Master Fund 3, L.P.
0001172661-20-001879	3	0001775953	028-19522			Alyeska Master Fund 3, L.P.
0001172661-20-001879	2	0001607448	028-16151			Alyeska Master Fund 2, L.P.
0001172661-20-001879	1	0001456506	028-13417			Alyeska Master Fund, L.P.
0001172661-20-001878	3	0001775953	028-19522			Alyeska Master Fund 3, L.P.
0001172661-20-001878	1	0001456506	028-13417			Alyeska Master Fund, L.P.
0001172661-20-001878	2	0001607448	028-16151			Alyeska Master Fund 2, L.P.
0001172661-20-001877	3	0001775953	028-19522			Alyeska Master Fund 3, L.P.
0001172661-20-001877	2	0001607448	028-16151			Alyeska Master Fund 2, L.P.
0001172661-20-001877	1	0001456506	028-13417			Alyeska Master Fund, L.P.
0000950123-20-009191	1		28-12332			GSO Capital Partners LP
0000950123-20-009191	6		28-13436			Havest Fund Advisors LLC
0000950123-20-009191	3		28-16028			Clarus Ventures, LLC
0000950123-20-009191	2		28-17363			Blackstone Management Partners L.L.C.
0000950123-20-009191	4		28-19316			Blackstone Alternative Solutions L.L.C.
0000950123-20-009191	5		28-20287			Blackstone Real Estate Advisors L.P.
0001041062-20-000113	7					Sionna Investment Managers Inc.
0001041062-20-000113	8					Todd Asset Management LLC
0001041062-20-000113	9		028-16449			SEI Investments Canada Company
0001041062-20-000113	1					Ceredex Value Advisors LLC
0001041062-20-000113	3					EAM Investors LLC
0001041062-20-000113	4					Jupiter Asset Management Ltd
0001041062-20-000113	5		028-16475			SEI Investments Management Corporation
0001041062-20-000113	6		028-10297			SEI Trust Company
0000049969-20-000007	5					LINA Life Insurance Company of Korea
0000049969-20-000007	1					Connecticut General Life Insurance Company
0000049969-20-000007	2					Cigna Health and Life Insurance Company
0000049969-20-000007	3					Life Insurance Company of North America
0000049969-20-000007	4	0000701221	028-01157			Cigna Holding Co
0001104659-20-095968	1	0001407543	028-13411			ENVESTNET ASSET MANAGEMENT INC
0001104659-20-095968	2	0001483801	028-13818			CSat Investment Advisory, L.P.
0001085146-20-002351	1	0001535090	028-14605			Parametrica Asset Management Ltd
0001104659-20-095821	5					PATRIOT FINANCIAL PARTNERS GP III, LLC
0001104659-20-095821	6					PATRIOT FREEDOM GP, LP
0001104659-20-095821	7					PATRIOT FREEDOM GP, LLC
0001104659-20-095821	1					PATRIOT FINANCIAL PARTNERS GP II, LP
0001104659-20-095821	4					PATRIOT FINANCIAL PARTNERS GP III, LP
0001104659-20-095821	3					PATRIOT FINANCIAL PARTNERS GP II, LLC
0001104659-20-095821	2					PATRIOT FINANCIAL PARTNERS GP, LLC
0001595888-20-000019	2	0001450709	028-13276			Jane Street Options, LLC
0001595888-20-000019	3	0001450705	028-13275			Jane Street Global Trading, LLC
0001595888-20-000019	4	0001556329	028-15040			JSOIN (BVI), Ltd.
0001801770-20-000003	1	0000932859	028-04558			PARAMETRIC PORTFOLIO ASSOCIATES LLC
0001801770-20-000003	2	0000829937	028-02259			Boston Trust Walden Co
0001801770-20-000003	3	0001665605	028-17691			3EDGE Asset Management, LP
0001801770-20-000003	4	0000810972	028-01911			BAIRD ROBERT W & CO INC /WI/
0001801770-20-000003	5	0001409427	028-12579			Boston Common Asset Management, LLC
0001801770-20-000003	6	0001599444	028-15799			CG Asset Management LLC
0001801770-20-000003	7	0001348883	028-11611			Clearbridge Investments, LLC
0001801770-20-000003	8	0000897378	028-03434			CONGRESS ASSET MANAGEMENT CO /MA
0001801770-20-000003	9	0001424322	028-12643			Cubic Asset Management, LLC
0001801770-20-000003	10	0001027760	028-05920			DELAWARE CAPITAL MANAGEMENT INC
0001801770-20-000003	11	0001102578	028-05269			EARNEST PARTNERS LLC
0001801770-20-000003	12	0000201772	028-00878			ESSEX INVESTMENT MANAGEMENT CO LLC
0001801770-20-000003	13	0001088084	028-10312			GOLDMAN SACHS ASSET MANAGEMENT/
0001801770-20-000003	14	0000928196	028-04434			HARDING LOEVNER LP
0001801770-20-000003	15	0001314620	028-11091			Hillman Capital Management, Inc.
0001801770-20-000003	16	0000938506	028-04736			INSIGHT CAPITAL RESEARCH & MANAGEMENT INC
0001801770-20-000003	17	0001127761	028-06155			IRONWOOD INVESTMENT MANAGEMENT LLC
0001801770-20-000003	18	0001106129	028-03495			JENSEN INVESTMENT MANAGEMENT INC
0001801770-20-000003	19	0001259887	028-10665			LONDON CO OF VIRGINIA
0001801770-20-000003	20	0001465109	028-13573			Neuberger Berman Group LLC
0001085146-20-002325	1	0001633376	028-16752			AQR Capital Management Holdings, LLC
0001085146-20-002325	2	0001582681	028-20231			Alaska Permanent Fund Corp
0001085146-20-002326	1	0001633376	028-16752			AQR Capital Management Holdings, LLC
0001085146-20-002326	2	0001167557	028-10120			AQR CAPITAL MANAGEMENT LLC
0001353316-20-000008	1	0001375836	028-13191			Hound Partners Offshore Fund, LP
0001353316-20-000008	2	0001607637	028-16134			Hound Partners Long Master, LP
0001353316-20-000008	3	0001607621	028-16135			Hound Partners Concentrated Master, LP
0001062993-20-004032	1	0001755163				SoftBank Group Capital Ltd
0001595888-20-000019	1	0001450698	028-13277			Jane Street Capital, LLC
0001801770-20-000003	24	0000860644	028-02634			Aristotle Capital Management, LLC
0001801770-20-000003	23	0001056593	028-04691			SCHAFER CULLEN CAPITAL MANAGEMENT INC
0001801770-20-000003	22	0001034524	028-03687			POLEN CAPITAL MANAGEMENT LLC
0001801770-20-000003	21	0001054554	028-06668			OAK RIDGE INVESTMENTS LLC
0001046192-20-000017	5	0001620577	028-17009			SETANTA ASSET MANAGEMENT
0001046192-20-000017	4	0001427274	028-13014			Irish Life Investment Managers Ltd.
0001046192-20-000017	3	0001657987	028-17019			Canada Life Asset Management Ltd
0001046192-20-000017	2	0001657985	028-17018			Canada Life Ltd
0001046192-20-000017	1	0001657965	028-17017			GLC Asset Management Group Ltd.
0001606587-20-000985	2	0001626982	028-16938			FormulaFolio Investments, LLC
0001606587-20-000985	1	0001758171	028-19380			Capita Financial Network
0001731509-20-000008	1	0001730859	028-18611			SB INVESTMENT ADVISERS (US) INC.
0001062993-20-004032	2	0001815949				Delaware Project 6 L.L.C.
0001085146-20-002332	1	0000317745	028-04922			GENERAL RE CORP
0001085146-20-002332	2	0001067983	028-04545			BERKSHIRE HATHAWAY INC
0001085146-20-002319	1	0001705439	028-18533			Siris Capital Group III, L.P.
0001085146-20-002318	1	0001682225	028-17512			Pointstate Argentum LLC
0001578621-20-000005	1					LMR Partners LLC
0001085146-20-002315	4	0001365324	028-11946			Numeric Investors LLC
0001085146-20-002315	3	0001289643	028-10979			GLG Partners LP
0001085146-20-002315	2	0001352261	028-11672			GLG LLC
0001085146-20-002315	1	0001598894	028-16037			AHL Partners LLP
0001567619-20-015547	6	0001327741	028-12621			CCI ONSHORE LLC
0001567619-20-015547	4	0001315356	028-11469			GASCON PARTNERS
0001567619-20-015547	3	0000928475	028-04460			HIGHCREST INVESTORS LLC
0001567619-20-015547	2	0000945612	028-04970			HIGH COAST LIMITED PARTNERSHIP
0001567619-20-015547	1	0001412093	028-12848			ICAHN CAPITAL LP
0001567619-20-015547	9	0001376139	028-20284			CVR ENERGY INC
0001567619-20-015547	8	0001738751	028-19369			AMERICAN ENTERTAINMENT PROPERTIES CORP.
0001567619-20-015547	7	0001548917	028-15034			IEP ENERGY LLC
0001567619-20-015547	5	0001257325	028-13170			THORNWOOD ASSOCIATES LIMITED PARTNERSHIP
0001567619-20-015545	1	0001603466	028-16256			Point72 Asset Management, L.P.
0001567619-20-015544	1	0001603466	028-16256			Point72 Asset Management, L.P.
0001567619-20-015542	1	0001603466	028-16256			Point72 Asset Management, L.P.
0001398344-20-015908	1					Glenmede Investment Management
0000919574-20-005420	1	0001317587	028-11159			ABRAMS BISON PARTNERS, LP
0001418812-20-000071	1	0001351069	028-12033			ValueAct Capital Management, L.P.
0001387131-20-007557	4	0001808245	028-20265			Walch Ernst
0001387131-20-007557	3	0001808252	028-20266			Prast Peter
0001387131-20-007557	2	0001796107	028-20151			Freemont Capital Pte Ltd
0001387131-20-007557	1	0001796111	028-20149			Haldor Foundation
0000950123-20-009134	1		028-13627			Sculptor Capital II LP
0001469589-20-000009	2	0001199406	028-10277			RAYNOR GEOFFREY
0001469589-20-000009	1	0001469588	028-13620			Q Global Capital Management, L.P.
0000860748-20-000134	2		028-18134			ALLIANCE UNITED INSURANCE CO
0000860748-20-000134	1	0000314998	028-00121			TRINITY UNIVERSAL INSURANCE CO
0000919574-20-005417	1	0001633435	028-16696			TIG Arbitrage Enhanced Master Fund, L.P.
0000919574-20-005417	2	0000913998	028-13433			TIG ARBITRAGE ASSOCIATES MASTER FUND, L.P.
0001567619-20-015535	2	0001520692	028-14775			KKR Credit Advisors (US) LLC
0001567619-20-015535	1	0001463931	028-13533			KKR Investment Management LLC
0001172661-20-001863	1	0001689919	028-17563			VEPF MANAGEMENT, L.P.
0001172661-20-001861	2	0001397513	028-13262			KROIN DAVID
0001172661-20-001861	1	0001239607	028-12517			JAY JEFFREY R
0000950123-20-009131	1		28-14356			BDTCP GP I, LLC
0001012975-20-000697	1	0001598364	028-16050			Electron GP, LLC
0001012975-20-000697	2	0001598371	028-16051			Shaver James O.
0001012975-20-000697	3	0001767528	028-19366			Electron Infrastructure GP, LLC
0001172661-20-001859	1	0001157524	028-10410			ORBIMED CAPITAL LLC
0001172661-20-001856	1	0001697367	028-17897			Gen IV Investment Opportunities, LLC
0001567619-20-015522	1	0001080168	028-04629			JACOBSON JONATHON S
0001167376-20-000016	1	0001114634	028-10109			Amalgamated Gadget, L.P.
0001167376-20-000016	2	0001199406	028-10277			RAYNOR GEOFFREY
0001567619-20-015518	1	0001166604	028-10011			PAULSON MANAGEMENT LP
0001172661-20-001851	1	0001537466	028-15267			Encompass Capital Master Fund LP
0001172661-20-001851	2	0001612850	028-16638			Encompass Capital E&P Master Fund L.P.
0001172661-20-001850	2	0001617621	028-16920			NexPoint Advisors, L.P.
0001172661-20-001850	1	0001167365	028-10659			HIGHLAND CAPITAL MANAGEMENT LP
0001493152-20-015893	1	0001797827	028-20285			Spruce House Partnership LLC
0000919574-20-005413	1	0001096344	028-12444			FAIRHOLME FUNDS INC
0000950159-20-000206	1	0001353362	028-11827			Flynn Management LLC
0001345471-20-000037	3	0001257864	028-11641			GARDEN EDWARD P
0001345471-20-000037	2	0000928264	028-11640			MAY PETER W
0001345471-20-000037	1	0000928265	028-11639			PELTZ NELSON
0001345471-20-000037	4	0001345472	028-12040			Trian Fund Management GP, LLC
0001012975-20-000693	1	0001512396	028-14351			Knighthead GP, LLC
0001012975-20-000693	2	0001512348	028-14353			Wagner Thomas
0001012975-20-000693	3	0001512398	028-14354			Cohen Ara
0001085146-20-002309	13	0001027796	028-03791			PZENA INVESTMENT MANAGEMENT LLC
0001085146-20-002309	1	0000052388	028-01091			AMERICAN CENTURY INVESTMENT MANAGEMENT INC
0001085146-20-002309	12	0001421306	028-12820			BRIGADE CAPITAL MANAGEMENT, LP
0001085146-20-002309	11	0001499094	028-16543			Rare Infrastructure Ltd
0001085146-20-002309	10	0001647273	028-18148			Perpetual Ltd
0001085146-20-002309	9	0001536105	028-14987			Magellan Asset Management Ltd
0001085146-20-002309	8	0001050470	028-06580			LSV ASSET MANAGEMENT
0001085146-20-002309	7	0001207017	028-10469			LAZARD ASSET MANAGEMENT LLC
0001085146-20-002309	6	0001303095	028-17200			K2/D&S MANAGEMENT CO LLC
0001085146-20-002309	5	0001086318	028-04211			INTECH INVESTMENT MANAGEMENT LLC
0001085146-20-002309	4	0001389191	028-12180			Hexavest Inc.
0001085146-20-002309	3	0001386060	028-12484			Boston Partners
0001085146-20-002309	2	0001164508	028-10005			ARROWSTREET CAPITAL, LIMITED PARTNERSHIP
0001567619-20-015496	3	0001721440	028-18501			AgateCreek LLC
0001567619-20-015496	1	0001702367	028-18499			Deer Park Road Management GP, LLC
0001567619-20-015496	2	0001655028	028-18500			Deer Park Road Management Company, LP
0001103882-20-000006	5	0001792635	028-19771			Nebula Research & Development LLC
0001103882-20-000006	4	0001631182	028-18227			Raritan Valley Capital Management LLC
0001103882-20-000006	3	0001766159	028-19021			Qsemble Capital Management, LP
0001103882-20-000006	2	0001569136	028-15313			Ergoteles LLC
0001103882-20-000006	1	0001633870	028-16676			Paloma Partners Advisors LP
0001104659-20-095584	2	0001620272	028-17046			ACOF Operating Manager IV, LLC
0001104659-20-095584	1	0001462608	028-14343			ACOF Operating Manager III LLC
0000950123-20-009122	1		028-11470			ESL Investments, Inc.
0001104659-20-095582	1	0001569620	028-15365			PlainsCapital Corp
0001104659-20-095582	2	0001534401	028-15369			PlainsCapital Bank
0001104659-20-095582	3	0000878520	028-18782			Hilltop Securities Holdings LLC
0001104659-20-095582	4	0000891055	028-18780			HILLTOP SECURITIES INC.
0001405086-20-000261	1	0001767929	028-19279			INHERENT GROUP GP, LLC
0001178913-20-002430	1	0001667024	028-17382			Internal server error. CIK may be invalid.
0001178913-20-002430	2	0001783644	028-19552			ION Tech Ltd
0001172661-20-001844	1	0001300763	028-13228			DME Advisors, LP
0001172661-20-001844	2	0001489933	028-14000			DME Capital Management, LP
0001172661-20-001844	3	0001449674	028-13259			Greenlight Masters, LLC
0001567619-20-015490	2	0000937611	028-16332			ELLIOTT INTERNATIONAL, L.P.
0001567619-20-015490	1	0000904495	028-04724			ELLIOTT ASSOCIATES, L.P.
0001719087-20-000007	1		028-18525			Nainoor Thakore
0001628280-20-012724	1		028-18621			METLIFE INC
0001172661-20-001839	1	0001647094	028-16942			Squarepoint Capital LLP
0000950123-20-009118	2		28-20130			Golden Harbor Ltd.
0000950123-20-009118	1		28-17341			Braslyn Ltd.
0000902664-20-003072	1	0000900203	028-10418			SOROS GEORGE
0000950123-20-009114	1					Deer VII & Co. L.P.
0000950123-20-009115	1		028-19200			Khosla Ventures Associates IV, LLC
0000921895-20-002258	1	0001334430	028-14882			BIGLARI, SARDAR
0000921895-20-002258	3	0001580602	028-16045			LION FUND II, L.P.
0000921895-20-002258	2	0001334426	028-15398			LION FUND, L.P.
0001628280-20-012721	1		028-18621			METLIFE INC
0000950123-20-009110	1		28-10368			Ivy Investment Management Company
0001172661-20-001830	1	0001750222	028-18919			Caledonia US, LP
0000092230-20-000103	14	0001383161	028-15462			BB&T SECURITIES, LLC
0000092230-20-000103	12	0001696868	028-18010			SunTrust Advisory Services, Inc.
0000092230-20-000103	5	0000764116	028-01507			TRUIST BANK /NC/
0000092230-20-000103	15	0001329883	028-11465			Sterling Capital Management LLC
0001104659-20-095554	2	0001358916	028-12277			Ridgeback Capital Investments Ltd.
0001104659-20-095554	1	0001357610	028-12280			Ridgeback Capital Management LLC
0001012975-20-000687	4	0001378379	028-13950			Clark John Smith II
0001012975-20-000687	2	0001378376	028-13953			Southpoint GP, LP
0001012975-20-000687	1	0001378377	028-13948			Southpoint Capital Advisors LLC
0001012975-20-000687	3	0001378378	028-13952			Southpoint GP, LLC
0001353316-20-000007	3	0001607621	028-16135			Hound Partners Concentrated Master, LP
0001353316-20-000007	2	0001607637	028-16134			Hound Partners Long Master, LP
0001353316-20-000007	1	0001375836	028-13191			Hound Partners Offshore Fund, LP
0001172661-20-001828	1	0001630228	028-16915			Gates Capital Management, L.P.
0001104659-20-095550	1		28-04826			Warburg Pincus & Co.
0001567619-20-015473	3	0001051877	028-17942			SAMSTOCK LLC
0001567619-20-015473	2	0001469407	028-17945			Zell Credit Opportunities Master Fund, L.P.
0001567619-20-015473	4	0001504277	028-18176			KMJZ Investments, L.L.C.
0001567619-20-015473	1	0001093566	028-17944			SZ INVESTMENTS LLC
0001567619-20-015468	1	0000919165	028-04120			CHESAPEAKE PARTNERS MANAGEMENT CO INC/MD
0000936753-20-000074	1	0000073124	028-00290			NORTHERN TRUST CORP
0001171843-20-005950	1	0000090498	028-04801			SIMMONS FIRST NATIONAL CORP
0001171843-20-005950	2	0000310051	028-01071			KING LUTHER CAPITAL MANAGEMENT CORP
0000950123-20-009104	2		028-19367			Adam Gray
0000950123-20-009104	1		028-19370			Christopher Shackelton
0001104659-20-095522	1	0001125816	028-06487			FIRST TRUST ADVISORS LP
0001065349-20-000009	3		028-00157			CAPITAL RESEARCH & MANAGEMENT CO
0001065349-20-000009	2		028-05044			CAPITAL GROUP INTERNATIONAL INC
0001065349-20-000009	1		028-00218			CAPITAL GROUP COMPANIES INC
0000950123-20-009094	5		028-18076			Silver Lake Technology Associates Sumeru Cayman, L.P.
0000950123-20-009094	6		028-18593			Silver Lake Technology Associates IV, L.P.
0000950123-20-009094	7		028-18777			Silver Lake Technology Associates V Marquee, L.P.
0000950123-20-009094	8		028-18876			Silver Lake Technology Associates V, L.P.
0000950123-20-009094	4		028-14020			Silver Lake Technology Associates Sumeru, L.P.
0000950123-20-009094	9		028-15137			Silver Lake Technology Associates Kraftwerk, L.P.
0000950123-20-009094	2		028-16315			Silver Lake Technology Associates III Cayman, L.P.
0000950123-20-009094	1		028-14670			Silver Lake Technology Associates III, L.P.
0000950123-20-009094	3		028-16973			Silver Lake Technology Associates IV Cayman, L.P.
0000355429-20-000011	1		028-06348			Dai-ichi Life Holdings, Inc.
0001567619-20-015455	1	0001658263	028-17039			Zurich Life Assurance plc
0000859804-20-000008	2	0001484256	028-15568			RiverPark Advisors, LLC
0001104659-20-095509	1	0001442276	028-13168			Partner Investment Management, L.P.
0000950123-20-009080	1		028-15910			Cartica Management, L.P.
0000950123-20-009080	2		028-15911			CCP Master GP, L.P.
0000950123-20-009079	1					Deer VIII & Co. L.P.
0001273087-20-000026	1	0001273087	028-10684			MILLENNIUM MANAGEMENT LLC
0000950123-20-009061	1		28-18870			Citadel Securities GP LLC
0000921895-20-002255	1	0001205885	028-14728			MARTIN WILLIAM C
0001104659-20-095490	2	0001335794	028-11452			D. E. Shaw Investment Management, L.L.C.
0001104659-20-095490	4	0001569653	028-15385			D. E. Shaw Adviser II, L.L.C.
0001104659-20-095490	1	0001009268	028-05394			D. E. SHAW & CO, L.P.
0001104659-20-095490	3	0001518837	028-14492			D. E. Shaw Heliant Adviser, L.L.C.
0001214659-20-007178	4	0001413315				OC 532 Offshore Fund, Ltd.
0001214659-20-007179	1	0001458762	028-14291			DEKEL PARTNERS, L.P.
0001214659-20-007179	2	0001679606	028-17788			Adom Partners, L.P.
