0001085146-20-002119	59					Roosevelt Investment Group
0001085146-20-002119	60					Sage Advisory Services
0001085146-20-002119	61					Salient Capital Advisors
0001085146-20-002119	62					SaratogaRIM
0001085146-20-002119	63					Schafer Cullen Capital Mgmt
0001085146-20-002119	64					Seaview Global Advisors
0001085146-20-002119	65					Security Capital
0001085146-20-002119	67					Stephens Inv Mgt
0001085146-20-002119	70					SouthernSun Asset Mgmt
0001085146-20-002119	71					Thornburg Investment Management
0000897423-20-000083	1		028-18015			Robert M. Bass
0001112520-20-000022	1	0001697927	028-17748			Braddock Partners Offshore, LP
0001420506-20-000864	1		28-04975			Affiliated Managers Group, Inc.
0001018331-20-000012	2		028-05267			Delaware Management, L.P.
0001018331-20-000012	10		028-06808			Natixis Investment Managers, L.P.
0001018331-20-000012	9		028-04698			MFS Investment Management, L.P.
0001018331-20-000012	8		028-05840			Vaughan Nelson Investment Investment, L.P.
0001018331-20-000012	7		028-03589			Tocqueville Asset Management, L.P.
0001018331-20-000012	6		028-00398			Loomis Sayles & Company, L.P.
0001018331-20-000012	5		028-04434			Harding Loevner, L.P.
0001018331-20-000012	4		028-05229			Great Lakes Advisors, Inc
0001018331-20-000012	1		028-06538			AEW Capital Management, L.P.
0001018331-20-000012	3		028-14580			Euclid Advisors
0001567619-20-014710	6	0001430557	028-18197			Friedman Fleischer & Lowe GP II, LLC
0001567619-20-014710	5	0001430556	028-13725			Friedman Fleischer & Lowe GP II, L.P.
0001567619-20-014710	4	0001615971	028-17995			Friedman Fleischer & Lowe GP III, LLC
0001567619-20-014710	3	0001616050	028-17996			Friedman Fleischer & Lowe GP III, L.P.
0001567619-20-014710	2	0001701881	028-17997			FFL Partners Holdings, LLC
0001567619-20-014710	1	0001701852	028-17998			FFL Partners, L.P.
0001738728-20-000003	1	0001319111	028-11308			Virtus Fund Advisers, LLC
0001738726-20-000006	1	0001319111	028-11308			Virtus Fund Advisers, LLC
0001567619-20-014700	1	0001479598	028-17612			AGF Investments LLC
0000019617-20-000375	4	0001363391	028-11937			J.P. Morgan Investment Management Inc.
0000019617-20-000375	13	0001657983	028-17025			J.P. Morgan (Suisse) SA
0000019617-20-000375	11	0001503764	028-16931			J.P. Morgan Private Investments Inc.
0000019617-20-000375	10	0001548249	028-14957			JPMorgan Asset Management (Canada) Inc.
0000019617-20-000375	8	0001362941	028-11947			JPMorgan Asset Management (UK) Ltd
0000019617-20-000375	6	0001373636	028-12006			J.P. Morgan Securities plc
0000019617-20-000375	5	0001362244	028-11925			J.P. Morgan Securities LLC
0000019617-20-000375	17	0001657966	028-17030			JPMorgan Asset Management (Singapore) Ltd
0000019617-20-000375	7	0001373637	028-12007			J.P. Morgan Whitefriars LLC
0000019617-20-000375	15	0001657968	028-17029			JPMorgan Asset Management (Asia Pacific) Ltd
0000019617-20-000375	20	0001657978	028-17033			MLP Investment Holdings, Inc.
0000019617-20-000375	19	0001657969	028-17032			JPMorgan Funds (Asia) Ltd
0000019617-20-000375	18	0001657967	028-17031			JPMorgan Asset Management (Taiwan) Ltd
0000019617-20-000375	21	0001657964	028-17034			J.P. Morgan International Bank Ltd
0000019617-20-000375	1	0001387526	028-12125			J.P. Morgan Trust Co of Delaware
0000019617-20-000375	2	0000835271	028-00123			JPMorgan Chase Bank, N.A.
0000019617-20-000375	16	0001549547	028-14958			JPMorgan Asset Management (Japan) Ltd
0000019617-20-000375	14	0001657977	028-17027			J.P. Morgan GT Corp
0000912938-20-000365	7		028-06597			MFS Investment Management Canada Limited
0000912938-20-000365	6		028-13175			MFS Heritage Trust Company
0000912938-20-000365	5		028-13177			MFS Investment Management K.K.
0000912938-20-000365	4		028-13178			MFS International (U.K.) Limited
0000912938-20-000365	3		028-16137			MFS International Singapore Pte. Ltd.
0000912938-20-000365	2		028-13180			MFS Investment Management Company (LUX) S.a r.l.
0000912938-20-000365	1		028-13173			MFS Institutional Advisors, Inc.
0000912938-20-000365	9		028-06325			New York Life Investment Management LLC
0000912938-20-000365	8		028-18051			MFS International Australia Pty Ltd
0001391166-20-000004	3	0001280965	028-11123			TORTOISE CAPITAL ADVISORS, L.L.C.
0001391166-20-000004	1	0001082917	028-04145			GW&K Investment Management, LLC
0000892712-20-000283	1		028-13748			Johnson Bank
0000892712-20-000283	2		028-17498			Johnson Wealth Inc.
0000950123-20-008181	3		028-00033			Liberty Mutual Insurance Co
0000950123-20-008181	5		028-14524			Peerless Insurance Co
0001567619-20-014685	1	0001552332	028-17873			Dickerman Ronald
0001449088-20-000003	1	0001449088	028-16338			MILLINGTON SECURITIES, INC.
0001104659-20-093123	1	0001522877	028-18932			AIA Group Ltd
0001104659-20-093122	1	0001522877	028-18932			AIA Group Ltd
0001104659-20-093121	1	0001522877	028-18932			AIA Group Ltd
0001463217-20-000003	2					IMD Holdings, LLC
0001463217-20-000003	3	0001372312	028-13541			United Capital Financial Partners, Inc
0001463217-20-000003	1	0000886982	028-04981			GOLDMAN SACHS GROUP INC
0001085146-20-002113	2	0001602159	028-18323			ORIX Corp USA
0001085146-20-002113	1	0001070304	028-18337			ORIX CORP
0000897423-20-000080	2		028-19052			GC-32 Mineral Partners, L.P.
0000897423-20-000080	1		028-01757			LMBI, L.P.
0001567619-20-014674	1	0001423255	028-15175			Mirae Asset Global Investments (Hong Kong) LTD
0001567619-20-014674	2	0001568512	028-15176			Mirae Asset Global Investments (USA) Inc.
0001567619-20-014674	3	0001488106	028-15177			Mirae Asset Global Investments (USA) LLC
0001567619-20-014674	5	0001573668	028-15459			Horizons ETFs Management (Canada) Inc.
0001567619-20-014674	6	0001705339	028-18036			MIRAE ASSET GLOBAL ETFS HOLDINGS Ltd.
0001567619-20-014674	7	0001579960	028-18037			GLOBAL X MANAGEMENT COMPANY, INC.
0001567619-20-014674	8	0001705343	028-18039			Betashares Holdings Pty Ltd.
0001567619-20-014674	9	0001705342	028-18038			Betashares Capital Ltd.
0001567619-20-014674	10	0001432354	028-14399			Global X Management CO LLC
0000749044-20-000004	1					Torrington Savings Bank
0001041062-20-000107	6		028-10297			SEI Trust Company
0001041062-20-000107	5		028-16475			SEI Investments Management Corporation
0001041062-20-000107	4					Jupiter Asset Management Ltd
0001041062-20-000107	7					Sionna Investment Managers Inc.
0001041062-20-000107	1					Ceredex Value Advisors LLC
0001041062-20-000107	3					EAM Investors LLC
0001041062-20-000107	8					Todd Asset Management LLC
0001041062-20-000107	9		028-16449			SEI Investments Canada Company
0001104659-20-093063	1	0001820717				South State Bank, National Association
0001104659-20-093063	2	0001776610	028-19523			South State Advisory, Inc.
0001008322-20-000009	1	0000796370	028-11931			BrightSphere Inc.
0001008322-20-000009	2	0001097218	028-05161			Nationwide Fund Advisors
0000950123-20-008157	1		028-00960			Sarofim Trust Co
0000950123-20-008157	2		028-05074			Sarofim International Management Co
0000950123-20-008157	3		028-00127			BNY Mellon Investment Adviser, Inc.
0000950123-20-008157	4		028-12592			The Bank of New York Mellon Corporation
0001178913-20-002331	5	0001728584	028-18262			Internal server error. CIK may be invalid.
0001178913-20-002331	1	0001667119	028-17386			Migdal Insurance Co Ltd
0001178913-20-002331	2	0001667118	028-17385			Migdal Makefet Pension Funds & Provident Funds Ltd
0001178913-20-002331	4	0001727574	028-18263			Internal server error. CIK may be invalid.
0001178913-20-002331	3	0001667117	028-17384			Yozma Pension Fund for the Self Employed Ltd
0001598180-20-000003	2					Geode
0001598180-20-000003	1					Aperio
0001085146-20-002099	1	0001316397	028-11093			Aurora Investment Counsel
0001171843-20-005803	1	0001816616	028-20310			NZS Capital, LLC
0001481045-20-000004	5	0001512694	028-14428			Daiwa Capital Markets America Holdings Inc.
0001481045-20-000004	4	0001513045	028-14433			Daiwa Securities Co., Ltd.
0001481045-20-000004	3	0001512777	028-14427			Daiwa America Strategic Advisors Corp
0001481045-20-000004	2	0001545860	028-14945			Daiwa International Holdings Inc.
0001481045-20-000004	1	0001513151	028-14429			Daiwa Asset Management Co. Ltd
0001681596-20-000006	3		028-16832			ABU DHABI INVESTMENT COUNCIL
0001681596-20-000006	2		028-10487			NORTHERN TRUST INVESTMENTS INC
0001681596-20-000006	1		028-16454			SEI INVESTMENTS CO
0001513227-20-000006	1	0000849854	028-15527			STRATEGIC WEALTH MANAGEMENT INC
0001725296-20-000005	4	0000030163	028-00127			BNY Mellon Investment Adviser, Inc.
0001725296-20-000005	3	0000813905	028-02009			BANK OF NEW YORK MELLON
0001725296-20-000005	2	0001696076	028-17771			Griffin Capital Advisor, LLC
0001725296-20-000005	5	0001390777				Bank of New York Mellon Corp
0001221073-20-000133	5	0000932859	028-04558			PARAMETRIC PORTFOLIO ASSOCIATES LLC
0001221073-20-000133	4	0001040197	028-06392			MAI Capital Management
0001379041-20-000139	1		028-10981			Goldman Sachs Asset Management, L.P.
0001325447-20-000024	1	0001033427	028-06008			IRIDIAN ASSET MANAGEMENT LLC/CT
0001628280-20-012327	1	0001521019	028-14498			Nuveen Asset Management, LLC
0001573876-20-000008	11	0001483964	028-13809			Ladenburg Thalmann Asset Management
0001573876-20-000008	1	0001297376				Advisors Asset Management, Inc.
0001573876-20-000008	16					SYNTAX RESEARCH, INC
0001573876-20-000008	3	0001093589	028-05119			ALTA CAPITAL MANAGEMENT LLC/
0001573876-20-000008	23	0001021223	028-05792			KAYNE ANDERSON RUDNICK INVESTMENT MANAGEMENT LLC
0001573876-20-000008	25	0001598416	028-16121			Astor Investment Management LLC
0001573876-20-000008	22	0001501902	028-14153			Charles Schwab Investment Advisory, Inc.
0001573876-20-000008	24	0001600999	028-16090			MANAGED ASSET PORTFOLIOS, LLC
0001573876-20-000008	26	0001504492	028-14071			St. James Investment Company, LLC
0001573876-20-000008	28	0001034524	028-03687			POLEN CAPITAL MANAGEMENT LLC
0001573876-20-000008	30	0001554656	028-15157			Raub Brock Capital Management LP
0001573876-20-000008	29	0001018331				NATIXIS ADVISORS, L.P.
0001573876-20-000008	31	0001056593	028-04691			SCHAFER CULLEN CAPITAL MANAGEMENT INC
0001573876-20-000008	33	0000932859	028-04558			PARAMETRIC PORTFOLIO ASSOCIATES LLC
0001573876-20-000008	35	0001473182	028-13833			NUANCE INVESTMENTS, LLC
0001573876-20-000008	19	0001086483	028-04587			ZACKS INVESTMENT MANAGEMENT
0001573876-20-000008	38	0001143892	028-14082			NIEMANN CAPITAL MANAGEMENT INC
0001573876-20-000008	2	0001093589	028-05119			ALTA CAPITAL MANAGEMENT LLC/
0001573876-20-000008	34	0001541743	028-14668			Copeland Capital Management, LLC
0001573876-20-000008	37	0001593387	028-16841			Internal server error. CIK may be invalid.
0001573876-20-000008	41	0000897378	028-03434			CONGRESS ASSET MANAGEMENT CO /MA
0001573876-20-000008	40	0000872163	028-02824			NAVELLIER & ASSOCIATES INC
0001573876-20-000008	36					55IP
0001573876-20-000008	45	0001376772	028-12076			Dorsey Wright & Associates
0001573876-20-000008	17	0000903947	028-03692			MILLER HOWARD INVESTMENTS INC /NY
0001573876-20-000008	9	0001407543				ENVESTNET ASSET MANAGEMENT INC
0001573876-20-000008	6	0001442056	028-13334			CONFLUENCE INVESTMENT MANAGEMENT LLC
0001573876-20-000008	5	0001562855	028-15091			Clarkston Capital Partners, LLC
0001573876-20-000008	4	0001034369				CAPRIN ASSET MANAGEMENT LLC /ADV
0001573876-20-000008	7	0001442056	028-13334			CONFLUENCE INVESTMENT MANAGEMENT LLC
0001573876-20-000008	15	0001664771	028-17076			Sitrin Capital Management LLC
0001089877-20-000016	3	0001074714	028-04569			KEYBANC CAPITAL MARKETS,INC /OH/
0001438848-20-000006	2					GAM Investment Management (Switzerland) AG
0001438848-20-000006	1	0001229918				GAM INTERNATIONAL MANAGEMENT LTD
0001606587-20-000917	1	0001575239	028-16082			Perigon Wealth Management, LLC
0001763409-20-000004	1	0001221362	028-10434			Avalon Investment & Advisory
0001580642-20-002952	3		028-01006			BARROW HANLEY MEWHINNEY & STRAUSS LLC
0001580642-20-002952	4		028-02204			Brandywine Global Investment Management, LLC
0001580642-20-002952	5		028-10449			COLUMBUS CIRCLE INVESTORS
0001580642-20-002952	6		028-01203			CS MCKEE LP
0001580642-20-002952	16		028-10622			ZEVENBERGEN CAPITAL INVESTMENTS LLC
0001580642-20-002952	8		028-02494			TCW GROUP INC
0001580642-20-002952	9		028-16230			Jackson Square Partners, LLC
0001580642-20-002952	10		028-05267			MACQUARIE INVESTMENT MANAGEMENT BUSINESS TRUST
0001580642-20-002952	11		028-03692			MILLER HOWARD INVESTMENTS INC /NY
0001580642-20-002952	12		028-03425			NEW SOUTH CAPITAL MANAGEMENT INC
0001580642-20-002952	13		028-03459			SMITH ASSET MANAGEMENT GROUP LP /ADV
0001580642-20-002952	14		028-07104			WCM INVESTMENT MANAGEMENT, LLC
0001580642-20-002952	15		028-04557			WELLINGTON MANAGEMENT GROUP LLP
0001580642-20-002952	2		028-05933			ARGENT CAPITAL MANAGEMENT LLC
0001580642-20-002952	1		028-10562			ALLIANCEBERNSTEIN L.P
0001580642-20-002952	7		028-01185			FRONTIER CAPITAL MANAGEMENT CO LLC
0001172661-20-001623	1	0001027746	028-03765			ALLEN & CO INC
0001172661-20-001622	1	0001389544	028-12302			ALLEN OPERATIONS LLC
0001172661-20-001621	1	0001303053	028-18385			Allen & CO LLC
0001512020-20-000009	1	1512014				Kepos Partners LLC
0001206774-20-002367	5	0001254859	028-10490			Manulife Investment Management (North America) Ltd
0001206774-20-002367	6	0001553998	028-15006			Manulife Investment Management (Hong Kong) Ltd
0001206774-20-002367	7	0001528732	028-14594			Manulife Investment Management (Europe) Ltd
0001206774-20-002367	4	0001034182	028-03673			MANULIFE INVESTMENT MANAGEMENT (US) LLC
0001206774-20-002367	3	0001073894	028-15079			JOHN HANCOCK LIFE INSURANCE CO USA
0001206774-20-002367	8	0001230788	028-19939			JOHN HANCOCK INVESTMENT MANAGEMENT LLC
0001206774-20-002367	1	0001086888	028-11519			MANULIFE FINANCIAL CORP
0001206774-20-002367	2	0001343498	028-11524			Manulife Investment Management Ltd
0000950123-20-008014	3		028-13799			KBC Fund Management Ltd.
0000950123-20-008014	2		028-13051			KBC Asset Management NV
0000950123-20-008014	1		028-13045			KBC Bank NV
0000950123-20-008014	4		028-17975			CSOB Asset Management a.s.
0001213900-20-021093	4		028-17097			Sand Hill Cove Management LLC
0001213900-20-021093	3		028-19511			Nathan Faber
0001213900-20-021093	2		028-17095			Corey M. Hoffstein
0001213900-20-021093	1		028-17094			Thomas B. Rosedale
0001213900-20-021093	5		028-17098			Newfound Holdings, LLC
0000936944-20-000005	3	0001409728	028-12567			Mercer Investments LLC
0000936944-20-000005	4	0000350894	028-16454			SEI INVESTMENTS CO
0001290668-20-000003	3	0000019481	028-00085			Virtus Investment Advisers, Inc.
0001290668-20-000003	2	0001376113	028-12230			ALPS ADVISORS INC
0001290668-20-000003	1	0000721204	028-01190			RUSSELL FRANK CO/
0001290668-20-000003	4	0001319111	028-11308			Virtus Fund Advisers, LLC
0000930413-20-001971	1	0001460304				VAN ECK ABSOLUTE RETURN ADVISERS CORP.
0000930413-20-001971	2					VanEck Investments Limited
0000930413-20-001971	3					VanEck Asset Management B.V.
0001162044-20-000685	2	0001141455	028-06545			COOKSON PEIRCE & CO INC
0001162044-20-000685	3	0001526528	028-14513			Lyons Wealth Management, LLC.
0000950123-20-008003	1		028-14069			Daniels + Tansey LLP
0001544599-20-000005	1					NSC Asesores
0001544599-20-000005	2					Kairos
0001580642-20-002925	1	0001750924	028-19208			VisionPoint Advisory Group, LLC
0001580642-20-002925	2	0001731446	028-18542			Prime Capital Investment Advisors, LLC
0001172661-20-001609	3	0001520194	028-14463			Synovus Securities, Inc.
0001172661-20-001609	2	0001003553	028-05144			GLOBALT Investments
0001172661-20-001609	1	0000945597	028-04944			SYNOVUS TRUST CO NA
0001226886-20-000008	1	0001132700	028-06661			SAXON WOODS ADVISORS LLC
0001085146-20-002076	1					GKFO LLC
0001567619-20-014570	1	0001390777	028-12592			Bank of New York Mellon Corp
0001172661-20-001608	1	0001373130	028-12005			M.D. Sass Associates, Inc.
0001085146-20-002071	7	0000073076	028-00229			NORTHWESTERN MUTUAL LIFE INSURANCE CO
0001085146-20-002071	8	0001624724	028-16329			Aberdeen Standard Capital Ltd
0001085146-20-002071	9	0001536355	028-16269			Ignis Investment Services Ltd
0001085146-20-002071	6	0001071039	028-05167			Brighthouse Investment Advisers, LLC
0001085146-20-002071	5	0001125816	028-06487			FIRST TRUST ADVISORS LP
0001085146-20-002071	4	0001650392	028-16969			Aberdeen Asset Investments Ltd
0001085146-20-002071	3	0001544935	028-14936			Aberdeen Asset Managers Ltd
0001085146-20-002071	2	0001056108	028-11022			Aberdeen Standard Investments (Asia) Ltd
0001085146-20-002071	11	0001803235	028-20161			Aberdeen Standard Capital International Ltd.
0001085146-20-002071	10	0001505708	028-14115			Standard Life Investments LTD
0001085146-20-002071	1	0001309613	028-11020			Aberdeen Standard Investments Inc.
0001104659-20-092456	1	0000872163	028-02824			NAVELLIER & ASSOCIATES INC
0001141781-20-000003	3	0000887393	028-03162			NICHOLS JAMES R
0001141781-20-000003	6	0001389867	028-12207			Herbert John K III
0001141781-20-000003	9	0001799678	028-20092			Popov Patricia D
0001141781-20-000003	8	0001799680	028-20095			Nichols Richard K
0001141781-20-000003	7	0001568106	028-15124			Bator Thomas E.
0001178913-20-002319	2	0001812114	028-20291			KSM Mutual Funds Ltd.
0001178913-20-002319	1	0001698157	028-18651			Excellence Investments Ltd.
0001178913-20-002311	2	0001731130	028-18635			meitav dash provident & pensions ltd
0001178913-20-002311	1	0001731450	028-18633			MEITAV TACHLIT MUTUAL FUNDS LTD
0001178913-20-002311	3	0001731451	028-18634			MEITAV DASH PROTFOLIO MANAGETENT LTD
0001654954-20-008660	1	0001106553	028-11512			TD SECURITIES INC
0001654954-20-008660	2	0001178652	028-11579			TD GLOBAL FINANCE
0001654954-20-008660	3	0001343236	028-11510			Toronto Dominion (New York) LLC
0001654954-20-008660	4	0001584627	028-15608			TORONTO DOMINION (SOUTH EAST ASIA) Ltd
0001654954-20-008660	5	0001719180	028-18156			TD Insurance - Meloche Monnex
0000950123-20-007928	1		028-18439			Mark Levin
0000950123-20-007928	2		028-18438			Kevin P. Starr
0000950123-20-007928	3		028-18419			Robert I. Tepper
0000950123-20-007927	3		028-18419			Robert I. Tepper
0000950123-20-007927	2		028-18438			Kevin P. Starr
0000950123-20-007927	1		028-18439			Mark Levin
0000950123-20-007930	3		028-18419			Robert I. Tepper
0000950123-20-007930	1		028-18439			Mark Levin
0000950123-20-007930	2		028-18438			Kevin P. Starr
0000950123-20-007900	1		028-18569			EnCap Partners GP, LLC
0000950123-20-007898	1		028-18569			EnCap Partners GP, LLC
0000950123-20-007896	1		028-18569			EnCap Partners GP, LLC
0001104659-20-091945	1	0001520684	028-14473			Citizens & Northern Bank
0001730299-20-000003	2	0001730946	028-18643			Sabadell Asset Management, S.A S.G.I.I.C
0001730299-20-000003	1	0001740639	028-18786			Urquijo Gestion, S.A S.G.I.I.C
0001533964-20-000007	2		28-13648			Virtu Financial BD LLC
0001533964-20-000007	5		28-15626			Virtu Americas LLC
0001533964-20-000007	1		28-12744			VIRTU FINANCIAL CAPITAL MARKETS
0001666746-20-000004	1	0001528086	028-14913			Good Harbor Financial, LLC
0001172661-20-001602	1	0001673553	028-17424			Tilden Park Capital Management LP
0000947871-20-000665	4	0001667654	028-17393			EDMOND DE ROTHSCHILD ASSET MANAGEMENT (LUXEMBOURG)
0000947871-20-000665	5	0001689918	028-17574			EDMOND DE ROTHSCHILD (MONACO)
0000947871-20-000665	2	0001536550	028-16963			Edmond de Rothschild (Europe)
0000947871-20-000665	1	0001650162	028-16957			EDMOND DE ROTHSCHILD (SUISSE) S.A.
0000947871-20-000665	3	0001649592	028-16959			EDMOND DE ROTHSCHILD ASSET MANAGEMENT (FRANCE)
0001040188-20-000119	3	0001164772	028-06761			JACKSON NATIONAL ASSET MANAGEMENT LLC
0001040188-20-000119	4	0001071039	028-05167			Brighthouse Investment Advisers, LLC
0001040188-20-000119	2	0001256909				Northern Trust Investments, Inc
0001040188-20-000119	1	0001077479	028-04547			VOYA INVESTMENTS, LLC
0001104659-20-091855	1	0000940755	028-14777			J O HAMBRO CAPITAL MANAGEMENT LTD
0001104659-20-091855	2	0001541741	028-14773			Pendal Group Ltd
0001172661-20-001600	1	0001169486	028-14109			TOKIO MARINE HOLDINGS, INC.
0001042046-20-000038	3		28-17123			Great American Holding, Inc
0001042046-20-000038	1		28-498			Great American Insurance Company
0001042046-20-000038	2		28-1258			Great American Life Insurance Company
0000950123-20-007849	4		028-13663			PNC Delaware Trust Company
0000950123-20-007849	3		028-13605			PNC Capital Advisors, LLC
0000950123-20-007849	2		028-5284			PNC Bank, National Association
0000950123-20-007849	5		028-16415			PNC Investments LLC
0001062993-20-003758	1		028-20231			Alaska Permanent Fund Corp
0001398344-20-015227	2		028-19397			Toroso Investments, LLC
0001398344-20-015227	1		028-17968			Amplify Investments, LLC
0000906304-20-000109	1					Legg Mason, Inc.
0001505817-20-000021	1	0000945425	028-04930			Fiera Capital Inc.
0001505817-20-000021	4	0001351841	028-11574			Fiera Capital (Europe) Ltd.
0001505817-20-000021	3	0001316828	028-11145			Fiera Capital (IOM) Ltd
0001505817-20-000021	2	0001078727	028-07472			Bel Air Investment Advisors LLC
0001505817-20-000021	5	0001764000	028-19149			Wilkinson Global Asset Management LLC
0001085146-20-002064	1	0001435249	028-13133			CQS (HONG KONG) LTD
0001085146-20-002064	2	0001438311	028-13136			CQS (UK) LLP
0001163648-20-000012	1	0001523847	028-14509			CI Global Investments Inc.
0001163648-20-000011	1	0001523847	028-14509			CI Global Investments Inc.
0001104659-20-091773	2	0001133639	028-06325			NEW YORK LIFE INVESTMENT MANAGEMENT LLC
0001104659-20-091773	1	0001483922	028-13710			INDEXIQ LLC
0001009076-20-000006	1	0000022356	028-00642			COMMERCE BANCSHARES INC /MO/
0001397545-20-000012	3	0001117699	028-15256			NOVEM
0001397545-20-000012	2	0001569218	028-15255			HHR TITAN OFFSHORE MASTER, L.P.
0001397545-20-000012	1	0001568755	028-15259			HHR ATLAS MASTER, L.P.
0001397545-20-000012	4	0001457812	028-15257			TITAN PARTNERS LP
0000051964-20-000011	1	0000796370	028-11931			BrightSphere Inc.
0000950123-20-007820	3					Michele Ollier
0000950123-20-007820	1					Francesco De Rubertis
0000950123-20-007820	2					Kevin Stuart Johnson
0001085146-20-002052	1	0001053994	028-12760			SANDERS MORRIS HARRIS LLC
0000036104-20-000022	5	0000786393	028-16147			U.S. BANCORP INVESTMENTS, INC.
0000036104-20-000022	1	0000830013	028-02267			US BANK NATIONAL ASSOCIATION
0001085146-20-002048	1	0000837592	028-02354			CRAWFORD INVESTMENT COUNSEL INC
0001085146-20-002048	6	0001048703	028-11445			Karpus Management, Inc.
0001085146-20-002048	5	0001072843	028-07360			First Fiduciary Investment Counsel, Inc.
0001085146-20-002048	2	0001034524	028-03687			POLEN CAPITAL MANAGEMENT LLC
0001085146-20-002048	3	0001631353	028-16362			Dakota Wealth Management
0001085146-20-002048	4	0001076598	028-04139			EATON VANCE MANAGEMENT
0001172661-20-001598	1	0001681639	028-17489			Coronation Investment Management International (Pty) Ltd
0000950123-20-007771	2		28-10508			RSUI Indemnity Company
0000950123-20-007771	3		28-06459			Alleghany Insurance Holdings LLC
0000950123-20-007771	4		28-15020			Transatlantic Reinsurance Company
0000950123-20-007771	5		28-16393			Roundwood Asset Management LLC
0001172661-20-001594	1	0001623378	028-16283			Paradice Investment Management Pty Ltd
0001082917-20-000006	3		028-10981			Goldman Sachs Asset Management
0001082917-20-000006	2		028-14465			Mercer Trust Co
0001082917-20-000006	1		028-11395			AMG FUNDS LLC
0001567619-20-014396	2	0001591068	028-17877			VIRTUS ALTERNATIVE INVESTMENT ADVISERS, INC.
0001567619-20-014396	1	0000019481	028-00085			Virtus Investment Advisers, Inc.
0001049050-20-000003	1	0001278610	028-10850			STRACHAN STEPHEN M
0001049050-20-000003	2	0001389038	028-12349			Seitz Charles E III
0000950123-20-007754	1		028-14012			FNB Investment Advisors, Inc
0001531879-20-000009	3	0001546085	028-14939			Teilinger Investments SA
0001531879-20-000009	2	0001535984	028-14632			Vitol Holding SARL
0001531879-20-000009	1	0001546531	028-14937			Vitol Holding B.V.
0001606587-20-000853	1	0000874791	028-02903			CAMPBELL NEWMAN ASSET MANAGEMENT INC
0001567619-20-014376	1	0001577920	028-15534			Veritas Investment Management (UK) Ltd
0000053417-20-000073	2		028-13416			Prudential Trust Company
0000053417-20-000073	1		028-10077			Prudential Financial Inc
0001166588-20-000003	1	0001197610				BNP PARIBAS SECURITIES CORP
0001166588-20-000003	2	0000872786				BNP PARIBAS
0001387131-20-007090	1	0001542292	028-14796			Contrarius Investment Management (Bermuda) Ltd
0001172661-20-001590	2	0001452938	028-13290			VALINOR CAPITAL PARTNERS OFFSHORE MASTER FUND, L.P.
0001172661-20-001590	1	0001401387	028-12749			VALINOR CAPITAL PARTNERS, L.P.
0001104659-20-091205	1	0000020286	028-10798			CINCINNATI FINANCIAL CORP
0001104659-20-091201	1	0000020286	028-10798			CINCINNATI FINANCIAL CORP
0001104659-20-091199	1	0000020286	028-10798			CINCINNATI FINANCIAL CORP
0001104659-20-091197	1	0000020286	028-10798			CINCINNATI FINANCIAL CORP
0001104659-20-091195	1	0000020286	028-10798			CINCINNATI FINANCIAL CORP
0001760472-20-000003	3					Essex
0001760472-20-000003	1					Dana Investments
0001760472-20-000003	2					Eaton Vance
0001760472-20-000003	4					Gardner Russo Gardner
0001760472-20-000003	5					Mittleman
0001760472-20-000003	6					Parametric
0001760472-20-000003	7					Toth Advisory
0001763608-20-000003	3					City National Rochdale
0001763608-20-000003	2					Assetmark
0001763608-20-000003	1					Clark Capital
0000740913-20-000009	1	0001587281	028-17301			Virtus ETF Advisers LLC
0000950123-20-007731	1		28-13582			MITSUBISHI UFJ FINANCIAL GROUP INC
0000950123-20-007731	2		28-13564			MITSUBISHI UFJ TRUST & BANKING CORP
0000950123-20-007727	1		28-13582			Mitsubishi UFJ Financial Group, Inc.
0001085146-20-002027	1	0000867626	028-19447			MUFG SECURITIES AMERICAS INC.
0001085146-20-002027	2	0000067088	028-13582			MITSUBISHI UFJ FINANCIAL GROUP INC
0001085146-20-002027	3	0000852743	028-05836			MUFG Bank, Ltd.
0001085146-20-002027	4	0001084706	028-04663			HIGHMARK CAPITAL MANAGEMENT INC/CA
0001085146-20-002027	5	0000016287	028-04661			MUFG Union Bank, N.A.
0001085146-20-002025	6					Schafer
0001085146-20-002025	5					Parametric
