0001104659-20-095300	1	0001611388	028-18063			SC U.S. GROWTH VI MANAGEMENT, L.P.
0001104659-20-095300	8	0001743989	028-20068			SC Global Growth II Management, L.P.
0001104659-20-095300	2	0001447940	028-15205			SCGF IV MANAGEMENT LP
0001688519-20-000003	4	0000812295				JANUS CAPITAL MANAGEMENT LLC
0001688519-20-000003	3	0000790502				EAGLE ASSET MANAGEMENT INC
0001688519-20-000003	2	0000872259				BAHL & GAYNOR INC
0001688519-20-000003	1	0000860644				Aristotle Capital Management, LLC
0001688519-20-000003	12	0001207017				LAZARD ASSET MANAGEMENT LLC
0001688519-20-000003	11	0000350797				EATON VANCE CORP
0001688519-20-000003	10	0000900973				Winslow Capital Management, LLC
0001688519-20-000003	9	0001599511				Tortoise Investment Management, LLC
0001688519-20-000003	8	0001259887				LONDON CO OF VIRGINIA
0001688519-20-000003	5	0001106012				NFJ INVESTMENT GROUP LLC
0001688519-20-000003	6	0001539852				PARAMETRIC DEFENSIVE EQUITY FUND LLC
0001688519-20-000003	7	0000932859				PARAMETRIC PORTFOLIO ASSOCIATES LLC
0001172661-20-001781	1	0001767843	028-19315			MIROVA
0001572748-20-000006	1	0001633121	028-16521			Marathon Trading Group LLC
0001606779-20-000001	4	0001568131	028-15112			Baring International Investment Ltd
0001606779-20-000001	5	0001803230	028-20060			Baring SICE (Taiwan) LTD
0001606779-20-000001	2	0001606780	028-19111			Baring Asset Management Korea Ltd
0001606779-20-000001	3	0001606779	028-16289			BARING ASSET MANAGEMENT Ltd
0001606779-20-000001	1	0001624302	028-16290			BARING ASSET MANAGEMENT (ASIA) Ltd
0001062993-20-003987	2	0000081273	028-00090			PUTNAM INVESTMENT MANAGEMENT LLC
0001062993-20-003987	1	0000081238	028-00092			PUTNAM ADVISORY CO LLC
0000919574-20-005307	1	0001364411	028-13041			H PARTNERS, LP
0000919574-20-005307	2	0001439712	028-14314			H OFFSHORE FUND, LTD.
0001104659-20-095283	1	0001520339	028-14458			MTP Energy Management LLC
0001172661-20-001770	1	0001731531	028-18620			Moab Private Investments, L.P.
0001085146-20-002275	1	0001764134	028-19246			Emerson Point Capital Long Short LLC
0000720672-20-000007	5	0001135986	028-06397			Stifel Trust Company, N.A.
0000720672-20-000007	3	0001483835	028-13699			Century Securities Associates, Inc.
0000720672-20-000007	6	0001592412	028-16086			Stifel Trust Co Delaware, N.A.
0000720672-20-000007	7	0001725950	028-19513			Washington Crossing Advisers LLC
0000720672-20-000007	1	0000948905	028-06972			STIFEL NICOLAUS & CO INC \MO\
0000720672-20-000007	4	0001324943	028-11345			1919 Investment Counsel, LLC
0000720672-20-000007	2	0001442676	028-13156			EquityCompass Investment Management
0001085146-20-002270	1	0001591766	028-15644			KEY GROUP HOLDINGS USA INC.
0000950123-20-008914	3		028-16270			Brookfield Asset Management Private Institutional Capital Adviser US, LLC
0000950123-20-008914	6		028-17298			Brookfield Asset Management Private Institutional Capital Adviser (Private Equity), LLC
0000950123-20-008914	4		028-16296			Brookfield Asset Management Private Institutional Capital Adviser (Credit), LLC
0000950123-20-008914	5		028-14362			Brookfield Asset Management Private Institutional Capital Adviser (Canada), LLC
0000950123-20-008914	2		028-20008			Brookfield BHS Advisors LLC
0000950123-20-008914	1		028-13826			Brookfield Public Securities Group LLC
0001085146-20-002266	4	0001492224	028-13965			Jefferies Investment Advisers, LLC
0001085146-20-002266	2	0001697634	028-17885			Leucadia Investment Management Ltd
0001085146-20-002266	1	0001265287	028-13184			JEFFERIES LLC
0001085146-20-002266	5	0001681904	028-17499			Jefferies Financial Products, LLC
0001696778-20-000004	1	0001578299	028-17749			DLD Asset Management, LP
0000950123-20-008911	1		028-17846			Precept Capital Management, L.P.
0001172661-20-001754	1	0001456506	028-13417			Alyeska Master Fund, L.P.
0001172661-20-001754	2	0001775953	028-19522			Alyeska Master Fund 3, L.P.
0000919574-20-005282	4	0001622934	028-19271			COATUE PRIVATE FUND II LP
0000919574-20-005282	3	0001755729	028-19270			COATUE PRIVATE FUND I LP
0000919574-20-005282	2	0001633822	028-16615			Coatue Long Only Offshore Master Fund Ltd
0000919574-20-005282	1	0001664809	028-17315			COATUE OFFSHORE MASTER FUND LP
0000919574-20-005282	5	0001802767	028-20004			Coatue Quant Master Fund LP
0000950123-20-008902	1		028-19296			EnerVest Investment Services, L.L.C.
0001172661-20-001749	1	0001074026	028-07384			BOHRER NATHANIEL
0001172661-20-001749	2	0001080371	028-04407			KELLNER MARJORIE GOCHBERG
0000919574-20-005278	1	0001220336	028-16563			SIMCOE PARTNERS L P
0000950123-20-008896	24		028-15071			Allianz Global Investors Taiwan Ltd.
0000950123-20-008896	25		028-17306			Allianz Global Investors Japan Co. Ltd.
0000950123-20-008896	21		028-14962			Allianz Global Investors GmbH
0000950123-20-008896	20		028-15015			Allianz Global Investors Asia Pacific Ltd
0000950123-20-008896	17		028-13991			Allianz Global Investors U.S. LLC
0000950123-20-008896	4		028-10952			Pacific Investment Management Company LLC
0001085146-20-002261	2	0001561248	028-15064			Taconic Capital Advisors (Hong Kong) Ltd
0001085146-20-002261	1	0001390110	028-12491			Taconic Capital Advisors UK LLP
0001772937-20-000003	1	0001772938	028-19461			TPWM Services, Inc.
0001772937-20-000003	2	0001692067	028-19462			Tolleson Private Wealth Management, LP
0001085146-20-002260	1	0001390110	028-12491			Taconic Capital Advisors UK LLP
0001085146-20-002260	2	0001561248	028-15064			Taconic Capital Advisors (Hong Kong) Ltd
0001085146-20-002259	2	0001561248	028-15064			Taconic Capital Advisors (Hong Kong) Ltd
0001085146-20-002259	1	0001390110	028-12491			Taconic Capital Advisors UK LLP
0001085146-20-002258	1	0001390110	028-12491			Taconic Capital Advisors UK LLP
0001085146-20-002258	2	0001561248	028-15064			Taconic Capital Advisors (Hong Kong) Ltd
0001785546-20-000001	1	0001607635	028-16153			CMT Global Holdings LLC
0001085146-20-002257	1	0001390110	028-12491			Taconic Capital Advisors UK LLP
0001085146-20-002257	2	0001561248	028-15064			Taconic Capital Advisors (Hong Kong) Ltd
0001172661-20-001746	1	0001730897	028-18516			Glen Point Capital Advisors LP
0001593387-20-000004	1	0001800938	028-19841			One Charles Private Wealth Services, LLC
0001387131-20-007494	1	0001454027	028-13309			Verition Fund Management LLC
0001736225-20-000003	1	0001802856	028-20054			Pythagorean Trading, LLC
0001172661-20-001744	1	0001169486	028-14109			TOKIO MARINE HOLDINGS, INC.
0001085146-20-002255	2	0001263567	028-10527			Perkins Investment Management, LLC
0001085146-20-002255	4	0001280110	028-10906			HENDERSON GLOBAL INVESTORS LTD
0001085146-20-002255	9	0001086318	028-04211			INTECH INVESTMENT MANAGEMENT LLC
0001085146-20-002255	10	0000812295	028-01343			JANUS CAPITAL MANAGEMENT LLC
0001085146-20-002255	11	0001794678	028-20157			Janus Henderson Investors (Australia) Institutional Funds Management Ltd
0001085146-20-002255	12	0001810753	028-20257			Janus Henderson Investors (Singapore) Ltd
0000712537-20-000022	1		28-11893			First Commonwealth Bank
0001616416-20-000008	4	0001633064				Bardin Hill Arbitrage IC Management LP
0001616416-20-000008	1	0001633312				Bardin Hill Investment Partners LP
0001616416-20-000008	2	0001633067				Bardin Hill Arbitrage Management LP
0001616416-20-000008	3	0001730418				Bardin Hill Arbitrage UCITS Management LP
0001214659-20-007100	2	0001214717	028-10386			GEODE CAPITAL MANAGEMENT, LLC
0001214659-20-007100	1	0000932859	028-04558			PARAMETRIC PORTFOLIO ASSOCIATES LLC
0001632813-20-000002	1	0001607635	028-16153			CMT Global Holdings LLC
0001632813-20-000002	2	0001776936	028-19536			CMT GmbH Holdings LLC
0001606720-20-000007	1	0001133639	028-06325			NEW YORK LIFE INVESTMENT MANAGEMENT LLC
0001606720-20-000007	2	0001415996	028-13712			IndexIQ Advisors LLC
0001172661-20-001731	1	0001632354	028-16640			Hitchwood Capital LLC
0001283072-20-000015	4		28-18657			Guggenheim Life & Annuity Co
0001283072-20-000015	5		28-11097			GUGGENHEIM FUNDS INVESTMENT ADVISORS, LLC
0001283072-20-000015	2		28-01689			SECURITY INVESTORS LLC
0001283072-20-000015	3		28-12837			Guggenheim Partners Investment Management, LLC
0001283072-20-000015	1		28-12550			GUGGENHEIM FUNDS DISTRIBUTORS, LLC
0001062993-20-003976	1	0001430089	028-15564			Selkirk Partners, LP
0001172661-20-001726	1	0001633019	028-17204			Capula Investment US LP
0001172661-20-001726	2	0001351450	028-17757			Capula Investment Management LLP
0001172661-20-001722	1	0001544730	028-15968			First Reserve GP XII, LP
0001172661-20-001720	1	0001477478	028-14889			First Reserve GP XI, L.P.
0000918537-20-000003	1	0001105685	028-05359			MFP INVESTORS LLC
0000914208-20-000401	3		028-12270			Invesco Trust Co.
0000914208-20-000401	4					Invesco Hong Kong Limited
0000914208-20-000401	5					Invesco Asset Management Deutschland GmbH
0000914208-20-000401	6		028-05683			Invesco Asset Management Ltd
0000914208-20-000401	1		028-00255			Invesco Advisers, Inc.
0000914208-20-000401	11					Invesco Asset Management Japan Limited
0000914208-20-000401	13					Invesco Australia Ltd.
0000914208-20-000401	14		028-11365			Invesco Investment Advisers, LLC
0000914208-20-000401	15		028-11936			Invesco Capital Management LLC
0000914208-20-000401	2		028-06137			Invesco Canada Ltd
0000914208-20-000401	9					Invesco Management S.A.
0001719165-20-000005	1	0001731572	028-18614			Accent Partners LLC
0001728194-20-000003	8	0001081698	028-13218			HEIGHTS CAPITAL MANAGEMENT, INC
0001728194-20-000003	12	0001649553	028-17822			CVI Investments, Inc.
0000919574-20-005241	2	0001555042	028-15272			MANOR ROAD INVESTMENT PARTNERS, LP
0000919574-20-005241	1	0001555043	028-15270			MANOR ROAD INVESTMENT PARTNERS II, LP
0000902664-20-003033	1	0001454288	028-13317			ARROWGRASS CAPITAL PARTNERS (US) LP
0001085146-20-002238	4	0001542162	028-14797			Signature Financial Management, Inc.
0001085146-20-002238	1	0001079817	028-04859			BROWN INVESTMENT ADVISORY & TRUST CO
0001085146-20-002238	2	0001114667	028-05775			Brown Advisory LLC
0001085146-20-002238	3	0001742040	028-18857			Brown Advisory Ltd
0000950123-20-008864	1		028-18606			Newton (PTC) Ltd
0000950123-20-008864	2		028-18610			Orland Properties Ltd
0000950123-20-008862	1		028-15594			1922 Investments Holdings Partners LP
0000950123-20-008862	2		028-15596			1922 Investments GP LLC
0000950123-20-008862	3		028-15595			1922 Trust
0001141802-20-000010	1	0000073076	028-00229			NORTHWESTERN MUTUAL LIFE INSURANCE CO
0001455468-20-000004	1		028-13158			Legato Capital Management LLC
0001446194-20-000010	1	0000918950	028-13224			SUSQUEHANNA INVESTMENT GROUP
0001446194-20-000010	11	0001136305	028-16683			G1 EXECUTION SERVICES, LLC
0001446194-20-000010	10	0001628277	028-16682			CVI Opportunities Fund I, LLLP
0001446194-20-000010	7	0001444949	028-13217			SUSQUEHANNA ADVISORS GROUP, INC.
0001446194-20-000010	2	0001446580	028-13221			SUSQUEHANNA SECURITIES, LLC
0001446194-20-000010	5	0001011712	028-13219			CAPITAL VENTURES INTERNATIONAL
0000919574-20-005237	1	0001734681	028-18701			KL Special Opportunities Master Fund Ltd.
0000950123-20-008852	2		028-17317			DST Global Advisors Ltd
0000950123-20-008852	3		028-15373			DST Managers Ltd
0000950123-20-008852	1		028-18613			Cardew Services Ltd
0000919574-20-005235	2	0001458862	028-18769			Contrarian Emerging Markets, L.P.
0000919574-20-005235	3	0001739720	028-18768			BOSTON PATRIOT SUMMER ST LLC
0000919574-20-005235	1	0001022373	028-15262			CONTRARIAN CAPITAL FUND I LP
0000950123-20-008849	2					Calibrium Management Company S.A.
0000950123-20-008849	1					Calibrium AG
0001398344-20-015823	1		028-15501			PROSPECTOR FUNDS, INC.
0001085146-20-002234	1	0001048802	028-06550			OSTERWEIS CAPITAL MANAGEMENT LLC/CA
0001085146-20-002232	1	0001789219	028-19636			Charles Schwab Trust Co
0001085146-20-002231	1	0001789219	028-19636			Charles Schwab Trust Co
0000895421-20-000454	10	0001399427	028-12509			Morgan Stanley Strategic Investments, Inc
0000895421-20-000454	1	0000924186	028-04312			MORGAN STANLEY & CO INTERNATIONAL PLC
0000895421-20-000454	2	0001359291	028-11873			MORGAN STANLEY & CO. LLC
0000895421-20-000454	14	0001767825	028-19344			Morgan Stanley Wealth Management Australia Pty Ltd
0000895421-20-000454	13	0001767823	028-19343			Morgan Stanley Asia Ltd
0000895421-20-000454	12	0001599632	028-15873			Fundlogic Sas
0000895421-20-000454	11	0001340040	028-11533			Morgan Stanley Uruguay Ltda.
0000895421-20-000454	9	0001466170	028-13935			MORGAN STANLEY SMITH BARNEY LLC
0000895421-20-000454	8	0001358504	028-11867			Morgan Stanley Investment Management LTD
0000895421-20-000454	7	0001230193	028-11866			MORGAN STANLEY INVESTMENT MANAGEMENT INC
0000895421-20-000454	3	0001442737	028-13197			Morgan Stanley Canada LTD
0000895421-20-000454	4	0001358269	028-11865			Morgan Stanley Capital Services LLC
0000895421-20-000454	5	0001230207	028-14710			MORGAN STANLEY AIP GP LP
0000895421-20-000454	6	0001270238	028-11366			MORGAN STANLEY INVESTMENT MANAGEMENT CO
0000919574-20-005224	1	0001737513	028-18883			Redwood Capital Management Holdings, LP
0001172661-20-001694	1	0001632494	028-17968			Internal server error. CIK may be invalid.
0001461539-20-000009	1	0001486066	028-16582			Sawtooth Solutions, LLC
0001507673-20-000008	1	0001507678	028-19630			Legorreta Pablo G.
0001172661-20-001691	1	0001767558	028-19374			London & Capital Wealth Advisers Ltd
0000919574-20-005219	2	0001722659	028-18484			Long Meadow, L.P.
0000919574-20-005219	1	0001448009	028-13775			FRESHFORD PARTNERS LP
0001629649-20-000004	1	0000073076	028-00229			NORTHWESTERN MUTUAL LIFE INSURANCE CO
0000007789-20-000056	1		28-20327			Associated Trust Company, National Association
0000007789-20-000056	2		28-15153			Whitnell & Co
0000093751-20-000921	12	0001324598	028-11331			State Street Global Advisors Asia LTD
0000093751-20-000921	13	0001324597	028-11334			State Street Global Advisors GmbH
0000093751-20-000921	19	0001520010	028-14459			State Street Global Advisors Ireland Ltd
0000093751-20-000921	20	0001714343	028-18135			State Street Global Advisors Trust Co
0000093751-20-000921	1	0000093748	028-00733			STATE STREET BANK & TRUST CO
0000093751-20-000921	2	0001257442	028-11338			SSGA FUNDS MANAGEMENT INC
0000093751-20-000921	5	0001324602	028-11326			State Street Global Advisors LTD
0000093751-20-000921	6	0001324601	028-11327			State Street Global Advisors Ltd.
0000093751-20-000921	8	0001324595	028-11330			State Street Global Advisors, Australia
0000093751-20-000921	10	0001324600	028-11332			State Street Global Advisors (Japan) Co., Ltd.
0000093751-20-000921	11	0001324599	028-18493			State Street Global Advisors Singapore LTD
0001167711-20-000006	1	0000073076	028-00229			NORTHWESTERN MUTUAL LIFE INSURANCE CO
0000312348-20-000023	2		028-13087			Loomis Sayles Trust Company, LLC
0001451623-20-000003	1	0001451623	028-19533			BENJAMIN EDWARDS INC
0001567619-20-015238	1	0000704051	028-01700			LEGG MASON, INC.
0001567619-20-015235	1	0000704051	028-01700			LEGG MASON, INC.
0001567619-20-015233	1	0001768021	028-19326			Scion Asset Partners, LP
0001567619-20-015233	2	0001768023	028-19327			Scion Capital Group, LLC
0000902664-20-003024	3	0001511305	028-15284			Polygon Global Partners LP
0000902664-20-003024	1	0001511278	028-15282			TFG Asset Management L.P.
0000902664-20-003024	2	0001511306	028-15285			Polygon Global Partners LLP
0001567619-20-015230	1	0000704051	028-01700			LEGG MASON, INC.
0001567619-20-015229	2	0001576841	028-15488			Palisades Safety & Insurance Association
0001567619-20-015229	1	0001556246	028-15035			Plymouth Rock Co Inc
0000919574-20-005209	1	0001572706	028-15489			Okumus Opportunistic Value Fund Ltd.
0001405086-20-000251	6	0001613152	028-17831			Avenue Energy Opportunities Fund, L.P.
0001405086-20-000251	7	0001689110	028-17832			AVENUE ENERGY OPPORTUNITIES PARTNERS, LLC
0001405086-20-000251	8	0001689135	028-17833			GL ENERGY OPPORTUNITIES PARTNERS, LLC
0001405086-20-000251	4	0001541852	028-14820			Avenue Capital Partners VI, LLC
0001405086-20-000251	3	0001541853	028-14819			Avenue Special Situations Fund VI (Master), L.P.
0001405086-20-000251	2	0001317338	028-11224			Avenue Capital Management II, L.P.
0001405086-20-000251	1	0001389850	028-12377			Avenue Capital Management II GenPar, LLC
0001405086-20-000251	5	0001541856	028-14823			GL Partners VI, LLC
0001567619-20-015223	1	0000704051	028-01700			LEGG MASON, INC.
0001567619-20-015220	1	0001675772	028-18491			Blue Pool Capital Ltd
0000902219-20-000422	1		028-16899			Wellington Management Company LLP
0000902219-20-000422	5		028-16901			Wellington Management Singapore Pte. Ltd.
0000902219-20-000422	9					Wellington Management Europe GmbH
0000902219-20-000422	8					Wellington Management Australia Ltd
0000902219-20-000422	6		028-16902			Wellington Management International Ltd
0000902219-20-000422	7					Wellington Trust Company, NA
0000902219-20-000422	2		028-16903			Wellington Managment Canada LLC
0000902219-20-000422	3		028-16904			Wellington Management Hong Kong Ltd
0000902219-20-000422	4		028-16900			Wellington Management Japan Pte Ltd
0001567619-20-015208	1	0000704051	028-01700			LEGG MASON, INC.
0001567619-20-015208	2	0001505598	028-14026			EnTrust Global Ltd.
0001420506-20-000942	2	0001615293	028-16239			Lombard Odier (Europe) S.A.
0001420506-20-000942	1	0001106185	028-16234			Bank Lombard Odier & Co Ltd
0000950123-20-008828	10		028-10644			Threadneedle Asset Management Holdings LTD
0000950123-20-008828	2		028-10477			Columbia Management Investment Advisers, LLC
0000950123-20-008828	4		028-00140			Ameriprise Certificate Co
0000950123-20-008828	5		028-00143			RiverSource Life Insurance Co
0000950123-20-008828	6		028-10460			RiverSource Life Insurance Co of New York
0000950123-20-008828	18		028-18942			Ameriprise Bank, FSB
0000950123-20-008828	17		028-03639			Columbia Wanger Asset Management, LLC.
0000950123-20-008828	16		028-14918			Ameriprise Financial Services, Inc.
0000950123-20-008828	3		028-10458			Ameriprise Trust Co
0001387303-20-000007	2	0001387300	028-12267			Moon John W
0001387303-20-000007	1	0001387302	028-12268			JWM Capital LLC
0001567619-20-015204	3	0001034882	028-06256			MARTIN CURRIE INVESTMENT MANAGEMENT LTD
0001567619-20-015204	2	0001034883	028-06254			MARTIN CURRIE INC
0001567619-20-015204	1	0000704051	028-01700			LEGG MASON, INC.
0000950103-20-015800	2	0001393014	028-18537			Angelakis Michael J
0000950103-20-015800	1	0001671185	028-18540			Atairos Partners, L.P.
0001567619-20-015202	1					Miscellaneous
0001567619-20-015201	1	0000704051	028-01700			LEGG MASON, INC.
0001567619-20-015197	1	0000704051	028-01700			LEGG MASON, INC.
0000950159-20-000202	1	0001512538	028-14173			New Vernon Capital Holdings II LLC
0001420506-20-000925	1	0001374606	028-13678			RMCP GP LLC
0001420506-20-000925	3	0001688393	028-17813			RMCP DPC LLC
0001420506-20-000925	2	0001628461	028-16591			RMCP MANAGER LLC
0001323255-20-000009	1	0000918509	028-04817			STICHTING PENSIOENFONDS ABP
0001323255-20-000009	2	0001434820	028-13073			APG Group
0001323255-20-000009	3	0001434819	028-13074			APG Asset Management N.V.
0001434819-20-000012	2	0001434820	028-13073			APG Group
0001434819-20-000012	1	0000918509	028-04817			STICHTING PENSIOENFONDS ABP
0001661140-20-000003	1	0001536054	028-14917			Crestline Management, LP
0000921895-20-002237	1	0001802834	028-19984			Squire Kenneth
0001677044-20-000024	11	0001056102				SECURITIES AMERICA ADVISORS INC
0001677044-20-000024	99	0001681113				VISION2020 WEALTH MANAGEMENT CORP.
0001677044-20-000024	8	0000225478				WOODBURY FINANCIAL SERVICES, INC.
0001677044-20-000024	6	0001362424				FSC SECURITES, INC.
0001677044-20-000024	2	0001421628				SAGEPOINT FINANCIAL, INC.
0001677044-20-000024	1	0001043187				ROYAL ALLIANCE ASSOCIATES, INC.
0001677044-20-000024	17	0001722474				TRIAD ADVISORS, LLC
0001677044-20-000024	18	0001722470				INVESTACORP ADVISORY SERVICES, INC.
0001677044-20-000024	12	0001483964				LADENBURG THALMANN ASSET MANAGEMENT
0001677044-20-000024	13	0001580308				KMS FINANCIAL SERVICES, INC
0001677044-20-000024	14	0001642036				ARBOR POINT ADVISORS, LLC
0001677044-20-000024	15	0001642257				SSN Advisory, Inc.
0001677044-20-000024	16	0001682267				TRIAD HYBRID SOLUTIONS, LLC
0001085601-20-000004	1	0001645764	028-19429			LaSalle Investment Management
0001387131-20-007469	1	0001536054	028-14917			Crestline Management, LP
0000764068-20-000009	4	0001495115	028-13969			Legal & General Investment Management Ltd
0000764068-20-000009	3	0001559265	028-15066			Legal & General Investment Management America Inc
0000764068-20-000009	2	0001759318	028-18955			Legal & General Investment Management ASIA Ltd
0000764068-20-000009	1	0001738063	028-18791			GO ETF SOLUTIONS LLP
0000950123-20-008806	1		028-12230			ALPS Advisers, Inc.
0000950123-20-008806	2		028-04129			Weatherbie Capital, LLC
0001633050-20-000003	1	0001547676	028-16445			Swedbank Robur Fonder AB
0001104659-20-095098	5	0001680208	028-20272			VANGUARD ASSET MANAGEMENT, Ltd
0001104659-20-095098	4	0001811242	028-20273			Vanguard Global Advisers, LLC
0001104659-20-095098	3	0000947529	028-16887			VANGUARD ADVISERS INC
0001104659-20-095098	2	0001550100	028-14986			Vanguard Investments Australia, Ltd.
0001104659-20-095098	1	0000933478	028-11554			VANGUARD FIDUCIARY TRUST CO
0001104659-20-095096	1	0001433766	028-13502			Mintz Hal
0001062993-20-003961	1					Broken Clock Management LLC
0001062993-20-003961	2					Arbiter Partners QP LP
0001062993-20-003961	3					Arbiter Partners LP
0001062993-20-003961	4					Arbiter Partners Offshore LTD
0001567619-20-015174	1	0001103882	028-05431			Paloma Partners Management Co
0001446114-20-000047	2	0001517638				Clutterbuck Capital Management LLC
0001446114-20-000047	1	0001657660	028-17014			ANCORA FAMILY WEALTH ADVISORS, LLC
0001424367-20-000009	5		028-16916			Voya Financial, Inc
0001010911-20-000010	1		028-13976			Stewart Capital Advisors, LLC
0001068837-20-000006	3		028-04547			Voya Investments, LLC
0001068837-20-000006	5		028-16916			Voya Financial, Inc
0001068837-20-000006	2		028-10070			Voya Investment Trust Co.
0001068837-20-000006	1		028-01217			Voya Investment Management Co. LLC
0001567619-20-015164	1	0000845563	028-02405			COHEN & STEERS CAPITAL MANAGEMENT INC
0001567619-20-015164	2	0001581798	028-15583			Cohen & Steers UK Ltd
0000950123-20-008777	1		28-18476			Bain Capital Life Sciences Partners, LP
0000950123-20-008777	3		28-20270			BC SW, LP
0000950123-20-008777	2		28-18478			Bain Capital Life Sciences Fund, LP
0000950123-20-008769	3		28-19238			Bain Capital Venture Coinvestment Partners, L.P.
0000950123-20-008769	1		28-19237			Bain Capital Venture Partners 2014, L.P.
0000950123-20-008769	4		28-19236			Bain Capital Venture Coinvestment Fund, L.P.
0000950123-20-008769	2		28-19235			Bain Capital Venture Fund 2014, L.P.
0000950123-20-008768	2		28-15509			Bain Capital Fund X, L.P.
0000950123-20-008768	15		28-18475			BCPE Seminole Holdings L.P.
0000950123-20-008768	14		28-18474			BCPE Seminole GP LLC
0000950123-20-008768	13		28-16750			Atalaya Luxco PIKco S.C.A
0000950123-20-008768	12		28-16792			Atalaya PIKco S.a r.l.
0000950123-20-008768	11		28-16798			Atalaya Luxco Topco S.C.A.
0000950123-20-008768	10		28-16793			Atalaya Luxco S.a.r.l.
0000950123-20-008768	9		28-16335			Glory Investments B Limited
0000950123-20-008768	8		28-16334			Glory Investments A Limited
0000950123-20-008768	7		28-16333			Bain Capital Partners Asia II, L.P.
0000950123-20-008768	6		28-14482			Bain Capital Integral Investors 2006, LLC
0000950123-20-008768	5		28-16251			Bain Capital Europe Fund III, L.P.
0000950123-20-008768	1		28-15506			Bain Capital Partners X, L.P.
0000950123-20-008768	3		28-15576			Bain Capital Integral Investors 2008, L.P.
0000950123-20-008768	4		28-16250			Bain Capital Partners Europe III, L.P.
0001398344-20-015773	2		028-00290			Northern Trust Corp
0001398344-20-015773	1		028-12230			ALPS ADVISORS INC
0001104659-20-095033	1	1697506				Energy Capital Partners GP III, LP
0001104659-20-095033	2	1621292				ENERGY CAPITAL PARTNERS III, LLC
0000950123-20-008750	2		028-16475			SEI Investments Management Corporation
0000950123-20-008750	1		028-11405			Nuveen Investments, Inc.
0001633046-20-000006	2	0001796861	028-20020			Maven Investment Partners US Ltd
0001633046-20-000006	1	0001759004	028-18941			Maven Investment Partners Ltd
0001683168-20-002696	1	0000354190	028-14530			Arthur J. Gallagher & Co.
0001683168-20-002696	2	0001527782	028-14532			Gallagher Benefit Services, Inc.
0000950123-20-008741	1		028-12592			The Bank of New York Mellon Corporation
0001387131-20-007433	1	0001536054	028-14917			Crestline Management, LP
0000950123-20-008731	1					Sumitomo Mitsui Banking Corporation
0000950123-20-008731	2					SMBC Trust Bank Ltd.
0001749768-20-000011	1	0001428948				Impax Asset Management LTD
0001749768-20-000011	2	0001634155				Impax Asset Management (AIFM) Ltd
0001749768-20-000011	3	0001127990				IMPAX ASSET MANAGEMENT LLC
0001749768-20-000011	4	0001616658				Pax Ellevate Management LLC
0000950123-20-008726	2		028-19255			SV Life Sciences Fund VI (GP), L.P.
0000950123-20-008726	1		028-19256			SVLSF VI, LLC
0000950123-20-008724	6		028-00331			Teachers Insurance & Annuity Association of America
0000950123-20-008724	1		028-11405			Nuveen Investments, Inc.
0000950123-20-008724	5		028-11405			Santa Barbara Asset Management, LLC
0000950123-20-008724	2		028-11710			Nuveen Fund Advisors, LLC
0000950123-20-008724	3		028-03194			TIAA-CREF Investment Management, LLC
0000950123-20-008724	4		028-04800			Teachers Advisors, LLC
0001665077-20-000006	1					Sand Grove Capital Management (Delaware) LP
0000950123-20-008710	1					Villanova Investment Management Company LLC
0001104659-20-094934	2		028-12556			V. Prem Watsa
0001104659-20-094934	1		028-12555			Hamblin Watsa Investment Counsel Ltd.
0001104659-20-094911	21		028-13090			Temasek Capital (Private) Ltd
0001104659-20-094911	22		028-15907			Temasek Life Sciences Private Ltd
0001104659-20-094911	23		028-14163			Tembusu Capital Pte. Ltd.
0001104659-20-094911	24		028-15195			Thomson Capital Pte. Ltd.
0001104659-20-094911	25		028-19223			TLS Beta Pte. Ltd.
